,"""About the data: Exported on Nov 01, 2019. Criteria: Researcher is Alyson E Santoro. © 2019 Digital Science and Research Solutions Inc. All rights reserved. Unless otherwise agreed, redistribution / external use of this work is not permitted.""
",Unnamed: 1,Unnamed: 2,Unnamed: 3,Unnamed: 4,Unnamed: 5,Unnamed: 6,Unnamed: 7,Unnamed: 8,Unnamed: 9,Unnamed: 10,Unnamed: 11,Unnamed: 12,Unnamed: 13,Unnamed: 14,Unnamed: 15,Unnamed: 16,Unnamed: 17,Unnamed: 18,Unnamed: 19,Unnamed: 20,Unnamed: 21,Unnamed: 22,Unnamed: 23,Unnamed: 24,Unnamed: 25,Unnamed: 26,Unnamed: 27,Unnamed: 28,Unnamed: 29,Unnamed: 30
0,Rank,Publication ID,DOI,PMID,PMCID,Title,Source title,Anthology title,MeSH terms,Publication Date,PubYear,Volume,Issue,Pagination,Open Access,Publication Type,Authors,Corresponding Author,Authors Affiliations,Times cited,Recent citations,RCR,FCR,Source Linkout,Dimensions URL,FOR (ANZSRC) Categories,FOR 1,FOR 2,FOR 3,FOR 4,FOR 5
1,500,pub.1106013868,10.1111/jeu.12679,30080299,,"A Revised Taxonomy of Diplonemids Including the Eupelagonemidae n. fam. and a Type Species, Eupelagonema oceanica n. gen. & sp.",Journal of Eukaryotic Microbiology,,,2019-05,2019,66,3,519-524,Closed,Article,"Okamoto, Noriko; Gawryluk, Ryan M.R.; Campo, Javier; Strassert, Jürgen F.H.; Lukeš, Julius; Richards, Thomas A.; Worden, Alexandra Z.; Santoro, Alyson E.; Keeling, Patrick J.",,"Okamoto, Noriko (University of British Columbia); Gawryluk, Ryan M.R. (University of British Columbia); Campo, Javier (University of British Columbia); Strassert, Jürgen F.H. (University of British Columbia); Lukeš, Julius (); Richards, Thomas A. (University of Exeter); Worden, Alexandra Z. (Monterey Bay Aquarium Research Institute); Santoro, Alyson E. (University of California, Santa Barbara); Keeling, Patrick J. (University of British Columbia)",0,0,,,,https://app.dimensions.ai/details/publication/pub.1106013868,0604 Genetics; 06 Biological Sciences,0604 Genetics,06 Biological Sciences,,,
2,200,pub.1110904406,10.1111/1758-2229.12721,30585419,,Crystal ball: the microbial map of the ocean,Environmental Microbiology Reports,,Ecosystem; Maps as Topic; Oceans and Seas; Seawater,2019-02,2019,11,1,35-37,All OA; Gold,Article,"Santoro, Alyson E.",,"Santoro, Alyson E. (University of California, Santa Barbara)",0,0,,,https://onlinelibrary.wiley.com/doi/pdf/10.1111/1758-2229.12721,https://app.dimensions.ai/details/publication/pub.1110904406,0605 Microbiology; 0602 Ecology; 06 Biological Sciences; 0603 Evolutionary Biology,0605 Microbiology,0602 Ecology,06 Biological Sciences,0603 Evolutionary Biology,
3,500,pub.1106944862,10.1146/annurev-marine-121916-063141,30212260,,Planktonic Marine Archaea,Annual Review of Marine Science,,,2019-01-03,2019,11,1,1-28,Closed,Article,"Santoro, Alyson E; Richter, R Alexander; Dupont, Christopher L",,"Santoro, Alyson E (University of California, Santa Barbara); Richter, R Alexander (J. Craig Venter Institute); Dupont, Christopher L (J. Craig Venter Institute)",9,9,,,,https://app.dimensions.ai/details/publication/pub.1106944862,0605 Microbiology; 0602 Ecology; 06 Biological Sciences,0605 Microbiology,0602 Ecology,06 Biological Sciences,,
4,100,pub.1106287298,10.1007/s12237-018-0441-4,,,Observations of Variable Ammonia Oxidation and Nitrous Oxide Flux in a Eutrophic Estuary,Chesapeake Science,,,2019-01,2019,42,1,33-44,Closed,Article,"Laperriere, Sarah M.; Nidzieko, Nicholas J.; Fox, Rebecca J.; Fisher, Alexander W.; Santoro, Alyson E.","Santoro, Alyson E.","Laperriere, Sarah M. (University of Maryland Center For Environmental Sciences; University of California, Santa Barbara); Nidzieko, Nicholas J. (University of Maryland Center For Environmental Sciences; University of California, Santa Barbara); Fox, Rebecca J. (University of Maryland Center For Environmental Sciences; Washington College); Fisher, Alexander W. (University of Maryland Center For Environmental Sciences; University of California, Santa Barbara); Santoro, Alyson E. (University of Maryland Center For Environmental Sciences; University of California, Santa Barbara)",0,0,,,,https://app.dimensions.ai/details/publication/pub.1106287298,04 Earth Sciences; 05 Environmental Sciences; 06 Biological Sciences,04 Earth Sciences,05 Environmental Sciences,06 Biological Sciences,,
5,500,pub.1109914578,10.1111/jeu.12701,30444565,,"Phylogeny, Evidence for a Cryptic Plastid, and Distribution of Chytriodinium Parasites (Dinophyceae) Infecting Copepods",Journal of Eukaryotic Microbiology,,,2018-12-11,2018,66,4,574-581,Closed,Article,"Strassert, Jürgen F.H.; Hehenberger, Elisabeth; Campo, Javier; Okamoto, Noriko; Kolisko, Martin; Richards, Thomas A.; Worden, Alexandra Z.; Santoro, Alyson E.; Keeling, Patrick J.",,"Strassert, Jürgen F.H. (University of British Columbia); Hehenberger, Elisabeth (University of British Columbia); Campo, Javier (University of British Columbia); Okamoto, Noriko (University of British Columbia); Kolisko, Martin (University of British Columbia); Richards, Thomas A. (University of Exeter); Worden, Alexandra Z. (Monterey Bay Aquarium Research Institute); Santoro, Alyson E. (University of California, Santa Barbara); Keeling, Patrick J. (University of British Columbia)",0,0,,,,https://app.dimensions.ai/details/publication/pub.1109914578,0604 Genetics; 06 Biological Sciences,0604 Genetics,06 Biological Sciences,,,
6,100,pub.1107409881,10.5194/bg-15-5891-2018,,,An intercomparison of oceanic methane and nitrous oxide measurements,Biogeosciences,,,2018-10-05,2018,15,19,5891-5907,All OA; Gold,Article,"Wilson, Samuel T.; Bange, Hermann W.; Arévalo-Martínez, Damian L.; Barnes, Jonathan; Borges, Alberto V.; Brown, Ian; Bullister, John L.; Burgos, Macarena; Capelle, David W.; Casso, Michael; de la Paz, Mercedes; Farías, Laura; Fenwick, Lindsay; Ferrón, Sara; Garcia, Gerardo; Glockzin, Michael; Karl, David M.; Kock, Annette; Laperriere, Sarah; Law, Cliff S.; Manning, Cara C.; Marriner, Andrew; Myllykangas, Jukka-Pekka; Pohlman, John W.; Rees, Andrew P.; Santoro, Alyson E.; Tortell, Philippe D.; Upstill-Goddard, Robert C.; Wisegarver, David P.; Zhang, Gui-Ling; Rehder, Gregor",,"Wilson, Samuel T. (University of Hawaii at Manoa); Bange, Hermann W. (GEOMAR Helmholtz Centre for Ocean Research Kiel); Arévalo-Martínez, Damian L. (GEOMAR Helmholtz Centre for Ocean Research Kiel); Barnes, Jonathan (Newcastle University); Borges, Alberto V. (University of Liège); Brown, Ian (Plymouth Marine Laboratory); Bullister, John L. (Pacific Marine Environmental Laboratory); Burgos, Macarena (University of Hawaii at Manoa; University of Cádiz); Capelle, David W. (University of British Columbia); Casso, Michael (United States Geological Survey); de la Paz, Mercedes (Spanish Institute of Oceanography); Farías, Laura (University of Concepción); Fenwick, Lindsay (University of British Columbia); Ferrón, Sara (University of Hawaii at Manoa); Garcia, Gerardo (University of Concepción); Glockzin, Michael (Leibniz Institute for Baltic Sea Research); Karl, David M. (University of Hawaii at Manoa); Kock, Annette (GEOMAR Helmholtz Centre for Ocean Research Kiel); Laperriere, Sarah (University of California, Santa Barbara); Law, Cliff S. (National Institute of Water and Atmospheric Research; University of Otago); Manning, Cara C. (University of British Columbia); Marriner, Andrew (National Institute of Water and Atmospheric Research); Myllykangas, Jukka-Pekka (University of Helsinki); Pohlman, John W. (United States Geological Survey); Rees, Andrew P. (Plymouth Marine Laboratory); Santoro, Alyson E. (University of California, Santa Barbara); Tortell, Philippe D. (University of British Columbia); Upstill-Goddard, Robert C. (Newcastle University); Wisegarver, David P. (Pacific Marine Environmental Laboratory); Zhang, Gui-Ling (); Rehder, Gregor (Leibniz Institute for Baltic Sea Research)",3,3,,,https://www.biogeosciences.net/15/5891/2018/bg-15-5891-2018.pdf,https://app.dimensions.ai/details/publication/pub.1107409881,04 Earth Sciences; 0405 Oceanography,04 Earth Sciences,0405 Oceanography,,,
7,100,pub.1107064259,10.1101/418467,,,"Phylogeny, evidence for a cryptic plastid, and distribution of Chytriodinium parasites (Dinophyceae) infecting copepods",bioRxiv,,,2018-09-14,2018,,,418467,"All OA; Green, Published",Preprint,"Strassert, Juergen F. H.; Hehenberger, Elisabeth; del Campo, Javier; Okamoto, Noriko; Kolisko, Martin; Richards, Thomas A.; Worden, Alexandra Z.; Santoro, Alyson E.; Keeling, Patrick J.",,"Strassert, Juergen F. H. (University of British Columbia); Hehenberger, Elisabeth (University of British Columbia); del Campo, Javier (University of British Columbia); Okamoto, Noriko (University of British Columbia); Kolisko, Martin (University of British Columbia); Richards, Thomas A. (University of Exeter); Worden, Alexandra Z. (Monterey Bay Aquarium Research Institute); Santoro, Alyson E. (University of California, Santa Barbara); Keeling, Patrick J. (University of British Columbia)",0,0,,,https://www.biorxiv.org/content/biorxiv/early/2018/09/14/418467.full.pdf,https://app.dimensions.ai/details/publication/pub.1107064259,0604 Genetics; 06 Biological Sciences,0604 Genetics,06 Biological Sciences,,,
8,100,pub.1104606048,10.5194/bg-2018-274,,,An intercomparison of oceanic methane and nitrous oxide measurements,Biogeosciences Discussions,,,2018-06-14,2018,,,1-37,All OA; Gold,Article,"Wilson, Samuel T.; Bange, Hermann W.; Arévalo-Martínez, Damian L.; Barnes, Jonathan; Borges, Alberto V.; Brown, Ian; Bullister, John L.; Burgos, Macarena; Capelle, David W.; Casso, Michael; de la Paz, Mercedes; Farías, Laura; Fenwick, Lindsay; Ferrón, Sara; Garcia, Gerardo; Glockzin, Michael; Karl, David M.; Kock, Annette; Laperriere, Sarah; Law, Cliff S.; Manning, Cara C.; Marriner, Andrew; Myllykangas, Jukka-Pekka; Pohlman, John W.; Rees, Andrew P.; Santoro, Alyson E.; Torres, Mabel; Tortell, Philippe D.; Upstill-Goddard, Robert C.; Wisegarver, David P.; Zhang, Guiling L.; Rehder, Gregor",,"Wilson, Samuel T. (University of Hawaii at Manoa); Bange, Hermann W. (GEOMAR Helmholtz Centre for Ocean Research Kiel); Arévalo-Martínez, Damian L. (GEOMAR Helmholtz Centre for Ocean Research Kiel); Barnes, Jonathan (Newcastle University); Borges, Alberto V. (University of Liège); Brown, Ian (Plymouth Marine Laboratory); Bullister, John L. (Pacific Marine Environmental Laboratory); Burgos, Macarena (University of Cádiz); Capelle, David W. (University of British Columbia); Casso, Michael (United States Geological Survey); de la Paz, Mercedes (Spanish Institute of Oceanography); Farías, Laura (University of Concepción); Fenwick, Lindsay (University of British Columbia); Ferrón, Sara (University of Hawaii at Manoa); Garcia, Gerardo (University of Concepción); Glockzin, Michael (Leibniz Institute for Baltic Sea Research); Karl, David M. (University of Hawaii at Manoa); Kock, Annette (GEOMAR Helmholtz Centre for Ocean Research Kiel); Laperriere, Sarah (University of California, Santa Barbara); Law, Cliff S. (National Institute of Water and Atmospheric Research; University of Otago); Manning, Cara C. (University of British Columbia); Marriner, Andrew (National Institute of Water and Atmospheric Research); Myllykangas, Jukka-Pekka (University of Helsinki); Pohlman, John W. (United States Geological Survey); Rees, Andrew P. (Plymouth Marine Laboratory); Santoro, Alyson E. (University of California, Santa Barbara); Torres, Mabel (University of Concepción); Tortell, Philippe D. (University of British Columbia); Upstill-Goddard, Robert C. (Newcastle University); Wisegarver, David P. (Pacific Marine Environmental Laboratory); Zhang, Guiling L. (Ocean University of China); Rehder, Gregor (Leibniz Institute for Baltic Sea Research)",0,0,,,http://oceanrep.geomar.de/44710/1/bg-15-5891-2018.pdf,https://app.dimensions.ai/details/publication/pub.1104606048,04 Earth Sciences; 0402 Geochemistry,04 Earth Sciences,0402 Geochemistry,,,
9,500,pub.1103189480,10.1111/1462-2920.14107,29626379,,Patterns of thaumarchaeal gene expression in culture and diverse marine environments,Environmental Microbiology,,"Ammonia; Aquatic Organisms; Archaea; Archaeal Proteins; Gene Expression Regulation, Archaeal; Gene Expression Regulation, Enzymologic; Nitrite Reductases; Nitrogen Cycle; Oxidation-Reduction; Oxidoreductases; Phylogeny; Urea; Urease",2018-06,2018,20,6,2112-2124,Closed,Article,"Carini, Paul; Dupont, Christopher L.; Santoro, Alyson E.",,"Carini, Paul (University of Maryland Center For Environmental Sciences); Dupont, Christopher L. (J. Craig Venter Institute); Santoro, Alyson E. (University of Maryland Center For Environmental Sciences)",20,20,,,,https://app.dimensions.ai/details/publication/pub.1103189480,0604 Genetics; 06 Biological Sciences,0604 Genetics,06 Biological Sciences,,,
10,500,pub.1099612032,10.1111/1462-2920.14018,29215213,,Identifying protist consumers of photosynthetic picoeukaryotes in the surface ocean using stable isotope probing,Environmental Microbiology,,"Chlorophyta; Ciliophora; Food Chain; Isotopes; Oceans and Seas; Pacific Ocean; Photosynthesis; Phylogeny; Phytoplankton; RNA, Ribosomal, 18S; Seawater; Sequence Analysis, DNA; Stramenopiles",2018-02,2018,20,2,815-827,Closed,Article,"Orsi, William D.; Wilken, Susanne; del Campo, Javier; Heger, Thierry; James, Erick; Richards, Thomas A.; Keeling, Patrick J.; Worden, Alexandra Z.; Santoro, Alyson E.",,"Orsi, William D. (University of Maryland Center For Environmental Sciences); Wilken, Susanne (Monterey Bay Aquarium Research Institute); del Campo, Javier (University of British Columbia); Heger, Thierry (University of British Columbia); James, Erick (University of British Columbia); Richards, Thomas A. (University of Exeter); Keeling, Patrick J. (University of British Columbia); Worden, Alexandra Z. (Monterey Bay Aquarium Research Institute); Santoro, Alyson E. (University of Maryland Center For Environmental Sciences)",10,10,,,,https://app.dimensions.ai/details/publication/pub.1099612032,0605 Microbiology; 0604 Genetics; 0602 Ecology; 06 Biological Sciences,0605 Microbiology,0604 Genetics,0602 Ecology,06 Biological Sciences,
11,500,pub.1092133946,10.1038/ismej.2017.167,28994824,PMC5739020,Single cell genomics of uncultured marine alveolates shows paraphyly of basal dinoflagellates,The ISME Journal,,"Dinoflagellida; Genes, rRNA; Genomics; Phylogeny; Single-Cell Analysis",2018-01,2018,12,1,304-308,All OA; Gold,Article,"Strassert, Jürgen F H; Karnkowska, Anna; Hehenberger, Elisabeth; del Campo, Javier; Kolisko, Martin; Okamoto, Noriko; Burki, Fabien; Janouškovec, Jan; Poirier, Camille; Leonard, Guy; Hallam, Steven J; Richards, Thomas A; Worden, Alexandra Z; Santoro, Alyson E; Keeling, Patrick J","Strassert, Jürgen F H","Strassert, Jürgen F H (University of British Columbia; Uppsala University); Karnkowska, Anna (University of British Columbia; University of Warsaw); Hehenberger, Elisabeth (University of British Columbia); del Campo, Javier (University of British Columbia); Kolisko, Martin (University of British Columbia; Institute of Parasitology); Okamoto, Noriko (University of British Columbia); Burki, Fabien (University of British Columbia; Uppsala University); Janouškovec, Jan (University of British Columbia; University College London); Poirier, Camille (Monterey Bay Aquarium Research Institute); Leonard, Guy (University of Exeter); Hallam, Steven J (University of British Columbia); Richards, Thomas A (University of Exeter); Worden, Alexandra Z (Monterey Bay Aquarium Research Institute); Santoro, Alyson E (University of California, Santa Barbara); Keeling, Patrick J (University of British Columbia)",12,12,,,https://www.nature.com/articles/ismej2017167.pdf,https://app.dimensions.ai/details/publication/pub.1092133946,0605 Microbiology; 0604 Genetics; 06 Biological Sciences,0605 Microbiology,0604 Genetics,06 Biological Sciences,,
12,500,pub.1091296409,10.1073/pnas.1708097114,28827361,PMC5594687,Host-derived viral transporter protein for nitrogen uptake in infected marine phytoplankton,Proceedings of the National Academy of Sciences,,"Cell Membrane; Chlorophyta; Gene Transfer, Horizontal; Genes, Viral; Genome, Viral; Host-Pathogen Interactions; Nitrogen; Phytoplankton; Viral Proteins",2017-09-05,2017,114,36,e7489-e7498,All OA; Gold,Article,"Monier, Adam; Chambouvet, Aurélie; Milner, David S.; Attah, Victoria; Terrado, Ramón; Lovejoy, Connie; Moreau, Hervé; Santoro, Alyson E.; Derelle, Évelyne; Richards, Thomas A.",,"Monier, Adam (University of Exeter; Laval University); Chambouvet, Aurélie (University of Exeter); Milner, David S. (University of Exeter); Attah, Victoria (University of Exeter); Terrado, Ramón (University of Southern California); Lovejoy, Connie (Laval University); Moreau, Hervé (Observatoire Océanologique de Banyuls-sur-Mer); Santoro, Alyson E. (University of California, Santa Barbara); Derelle, Évelyne (Observatoire Océanologique de Banyuls-sur-Mer); Richards, Thomas A. (University of Exeter)",15,11,1.6,4.57,https://www.pnas.org/content/pnas/114/36/E7489.full.pdf,https://app.dimensions.ai/details/publication/pub.1091296409,11 Medical and Health Sciences; 1108 Medical Microbiology; 0605 Microbiology; 0601 Biochemistry and Cell Biology; 0604 Genetics; 06 Biological Sciences,11 Medical and Health Sciences,1108 Medical Microbiology,0605 Microbiology,0601 Biochemistry and Cell Biology,0604 Genetics
13,100,pub.1084516298,10.1002/lno.10547,,,Thaumarchaeal ecotype distributions across the equatorial Pacific Ocean and their potential roles in nitrification and sinking flux attenuation,Limnology and Oceanography,,,2017-09,2017,62,5,1984-2003,All OA; Gold,Article,"Santoro, Alyson E.; Saito, Mak A.; Goepfert, Tyler J.; Lamborg, Carl H.; Dupont, Chris L.; DiTullio, Giacomo R.",,"Santoro, Alyson E. (); Saito, Mak A. (); Goepfert, Tyler J. (); Lamborg, Carl H. (); Dupont, Chris L. (); DiTullio, Giacomo R. ()",20,19,,6.04,https://aslopubs.onlinelibrary.wiley.com/doi/pdf/10.1002/lno.10547,https://app.dimensions.ai/details/publication/pub.1084516298,0605 Microbiology; 06 Biological Sciences,0605 Microbiology,06 Biological Sciences,,,
14,100,pub.1091204124,10.1101/175141,,,Patterns of thaumarchaeal gene expression in culture and diverse marine environments,bioRxiv,,,2017-08-11,2017,,,175141,"All OA; Green, Published",Preprint,"Carini, Paul; Dupont, Christopher; Santoro, Alyson E.",,"Carini, Paul (University of Arizona); Dupont, Christopher (J. Craig Venter Institute); Santoro, Alyson E. (University of California, Santa Barbara)",0,0,,0,https://www.biorxiv.org/content/biorxiv/early/2018/03/19/175141.full.pdf,https://app.dimensions.ai/details/publication/pub.1091204124,0605 Microbiology; 0604 Genetics; 06 Biological Sciences,0605 Microbiology,0604 Genetics,06 Biological Sciences,,
15,100,pub.1022675997,10.1002/lno.10389,,,Multifaceted impacts of the stony coral Porites astreoides on picoplankton abundance and community composition,Limnology and Oceanography,,,2017-01,2017,62,1,217-234,All OA; Gold,Article,"McNally, Sean P.; Parsons, Rachel J.; Santoro, Alyson E.; Apprill, Amy",,"McNally, Sean P. (); Parsons, Rachel J. (); Santoro, Alyson E. (); Apprill, Amy ()",7,5,,2.92,https://aslopubs.onlinelibrary.wiley.com/doi/pdf/10.1002/lno.10389,https://app.dimensions.ai/details/publication/pub.1022675997,05 Environmental Sciences; 06 Biological Sciences; 0602 Ecology; 0502 Environmental Science and Management,05 Environmental Sciences,06 Biological Sciences,0602 Ecology,0502 Environmental Science and Management,
16,400,pub.1002228246,10.1016/j.cub.2016.09.013,27875688,,Morphological Identification and Single-Cell Genomics of Marine Diplonemids,Current Biology,,"Amino Acid Sequence; Biodiversity; California; Euglenozoa; Genome, Protozoan; Metagenomics; Pacific Ocean; Phylogeny; Plankton; RNA, Protozoan; Sequence Alignment",2016-11,2016,26,22,3053-3059,"All OA; Green, Accepted & Submitted",Article,"Gawryluk, Ryan M.R.; del Campo, Javier; Okamoto, Noriko; Strassert, Jürgen F.H.; Lukeš, Julius; Richards, Thomas A.; Worden, Alexandra Z.; Santoro, Alyson E.; Keeling, Patrick J.","Gawryluk, Ryan M.R.","Gawryluk, Ryan M.R. (University of British Columbia); del Campo, Javier (University of British Columbia); Okamoto, Noriko (University of British Columbia); Strassert, Jürgen F.H. (University of British Columbia); Lukeš, Julius (Canadian Institute for Advanced Research); Richards, Thomas A. (Canadian Institute for Advanced Research; University of Exeter); Worden, Alexandra Z. (Canadian Institute for Advanced Research; Monterey Bay Aquarium Research Institute); Santoro, Alyson E. (Canadian Institute for Advanced Research; University of California, Santa Barbara); Keeling, Patrick J. (University of British Columbia; Canadian Institute for Advanced Research)",42,26,2.72,8.99,http://oceanrep.geomar.de/46010/1/Morphological-Identification-and-SingleCell-Genomics-of-Marine-DiplonemidsCurrent-Biology.pdf,https://app.dimensions.ai/details/publication/pub.1002228246,0604 Genetics; 06 Biological Sciences,0604 Genetics,06 Biological Sciences,,,
17,400,pub.1062727612,10.1128/msystems.00143-16,27822559,PMC5080407,Distinguishing between Microbial Habitats Unravels Ecological Complexity in Coral Microbiomes,mSystems,,,2016-10-25,2016,1,5,e00143-16,All OA; Gold,Article,"Apprill, Amy; Weber, Laura G.; Santoro, Alyson E.",,"Apprill, Amy (Woods Hole Oceanographic Institution); Weber, Laura G. (Woods Hole Oceanographic Institution); Santoro, Alyson E. (University of Maryland Center For Environmental Sciences)",25,17,2.3,6.83,https://msystems.asm.org/content/msys/1/5/e00143-16.full.pdf,https://app.dimensions.ai/details/publication/pub.1062727612,0602 Ecology; 0502 Environmental Science and Management; 0605 Microbiology; 05 Environmental Sciences; 06 Biological Sciences,0602 Ecology,0502 Environmental Science and Management,0605 Microbiology,05 Environmental Sciences,06 Biological Sciences
18,400,pub.1009859187,10.1038/ismej.2016.20,26953597,PMC4989311,"Diverse, uncultivated bacteria and archaea underlying the cycling of dissolved protein in the ocean",The ISME Journal,,"Archaea; Bacteria; California; Carbon; DNA, Bacterial; DNA, Ribosomal; Nitrogen; Oceans and Seas; Phytoplankton; Proteins",2016-09,2016,10,9,2158-2173,All OA; Gold,Article,"Orsi, William D; Smith, Jason M; Liu, Shuting; Liu, Zhanfei; Sakamoto, Carole M; Wilken, Susanne; Poirier, Camille; Richards, Thomas A; Keeling, Patrick J; Worden, Alexandra Z; Santoro, Alyson E","Orsi, William D","Orsi, William D (University of Maryland Center For Environmental Sciences; Ludwig Maximilian University of Munich); Smith, Jason M (Monterey Bay Aquarium Research Institute); Liu, Shuting (The University of Texas at Austin); Liu, Zhanfei (The University of Texas at Austin); Sakamoto, Carole M (Monterey Bay Aquarium Research Institute); Wilken, Susanne (Monterey Bay Aquarium Research Institute); Poirier, Camille (Monterey Bay Aquarium Research Institute); Richards, Thomas A (University of Exeter; Canadian Institute for Advanced Research); Keeling, Patrick J (Canadian Institute for Advanced Research; University of British Columbia); Worden, Alexandra Z (Monterey Bay Aquarium Research Institute; Canadian Institute for Advanced Research); Santoro, Alyson E (University of Maryland Center For Environmental Sciences; Canadian Institute for Advanced Research)",41,24,3.99,8.73,https://www.nature.com/articles/ismej201620.pdf,https://app.dimensions.ai/details/publication/pub.1009859187,0605 Microbiology; 0604 Genetics; 0601 Biochemistry and Cell Biology; 06 Biological Sciences,0605 Microbiology,0604 Genetics,0601 Biochemistry and Cell Biology,06 Biological Sciences,
19,400,pub.1039557031,10.1073/pnas.1518534113,27357675,PMC4948339,Influence of ammonia oxidation rate on thaumarchaeal lipid composition and the TEX86 temperature proxy,Proceedings of the National Academy of Sciences,,Ammonia; Archaea; Culture Techniques; Energy Metabolism; Glyceryl Ethers; Lipid Metabolism; Oceans and Seas; Oxidation-Reduction; Paleontology; Temperature,2016-07-12,2016,113,28,7762-7767,All OA; Gold,Article,"Hurley, Sarah J.; Elling, Felix J.; Könneke, Martin; Buchwald, Carolyn; Wankel, Scott D.; Santoro, Alyson E.; Lipp, Julius Sebastian; Hinrichs, Kai-Uwe; Pearson, Ann",,"Hurley, Sarah J. (Harvard University); Elling, Felix J. (University of Bremen); Könneke, Martin (University of Bremen); Buchwald, Carolyn (University of Maryland Center For Environmental Sciences); Wankel, Scott D. (); Santoro, Alyson E. (University of Maryland Center For Environmental Sciences); Lipp, Julius Sebastian (University of Bremen); Hinrichs, Kai-Uwe (University of Bremen); Pearson, Ann (Harvard University)",40,31,0.99,10.38,https://www.pnas.org/content/pnas/113/28/7762.full.pdf,https://app.dimensions.ai/details/publication/pub.1039557031,0602 Ecology; 06 Biological Sciences,0602 Ecology,06 Biological Sciences,,,
20,200,pub.1062667267,10.1126/science.aad9839,26798002,,The do-it-all nitrifier,Science,,"Ammonia; Bacteria; Genome, Bacterial; Nitrification; Nitrites; Oxidation-Reduction",2016-01-22,2016,351,6271,342-343,All OA; Gold,Article,"Santoro, Alyson E.",,"Santoro, Alyson E. (University of Maryland Center For Environmental Sciences)",20,15,1.01,,https://science.sciencemag.org/content/sci/351/6271/342.full.pdf,https://app.dimensions.ai/details/publication/pub.1062667267,,,,,,
