,"""About the data: Exported on Oct 31, 2019. Criteria: Researcher is L C Stratton. © 2019 Digital Science and Research Solutions Inc. All rights reserved. Unless otherwise agreed, redistribution / external use of this work is not permitted.""
",Unnamed: 1,Unnamed: 2,Unnamed: 3,Unnamed: 4,Unnamed: 5,Unnamed: 6,Unnamed: 7,Unnamed: 8,Unnamed: 9,Unnamed: 10,Unnamed: 11,Unnamed: 12,Unnamed: 13,Unnamed: 14,Unnamed: 15,Unnamed: 16,Unnamed: 17,Unnamed: 18,Unnamed: 19,Unnamed: 20,Unnamed: 21,Unnamed: 22,Unnamed: 23,Unnamed: 24,Unnamed: 25,Unnamed: 26,Unnamed: 27,Unnamed: 28,Unnamed: 29,Unnamed: 30
0,Rank,Publication ID,DOI,PMID,PMCID,Title,Source title,Anthology title,MeSH terms,Publication Date,PubYear,Volume,Issue,Pagination,Open Access,Publication Type,Authors,Corresponding Author,Authors Affiliations,Times cited,Recent citations,RCR,FCR,Source Linkout,Dimensions URL,FOR (ANZSRC) Categories,FOR 1,FOR 2,FOR 3,FOR 4,FOR 5
1,400,pub.1036390837,10.1093/treephys/21.18.1327,11731343,,"Carbon uptake, growth and resource-use efficiency in one invasive and six native Hawaiian dry forest tree species",Tree Physiology,,Anacardiaceae; Carbon Dioxide; Hawaii; Nitrogen; Photosynthesis; Plant Leaves; Seasons; Trees,2001-12-01,2001,21,18,1327-1334,All OA; Gold,Article,"Stratton, L. C.; Goldstein, G.",,"Stratton, L. C. (); Goldstein, G. ()",33,3,0.25,3.64,https://academic.oup.com/treephys/article-pdf/21/18/1327/4665368/21-18-1327.pdf,https://app.dimensions.ai/details/publication/pub.1036390837,0602 Ecology; 0705 Forestry Sciences; 0607 Plant Biology; 06 Biological Sciences; 07 Agricultural and Veterinary Sciences,0602 Ecology,0705 Forestry Sciences,0607 Plant Biology,06 Biological Sciences,07 Agricultural and Veterinary Sciences
2,400,pub.1049313180,10.1007/s004420000384,28308768,,Temporal and spatial partitioning of water resources among eight woody species in a Hawaiian dry forest,Oecologia,,,2000-08,2000,124,3,309-317,Closed,Article,"Stratton, L. C.; Goldstein, G.; Meinzer, F. C.",,"Stratton, L. C. (University of Hawaii at Manoa); Goldstein, G. (University of Hawaii at Manoa); Meinzer, F. C. (Hawaii Agriculture Research Center)",61,5,0.57,5.66,,https://app.dimensions.ai/details/publication/pub.1049313180,0607 Plant Biology; 0602 Ecology; 06 Biological Sciences,0607 Plant Biology,0602 Ecology,06 Biological Sciences,,
3,100,pub.1016560532,10.1046/j.1365-3040.2000.00533.x,,,Stem water storage capacity and efficiency of water transport: their functional significance in a Hawaiian dry forest,Plant Cell & Environment,,,2000-01,2000,23,1,99-106,All OA; Gold,Article,"Stratton, L.; Goldstein, G.; Meinzer, F. C.",,"Stratton, L. (University of Hawaii at Manoa); Goldstein, G. (University of Hawaii at Manoa); Meinzer, F. C. (Hawaii Agriculture Research Center)",104,14,,12.05,https://onlinelibrary.wiley.com/doi/pdf/10.1046/j.1365-3040.2000.00533.x,https://app.dimensions.ai/details/publication/pub.1016560532,0607 Plant Biology; 06 Biological Sciences,0607 Plant Biology,06 Biological Sciences,,,
