,"""About the data: Exported on Nov 01, 2019. Criteria: Researcher is Mark A Brzezinski. © 2019 Digital Science and Research Solutions Inc. All rights reserved. Unless otherwise agreed, redistribution / external use of this work is not permitted.""
",Unnamed: 1,Unnamed: 2,Unnamed: 3,Unnamed: 4,Unnamed: 5,Unnamed: 6,Unnamed: 7,Unnamed: 8,Unnamed: 9,Unnamed: 10,Unnamed: 11,Unnamed: 12,Unnamed: 13,Unnamed: 14,Unnamed: 15,Unnamed: 16,Unnamed: 17,Unnamed: 18,Unnamed: 19,Unnamed: 20,Unnamed: 21,Unnamed: 22,Unnamed: 23,Unnamed: 24,Unnamed: 25,Unnamed: 26,Unnamed: 27,Unnamed: 28,Unnamed: 29,Unnamed: 30
92,100,pub.1015035066,10.1016/s0967-0645(02)00587-8,,,"Ratios of Si, C and N uptake by microplankton in the Southern Ocean",Deep Sea Research Part II Topical Studies in Oceanography,,,2003-03,2003,50,3-4,619-633,Closed,Article,"Brzezinski, Mark A; Dickson, Mary-Lynn; Nelson, David M; Sambrotto, Raymond","Brzezinski, Mark A","Brzezinski, Mark A (University of California, Santa Barbara); Dickson, Mary-Lynn (University of Rhode Island); Nelson, David M (Oregon State University); Sambrotto, Raymond (Lamont-Doherty Earth Observatory)",87,7,,6.35,,https://app.dimensions.ai/details/publication/pub.1015035066,04 Earth Sciences; 0405 Oceanography,04 Earth Sciences,0405 Oceanography,,,
93,200,pub.1071176843,10.3354/meps252015,,,"Iron and zinc effects on silicic acid and nitrate uptake kinetics in three high-nutrient, low-chlorophyll (HNLC) regions",Marine Ecology Progress Series,,,2003,2003,252,,15-33,All OA; Gold,Article,"Franck, VM; Bruland, KW; Hutchins, DA; Brzezinski, MA",,"Franck, VM (); Bruland, KW (); Hutchins, DA (); Brzezinski, MA ()",104,10,,9.23,https://www.int-res.com/articles/meps2003/252/m252p015.pdf,https://app.dimensions.ai/details/publication/pub.1071176843,0602 Ecology; 0405 Oceanography; 04 Earth Sciences; 06 Biological Sciences; 0608 Zoology,0602 Ecology,0405 Oceanography,04 Earth Sciences,06 Biological Sciences,0608 Zoology
94,100,pub.1051712969,10.1029/2001gb001442,,,Silicic acid leakage from the Southern Ocean: A possible explanation for glacial atmospheric pCO2,Global Biogeochemical Cycles,,,2002-09,2002,16,3,5-1-5-23,All OA; Gold,Article,"Matsumoto, Katsumi; Sarmiento, Jorge L.; Brzezinski, Mark A.",,"Matsumoto, Katsumi (Princeton University); Sarmiento, Jorge L. (Princeton University); Brzezinski, Mark A. (University of California, Santa Barbara)",191,17,,12.83,https://agupubs.onlinelibrary.wiley.com/doi/pdf/10.1029/2001GB001442,https://app.dimensions.ai/details/publication/pub.1051712969,04 Earth Sciences; 0405 Oceanography,04 Earth Sciences,0405 Oceanography,,,
95,100,pub.1041481808,10.1016/s0079-6611(02)00045-9,,,Effects of the 1997–98 El Niño on seasonal variations in suspended and sinking particles in the Santa Barbara basin,Progress In Oceanography,,,2002-07,2002,54,1-4,105-127,"All OA; Green, Accepted & Submitted",Article,"Shipe, R.F; Passow, U; Brzezinski, M.A; Graham, W.M; Pak, D.K; Siegel, D.A; Alldredge, A.L","Shipe, R.F","Shipe, R.F (University of California, Santa Barbara); Passow, U (University of California, Santa Barbara); Brzezinski, M.A (University of California, Santa Barbara); Graham, W.M (); Pak, D.K (University of California, Santa Barbara); Siegel, D.A (University of California, Santa Barbara); Alldredge, A.L (University of California, Santa Barbara)",27,5,,2.1,https://epic.awi.de/id/eprint/6314/1/Shi2002a.pdf,https://app.dimensions.ai/details/publication/pub.1041481808,04 Earth Sciences; 0403 Geology; 0405 Oceanography,04 Earth Sciences,0403 Geology,0405 Oceanography,,
96,100,pub.1029676667,10.1016/s0967-0645(02)00010-3,,,The Si cycle in the Pacific sector of the Southern Ocean: seasonal diatom production in the surface layer and export to the deep sea,Deep Sea Research Part II Topical Studies in Oceanography,,,2002-01,2002,49,9-10,1747-1763,Closed,Article,"Sigmon, Daniel E; Nelson, David M; Brzezinski, Mark A","Nelson, David M","Sigmon, Daniel E (Oregon State University); Nelson, David M (Oregon State University); Brzezinski, Mark A (University of California, Santa Barbara)",35,2,,2.35,,https://app.dimensions.ai/details/publication/pub.1029676667,04 Earth Sciences; 0405 Oceanography,04 Earth Sciences,0405 Oceanography,,,
97,100,pub.1021313475,10.1016/s0967-0645(02)00011-5,,,Biogenic silica production rates and particulate organic matter distribution in the Atlantic sector of the Southern Ocean during austral spring 1992,Deep Sea Research Part II Topical Studies in Oceanography,,,2002-01,2002,49,9-10,1765-1786,Closed,Article,"Quéguiner, B; Brzezinski, M.A","Quéguiner, B","Quéguiner, B (); Brzezinski, M.A (University of California, Santa Barbara)",34,4,,2.28,,https://app.dimensions.ai/details/publication/pub.1021313475,04 Earth Sciences; 0405 Oceanography,04 Earth Sciences,0405 Oceanography,,,
98,100,pub.1001981300,10.1016/s0967-0645(02)00005-x,,,"Vertical budgets for organic carbon and biogenic silica in the Pacific sector of the Southern Ocean, 1996–1998",Deep Sea Research Part II Topical Studies in Oceanography,,,2002-01,2002,49,9-10,1645-1674,Closed,Article,"Nelson, David M; Anderson, Robert F; Barber, Richard T; Brzezinski, Mark A; Buesseler, Ken O; Chase, Zanna; Collier, Robert W; Dickson, Mary-Lynn; François, Roger; Hiscock, Michael R; Honjo, Susumu; Marra, John; Martin, William R; Sambrotto, Raymond N; Sayles, Frederick L; Sigmon, Daniel E","Nelson, David M","Nelson, David M (Oregon State University); Anderson, Robert F (Lamont-Doherty Earth Observatory); Barber, Richard T (Duke University); Brzezinski, Mark A (University of California, Santa Barbara); Buesseler, Ken O (Woods Hole Oceanographic Institution); Chase, Zanna (Lamont-Doherty Earth Observatory); Collier, Robert W (Oregon State University); Dickson, Mary-Lynn (University of Rhode Island); François, Roger (Woods Hole Oceanographic Institution); Hiscock, Michael R (Duke University); Honjo, Susumu (Woods Hole Oceanographic Institution); Marra, John (Lamont-Doherty Earth Observatory); Martin, William R (Woods Hole Oceanographic Institution); Sambrotto, Raymond N (Lamont-Doherty Earth Observatory); Sayles, Frederick L (Woods Hole Oceanographic Institution); Sigmon, Daniel E (Oregon State University)",112,6,,7.52,,https://app.dimensions.ai/details/publication/pub.1001981300,04 Earth Sciences; 0405 Oceanography,04 Earth Sciences,0405 Oceanography,,,
99,100,pub.1008393369,10.1029/2001gl014349,,,A switch from Si(OH)4 to NO3− depletion in the glacial Southern Ocean,Geophysical Research Letters,,,2002,2002,29,12,5-1-5-4,All OA; Gold,Article,"Brzezinski, Mark A.; Pride, Carol J.; Franck, Valerie M.; Sigman, Daniel M.; Sarmiento, Jorge L.; Matsumoto, Katsumi; Gruber, Nicolas; Rau, Greg H.; Coale, Kenneth H.",,"Brzezinski, Mark A. (University of California, Santa Barbara); Pride, Carol J. (University of California, Santa Barbara; Savannah State University); Franck, Valerie M. (University of California, Santa Barbara); Sigman, Daniel M. (Princeton University); Sarmiento, Jorge L. (Princeton University); Matsumoto, Katsumi (Princeton University); Gruber, Nicolas (University of California Los Angeles); Rau, Greg H. (University of California, Santa Cruz); Coale, Kenneth H. ()",249,21,,16.72,https://agupubs.onlinelibrary.wiley.com/doi/pdf/10.1029/2001GL014349,https://app.dimensions.ai/details/publication/pub.1008393369,04 Earth Sciences; 0405 Oceanography,04 Earth Sciences,0405 Oceanography,,,
100,400,pub.1025838936,10.1016/s1074-5521(01)00072-2,11731296,,A novel fluorescent silica tracer for biological silicification studies,Cell Chemical Biology,,"Diatoms; Dose-Response Relationship, Drug; Fluorescent Dyes; Hydrogen-Ion Concentration; Microscopy, Fluorescence; Oxazoles; Silicic Acid; Silicon; Silicon Dioxide; Spectrum Analysis",2001-11,2001,8,11,1051-1060,All OA; Gold,Article,"Shimizu, Katsuhiko; Del Amo, Yolanda; Brzezinski, Mark A; Stucky, Galen D; Morse, Daniel E","Morse, Daniel E","Shimizu, Katsuhiko (University of California, Santa Barbara); Del Amo, Yolanda (University of California, Santa Barbara); Brzezinski, Mark A (University of California, Santa Barbara); Stucky, Galen D (University of California, Santa Barbara); Morse, Daniel E (University of California, Santa Barbara)",101,12,1.19,8.54,https://doi.org/10.1016/s1074-5521(01)00072-2,https://app.dimensions.ai/details/publication/pub.1025838936,0305 Organic Chemistry; 0601 Biochemistry and Cell Biology; 0304 Medicinal and Biomolecular Chemistry; 03 Chemical Sciences; 06 Biological Sciences,0305 Organic Chemistry,0601 Biochemistry and Cell Biology,0304 Medicinal and Biomolecular Chemistry,03 Chemical Sciences,06 Biological Sciences
101,400,pub.1030558768,10.1046/j.1365-2818.2001.00887.x,11422673,,Micromechanical and structural properties of a pennate diatom investigated by atomic force microscopy,Journal of Microscopy,,"Diatoms; Elasticity; Mathematics; Microscopy, Atomic Force",2001-06,2001,202,3,518-532,All OA; Gold,Article,"Almqvist, N.; Delamo, Y.; Smith, B. L.; Thomson, N. H.; Bartholdson, Å.; Lal, R.; Brzezinski, M.; Hansma, P. K.",,"Almqvist, N. (Luleå University of Technology; University of California, Santa Barbara); Delamo, Y. (University of Bordeaux); Smith, B. L. (); Thomson, N. H. (University of Leeds); Bartholdson, Å. (Luleå University of Technology); Lal, R. (University of California, Santa Barbara); Brzezinski, M. (); Hansma, P. K. ()",73,9,1.02,19.66,http://onlinelibrary.wiley.com/doi/10.1046/j.1365-2818.2001.00887.x/pdf,https://app.dimensions.ai/details/publication/pub.1030558768,02 Physical Sciences; 0299 Other Physical Sciences,02 Physical Sciences,0299 Other Physical Sciences,,,
102,100,pub.1053378456,10.1029/2000gb001297,,,"A time series study of silica production and flux in an eastern boundary region: Santa Barbara Basin, California",Global Biogeochemical Cycles,,,2001-06,2001,15,2,517-531,All OA; Gold,Article,"Shipe, Rebecca F.; Brzezinski, Mark A.",,"Shipe, Rebecca F. (); Brzezinski, Mark A. ()",31,4,,2.22,https://agupubs.onlinelibrary.wiley.com/doi/pdf/10.1029/2000GB001297,https://app.dimensions.ai/details/publication/pub.1053378456,04 Earth Sciences; 0405 Oceanography,04 Earth Sciences,0405 Oceanography,,,
103,100,pub.1023466889,10.1016/s0278-4343(00)00101-1,,,The origin of transparent exopolymer particles (TEP) and their role in the sedimentation of particulate matter,Continental Shelf Research,,,2001-03,2001,21,4,327-346,"All OA; Green, Published",Article,"Passow, U; Shipe, R.F; Murray, A; Pak, D.K; Brzezinski, M.A; Alldredge, A.L","Passow, U","Passow, U (University of California, Santa Barbara); Shipe, R.F (University of California, Santa Barbara); Murray, A (University of California, Santa Barbara); Pak, D.K (University of California, Santa Barbara); Brzezinski, M.A (University of California, Santa Barbara); Alldredge, A.L (University of California, Santa Barbara)",190,29,,15.27,https://epic.awi.de/id/eprint/6316/1/Pas2001c.pdf,https://app.dimensions.ai/details/publication/pub.1023466889,0602 Ecology; 06 Biological Sciences,0602 Ecology,06 Biological Sciences,,,
104,100,pub.1010282133,10.1016/s0967-0645(01)00076-5,,,A seasonal progression of Si limitation in the Pacific sector of the Southern Ocean,Deep Sea Research Part II Topical Studies in Oceanography,,,2001-01,2001,48,19-20,3973-3995,Closed,Article,"Nelson, David M.; Brzezinski, Mark A.; Sigmon, Daniel E.; Franck, Valerie M.","Nelson, David M.","Nelson, David M. (Oregon State University); Brzezinski, Mark A. (University of California, Santa Barbara); Sigmon, Daniel E. (Oregon State University); Franck, Valerie M. (University of California, Santa Barbara)",95,9,,6.82,,https://app.dimensions.ai/details/publication/pub.1010282133,04 Earth Sciences; 0405 Oceanography,04 Earth Sciences,0405 Oceanography,,,
105,100,pub.1005480797,10.1016/s0967-0645(01)00078-9,,,Silicon dynamics within an intense open-ocean diatom bloom in the Pacific sector of the Southern Ocean,Deep Sea Research Part II Topical Studies in Oceanography,,,2001-01,2001,48,19-20,3997-4018,Closed,Article,"Brzezinski, Mark A.; Nelson, David M.; Franck, Valerie M.; Sigmon, Daniel E.","Brzezinski, Mark A.","Brzezinski, Mark A. (); Nelson, David M. (Oregon State University); Franck, Valerie M. (University of California, Santa Barbara); Sigmon, Daniel E. (Oregon State University)",123,9,,8.82,,https://app.dimensions.ai/details/publication/pub.1005480797,04 Earth Sciences; 0405 Oceanography,04 Earth Sciences,0405 Oceanography,,,
106,100,pub.1000381706,10.1016/s0967-0645(01)00089-3,,,Upper ocean export of particulate organic carbon and biogenic silica in the Southern Ocean along 170°W,Deep Sea Research Part II Topical Studies in Oceanography,,,2001-01,2001,48,19-20,4275-4297,Closed,Article,"Buesseler, K.O.; Ball, L.; Andrews, J.; Cochran, J.K.; Hirschberg, D.J.; Bacon, M.P.; Fleer, A.; Brzezinski, M.","Buesseler, K.O.","Buesseler, K.O. (Woods Hole Oceanographic Institution); Ball, L. (Woods Hole Oceanographic Institution); Andrews, J. (Woods Hole Oceanographic Institution); Cochran, J.K. (Stony Brook University); Hirschberg, D.J. (Stony Brook University); Bacon, M.P. (Woods Hole Oceanographic Institution); Fleer, A. (Woods Hole Oceanographic Institution); Brzezinski, M. (University of California, Santa Barbara)",113,5,,8.11,,https://app.dimensions.ai/details/publication/pub.1000381706,04 Earth Sciences; 0405 Oceanography,04 Earth Sciences,0405 Oceanography,,,
107,100,pub.1026628053,10.1016/s0921-8181(00)00052-7,,,A review of the Si cycle in the modern ocean: recent progress and missing gaps in the application of biogenic opal as a paleoproductivity proxy,Global and Planetary Change,,,2000-12,2000,26,4,317-365,Closed,Article,"Ragueneau, O; Tréguer, P; Leynaert, A; Anderson, R.F; Brzezinski, M.A; DeMaster, D.J; Dugdale, R.C; Dymond, J; Fischer, G; François, R; Heinze, C; Maier-Reimer, E; Martin-Jézéquel, V; Nelson, D.M; Quéguiner, B","Ragueneau, O","Ragueneau, O (European Institute for Marine Studies); Tréguer, P (European Institute for Marine Studies); Leynaert, A (European Institute for Marine Studies); Anderson, R.F (Lamont-Doherty Earth Observatory); Brzezinski, M.A (University of California, Santa Barbara); DeMaster, D.J (North Carolina State University); Dugdale, R.C (San Francisco State University); Dymond, J (Oregon State University); Fischer, G (University of Bremen); François, R (Woods Hole Oceanographic Institution); Heinze, C (Max Planck Society); Maier-Reimer, E (Max Planck Society); Martin-Jézéquel, V (European Institute for Marine Studies); Nelson, D.M (Oregon State University); Quéguiner, B ()",462,38,,28.62,,https://app.dimensions.ai/details/publication/pub.1026628053,04 Earth Sciences; 0405 Oceanography,04 Earth Sciences,0405 Oceanography,,,
108,400,pub.1021694320,10.1007/s002390010111,11080371,,"Evaluation of Sequence Variation and Selection in the Bindin Locus of the Red Sea Urchin, Strongylocentrotus franciscanus",Journal of Molecular Evolution,,"Alleles; Animals; Base Sequence; DNA; Evolution, Molecular; Genetic Variation; Glycoproteins; Molecular Sequence Data; Point Mutation; Polymorphism, Genetic; Receptors, Cell Surface; Sea Urchins; Selection, Genetic; Sequence Alignment; Sequence Analysis, DNA; Sequence Homology, Nucleic Acid",2000-11,2000,51,5,481-490,Closed,Article,"Debenham, Patty; Brzezinski, Mark A.; Foltz, Kathy R.",,"Debenham, Patty (University of California, Santa Barbara); Brzezinski, Mark A. (University of California, Santa Barbara); Foltz, Kathy R. (University of California, Santa Barbara)",19,1,0.38,1.04,,https://app.dimensions.ai/details/publication/pub.1021694320,0604 Genetics; 06 Biological Sciences,0604 Genetics,06 Biological Sciences,,,
109,400,pub.1028044463,10.1016/s0022-0981(00)00242-2,11018236,,"Genetic structure of populations of the red sea urchin, Strongylocentrotus franciscanus",Journal of Experimental Marine Biology and Ecology,,,2000-10,2000,253,1,49-62,Closed,Article,"Debenham, Patty; Brzezinski, Mark; Foltz, Kathy; Gaines, Steven","Debenham, Patty","Debenham, Patty (University of California, Santa Barbara); Brzezinski, Mark (University of California, Santa Barbara); Foltz, Kathy (University of California, Santa Barbara); Gaines, Steven (University of California, Santa Barbara)",23,2,0.19,1.26,,https://app.dimensions.ai/details/publication/pub.1028044463,0604 Genetics; 06 Biological Sciences,0604 Genetics,06 Biological Sciences,,,
110,200,pub.1096086049,10.1142/9789812793867_0044,,,"SILICON-32: DIATOMS, THE SILICON CYCLE, AND THE CLIMATE",,Isotope Production and Applications in the 21st Century,,2000-10,2000,,,193-196,Closed,Proceeding,"PHILLIPS, DENNIS R.; KUDELA, RAPHAEL M.; HAMILTON, VIRGINIA T.; BRZEZINSKI, MARK A.",,"PHILLIPS, DENNIS R. (Los Alamos National Laboratory); KUDELA, RAPHAEL M. (Los Alamos National Laboratory); HAMILTON, VIRGINIA T. (Los Alamos National Laboratory); BRZEZINSKI, MARK A. (University of California, Santa Barbara)",0,0,,,,https://app.dimensions.ai/details/publication/pub.1096086049,,,,,,
111,100,pub.1039061647,10.1046/j.1529-8817.2000.00019.x,,,SILICON METABOLISM IN DIATOMS: IMPLICATIONS FOR GROWTH,Journal of Phycology,,,2000-10,2000,36,5,821-840,Closed,Article,"Martin‐Jézéquel, Véronique; Hildebrand, Mark; Brzezinski, Mark A.",,"Martin‐Jézéquel, Véronique (European Institute for Marine Studies); Hildebrand, Mark (European Institute for Marine Studies); Brzezinski, Mark A. (European Institute for Marine Studies)",516,73,,29.7,,https://app.dimensions.ai/details/publication/pub.1039061647,0604 Genetics; 0601 Biochemistry and Cell Biology; 06 Biological Sciences,0604 Genetics,0601 Biochemistry and Cell Biology,06 Biological Sciences,,
112,100,pub.1016346114,10.1016/s0016-7037(00)00373-2,,,A first look at the distribution of the stable isotopes of silicon in natural waters,Geochimica et Cosmochimica Acta,,,2000-07,2000,64,14,2467-2477,Closed,Article,"De La Rocha, Christina L.; Brzezinski, Mark A.; DeNiro, Michael J.","De La Rocha, Christina L.","De La Rocha, Christina L. (University of California, Santa Barbara); Brzezinski, Mark A. (University of California, Santa Barbara); DeNiro, Michael J. (University of California, Santa Barbara)",211,19,,13.07,,https://app.dimensions.ai/details/publication/pub.1016346114,04 Earth Sciences; 0405 Oceanography,04 Earth Sciences,0405 Oceanography,,,
113,100,pub.1012353898,10.1016/s0967-0645(00)00070-9,,,Iron and silicic acid concentrations regulate Si uptake north and south of the Polar Frontal Zone in the Pacific Sector of the Southern Ocean,Deep Sea Research Part II Topical Studies in Oceanography,,,2000-01,2000,47,15-16,3315-3338,Closed,Article,"Franck, Valerie M.; Brzezinski, Mark A; Coale, Kenneth H; Nelson, David M","Franck, Valerie M.","Franck, Valerie M. (University of California, Santa Barbara); Brzezinski, Mark A (University of California, Santa Barbara); Coale, Kenneth H (California State University Los Angeles); Nelson, David M (Oregon State University)",203,7,,12.58,,https://app.dimensions.ai/details/publication/pub.1012353898,04 Earth Sciences; 0405 Oceanography,04 Earth Sciences,0405 Oceanography,,,
114,200,pub.1071175358,10.3354/meps195071,,,Effects of iron and zinc deficiency on elemental composition and silica production by diatoms,Marine Ecology Progress Series,,,2000,2000,195,,71-79,All OA; Gold,Article,"De La Rocha, CL; Hutchins, DA; Brzezinski, MA; Zhang, Y",,"De La Rocha, CL (); Hutchins, DA (); Brzezinski, MA (); Zhang, Y ()",82,9,,7.21,https://www.int-res.com/articles/meps/195/m195p071.pdf,https://app.dimensions.ai/details/publication/pub.1071175358,0602 Ecology; 0405 Oceanography; 04 Earth Sciences; 06 Biological Sciences; 0608 Zoology,0602 Ecology,0405 Oceanography,04 Earth Sciences,06 Biological Sciences,0608 Zoology
115,100,pub.1052894857,10.1029/00eo00255,,,Academic research fleet faces ship shortage,Eos,,,2000,2000,81,30,334-334,All OA; Gold,Article,"Atkinson, Larry; Brzezinski, Mark; Hebert, David; Measures, Chris; Smethie, Bill; Weingartner, Tom; Coburn, Joseph",,"Atkinson, Larry (Old Dominion University); Brzezinski, Mark (University of California, Santa Barbara); Hebert, David (University of Rhode Island); Measures, Chris (University of Hawaii at Manoa); Smethie, Bill (Lamont-Doherty Earth Observatory); Weingartner, Tom (University of Alaska System); Coburn, Joseph (Woods Hole Oceanographic Institution)",1,0,,0.28,https://agupubs.onlinelibrary.wiley.com/doi/pdf/10.1029/00EO00255,https://app.dimensions.ai/details/publication/pub.1052894857,1402 Applied Economics; 14 Economics,1402 Applied Economics,14 Economics,,,
116,100,pub.1042291458,10.1046/j.1529-8817.1999.3561162.x,,,THE CHEMICAL FORM OF DISSOLVED SI TAKEN UP BY MARINE DIATOMS,Journal of Phycology,,,1999-12,1999,35,6,1162-1170,Closed,Article,"Del Amo, Yolanda; Brzezinski, Mark A.",,"Del Amo, Yolanda (University of California, Santa Barbara); Brzezinski, Mark A. (University of California, Santa Barbara)",80,4,,,,https://app.dimensions.ai/details/publication/pub.1042291458,0602 Ecology; 06 Biological Sciences,0602 Ecology,06 Biological Sciences,,,
117,100,pub.1039423998,10.1046/j.1529-8817.1999.3550995.x,,,A STUDY OF Si DEPOSITION SYNCHRONY IN RHIZOSOLENIA (BACILLARIOPHYCEAE) MATS USING A NOVEL 32Si AUTORADIOGRAPHIC METHOD,Journal of Phycology,,,1999-10,1999,35,5,995-1004,Closed,Article,"Shipe, Rebecca F.; Brzezinski, Mark A.",,"Shipe, Rebecca F. (University of California, Santa Barbara); Brzezinski, Mark A. (University of California, Santa Barbara)",12,2,,,,https://app.dimensions.ai/details/publication/pub.1039423998,0607 Plant Biology; 06 Biological Sciences,0607 Plant Biology,06 Biological Sciences,,,
118,100,pub.1025180111,10.1046/j.1529-8817.1999.3550896.x,,,BIOLOGICAL AND CHEMICAL CHARACTERISTICS OF THE GIANT DIATOM ETHMODISCUS (BACILLARIOPHYCEAE) IN THE CENTRAL NORTH PACIFIC GYRE,Journal of Phycology,,,1999-10,1999,35,5,896-902,Closed,Article,"Villareal, Tracy A.; Joseph, Leanne; Brzezinski, Mark A.; Shipe, Rebecca F.; Lipschultz, Fredric; Altabet, Mark A.",,"Villareal, Tracy A. (The University of Texas at Austin); Joseph, Leanne (University of Massachusetts Boston); Brzezinski, Mark A. (University of California, Santa Barbara); Shipe, Rebecca F. (University of California, Santa Barbara); Lipschultz, Fredric (Bermuda Institute of Ocean Sciences); Altabet, Mark A. (University of Massachusetts Dartmouth)",39,6,,,,https://app.dimensions.ai/details/publication/pub.1025180111,0607 Plant Biology; 06 Biological Sciences,0607 Plant Biology,06 Biological Sciences,,,
119,100,pub.1030954245,10.4319/lo.1999.44.5.1282,,,Rhizosolenia mats: An overlooked source of silica production in the open sea,Limnology and Oceanography,,,1999-07,1999,44,5,1282-1292,All OA; Gold,Article,"Shipe, Rebecca F.; Brzezinski, Mark A.; Pilskaln, Cynthia; Villareal, Tracy A.",,"Shipe, Rebecca F. (University of California, Santa Barbara); Brzezinski, Mark A. (University of California, Santa Barbara); Pilskaln, Cynthia (University of Maine); Villareal, Tracy A. (The University of Texas at Austin)",22,3,,,http://onlinelibrary.wiley.com/doi/10.4319/lo.1999.44.5.1282/pdf,https://app.dimensions.ai/details/publication/pub.1030954245,04 Earth Sciences; 0405 Oceanography,04 Earth Sciences,0405 Oceanography,,,
120,100,pub.1040834374,10.4319/lo.1999.44.4.1009,,,Inducing phytoplankton iron limitation in iron‐replete coastal waters with a strong chelating ligand,Limnology and Oceanography,,,1999-06,1999,44,4,1009-1018,All OA; Gold,Article,"Hutchins, D. A.; Franck, V. M.; Brzezinski, M. A.; Bruland, K. W.",,"Hutchins, D. A. (University of Delaware); Franck, V. M. (University of California, Santa Barbara); Brzezinski, M. A. (University of California, Santa Barbara); Bruland, K. W. (University of California, Santa Cruz)",81,5,,,https://aslopubs.onlinelibrary.wiley.com/doi/pdf/10.4319/lo.1999.44.4.1009,https://app.dimensions.ai/details/publication/pub.1040834374,04 Earth Sciences; 0405 Oceanography,04 Earth Sciences,0405 Oceanography,,,
121,100,pub.1020640670,10.1007/s002270050515,,,Neutral lipids in macroalgal spores and their role in swimming,Marine Biology,,,1999-05,1999,133,4,737-744,Closed,Article,"Reed, D. C.; Brzezinski, M. A.; Coury, D. A.; Graham, W. M.; Petty, R. L.",,"Reed, D. C. (University of California, Santa Barbara); Brzezinski, M. A. (University of California, Santa Barbara); Coury, D. A. (University of California, Santa Barbara); Graham, W. M. (Dauphin Island Sea Lab); Petty, R. L. (University of California, Santa Barbara)",38,4,,,,https://app.dimensions.ai/details/publication/pub.1020640670,0607 Plant Biology; 06 Biological Sciences,0607 Plant Biology,06 Biological Sciences,,,
122,400,pub.1029292476,10.1038/17103,29667969,,Upward transport of oceanic nitrate by migrating diatom mats,Nature,,,1999-02,1999,397,6718,423-425,Closed,Article,"Villareal, Tracy A.; Pilskaln, Cynthia; Brzezinski, Mark; Lipschultz, Fredric; Dennett, Mark; Gardner, George B.","Villareal, Tracy A.","Villareal, Tracy A. (The University of Texas at Austin); Pilskaln, Cynthia (University of Maine); Brzezinski, Mark (University of California, Santa Barbara); Lipschultz, Fredric (Bermuda Institute of Ocean Sciences); Dennett, Mark (Woods Hole Oceanographic Institution); Gardner, George B. ()",104,5,0.27,,,https://app.dimensions.ai/details/publication/pub.1029292476,04 Earth Sciences; 0405 Oceanography,04 Earth Sciences,0405 Oceanography,,,
