,"""About the data: Exported on Nov 01, 2019. Criteria: Researcher is Susannah M Porter. © 2019 Digital Science and Research Solutions Inc. All rights reserved. Unless otherwise agreed, redistribution / external use of this work is not permitted.""
",Unnamed: 1,Unnamed: 2,Unnamed: 3,Unnamed: 4,Unnamed: 5,Unnamed: 6,Unnamed: 7,Unnamed: 8,Unnamed: 9,Unnamed: 10,Unnamed: 11,Unnamed: 12,Unnamed: 13,Unnamed: 14,Unnamed: 15,Unnamed: 16,Unnamed: 17,Unnamed: 18,Unnamed: 19,Unnamed: 20,Unnamed: 21,Unnamed: 22,Unnamed: 23,Unnamed: 24,Unnamed: 25,Unnamed: 26,Unnamed: 27,Unnamed: 28,Unnamed: 29,Unnamed: 30
0,Rank,Publication ID,DOI,PMID,PMCID,Title,Source title,Anthology title,MeSH terms,Publication Date,PubYear,Volume,Issue,Pagination,Open Access,Publication Type,Authors,Corresponding Author,Authors Affiliations,Times cited,Recent citations,RCR,FCR,Source Linkout,Dimensions URL,FOR (ANZSRC) Categories,FOR 1,FOR 2,FOR 3,FOR 4,FOR 5
1,100,pub.1112994152,10.1017/jpa.2019.6,,,Insights into vase-shaped microfossil diversity and Neoproterozoic biostratigraphy in light of recent Brazilian discoveries,Journal of Paleontology,,,2019-07,2019,93,4,612-627,Closed,Article,"Morais, L.; Lahr, D.J.G.; Rudnitzki, I.D.; Freitas, B.T.; Romero, G.R.; Porter, S.M.; Knoll, A.H.; Fairchild, T.R.",,"Morais, L. (University of Sao Paulo); Lahr, D.J.G. (University of Sao Paulo); Rudnitzki, I.D. (University of Sao Paulo; Federal University of Ouro Preto); Freitas, B.T. (State University of Campinas); Romero, G.R. (Federal University of Para); Porter, S.M. (University of California System); Knoll, A.H. (Harvard University); Fairchild, T.R. (University of Sao Paulo)",0,0,,,,https://app.dimensions.ai/details/publication/pub.1112994152,0602 Ecology; 06 Biological Sciences,0602 Ecology,06 Biological Sciences,,,
2,300,pub.1112845156,10.1016/j.cub.2019.02.003,30889393,,Evolution: Ancient Fossilized Amoebae Find Their Home in the Tree,Current Biology,,,2019-03,2019,29,6,r212-r215,Closed,Article,"Porter, Susannah M.; Riedman, Leigh Anne","Porter, Susannah M.","Porter, Susannah M. (University of California, Santa Barbara); Riedman, Leigh Anne (University of California, Santa Barbara)",1,1,,,,https://app.dimensions.ai/details/publication/pub.1112845156,17 Psychology and Cognitive Sciences; 11 Medical and Health Sciences; 06 Biological Sciences,17 Psychology and Cognitive Sciences,11 Medical and Health Sciences,06 Biological Sciences,,
3,100,pub.1106290944,10.1016/j.precamres.2018.08.015,,,Descent into the Cryogenian,Precambrian Research,,,2018-12,2018,319,Precambrian Res 2017,1-5,Closed,Article,"Shields, Graham A.; Halverson, Galen P.; Porter, Susannah M.","Shields, Graham A.","Shields, Graham A. (University College London); Halverson, Galen P. (McGill University); Porter, Susannah M. (University of California, Santa Barbara)",1,1,,,,https://app.dimensions.ai/details/publication/pub.1106290944,04 Earth Sciences; 0403 Geology,04 Earth Sciences,0403 Geology,,,
4,100,pub.1091884974,10.1016/j.precamres.2017.09.019,,,"Vase-shaped microfossil biostratigraphy with new data from Tasmania, Svalbard, Greenland, Sweden and the Yukon",Precambrian Research,,,2018-12,2018,319,J. Eukaryot. Microbiol. 59 5 2012,19-36,Closed,Article,"Riedman, Leigh Anne; Porter, Susannah M.; Calver, Clive R.","Riedman, Leigh Anne","Riedman, Leigh Anne (Harvard University); Porter, Susannah M. (University of California System); Calver, Clive R. (University of Tasmania)",14,14,,,,https://app.dimensions.ai/details/publication/pub.1091884974,04 Earth Sciences; 0403 Geology,04 Earth Sciences,0403 Geology,,,
5,100,pub.1107297763,10.1042/etls20180093,,,Early Earth and the rise of complex life,Emerging Topics in Life Sciences,,,2018-09-28,2018,2,2,121-124,All OA; Gold,Article,"Lyons, Timothy W.; Droser, Mary L.; Lau, Kimberly V.; Porter, Susannah M.",,"Lyons, Timothy W. (); Droser, Mary L. (); Lau, Kimberly V. (); Porter, Susannah M. (University of California, Santa Barbara)",0,0,,,http://www.emergtoplifesci.org/content/ppetls/2/2/121.full.pdf,https://app.dimensions.ai/details/publication/pub.1107297763,04 Earth Sciences; 0403 Geology; 0402 Geochemistry,04 Earth Sciences,0403 Geology,0402 Geochemistry,,
6,100,pub.1105584653,10.1042/etls20170167,,,Dating the late Proterozoic stratigraphic record,Emerging Topics in Life Sciences,,,2018-09-28,2018,2,2,137-147,All OA; Gold,Article,"Halverson, Galen P.; Porter, Susannah M.; Gibson, Timothy M.",,"Halverson, Galen P. (McGill University; Curtin University); Porter, Susannah M. (University of California, Santa Barbara); Gibson, Timothy M. (McGill University)",5,5,,,http://www.emergtoplifesci.org/content/ppetls/2/2/137.full.pdf,https://app.dimensions.ai/details/publication/pub.1105584653,04 Earth Sciences; 0403 Geology,04 Earth Sciences,0403 Geology,,,
7,100,pub.1105584652,10.1042/etls20170162,,,Anoxic ecosystems and early eukaryotes,Emerging Topics in Life Sciences,,,2018-09-28,2018,2,2,299-309,All OA; Gold,Article,"Porter, Susannah M.; Agić, Heda; Riedman, Leigh Anne",,"Porter, Susannah M. (University of California, Santa Barbara); Agić, Heda (University of California, Santa Barbara); Riedman, Leigh Anne (University of California, Santa Barbara)",8,8,,,http://www.emergtoplifesci.org/content/ppetls/2/2/299.full.pdf,https://app.dimensions.ai/details/publication/pub.1105584652,04 Earth Sciences; 0403 Geology,04 Earth Sciences,0403 Geology,,,
8,100,pub.1101356357,10.1111/pala.12352,,,"Plywood‐like shell microstructures in hyoliths from the middle Cambrian (Drumian) Gowers Formation, Georgina Basin, Australia",Palaeontology,,,2018-05,2018,61,3,441-467,Closed,Article,"Moore, J. L.; Porter, Susannah M.",,"Moore, J. L. (University of California, Santa Barbara); Porter, Susannah M. (University of California, Santa Barbara)",5,5,,,,https://app.dimensions.ai/details/publication/pub.1101356357,04 Earth Sciences; 0403 Geology,04 Earth Sciences,0403 Geology,,,
9,200,pub.1110408307,10.1130/abs/2018am-322538,,,TOTAL ORGANIC CARBON AND THE PRESERVATION OF PRECAMBRIAN ORGANIC-WALLED MICROFOSSILS IN SHALES,Abstracts with programs (Geological Society of America),,,2018,2018,,,,Closed,Proceeding,"Woltz, Christina R.; Porter, Susannah M.; Dehler, Carol M.; Junium, Christopher K.; Hodgskiss, Malcolm S.W.; Wörndle, Sarah; Halverson, Galen P.",,"Woltz, Christina R. (); Porter, Susannah M. (); Dehler, Carol M. (); Junium, Christopher K. (); Hodgskiss, Malcolm S.W. (); Wörndle, Sarah (); Halverson, Galen P. ()",0,0,,,,https://app.dimensions.ai/details/publication/pub.1110408307,,,,,,
10,100,pub.1083938028,10.1130/b31532.1,,,"Synthesis of the 780–740 Ma Chuar, Uinta Mountain, and Pahrump (ChUMP) groups, western USA: Implications for Laurentia-wide cratonic marine basins",Geological Society of America Bulletin,,,2017-05,2017,129,5-6,607-624,Closed,Article,"Dehler, Carol; Gehrels, George; Porter, Susannah; Heizler, Matt; Karlstrom, Karl; Cox, Grant; Crossey, Laura; Timmons, Mike",,"Dehler, Carol (Utah State University); Gehrels, George (University of Arizona); Porter, Susannah (University of California, Santa Barbara); Heizler, Matt (New Mexico Institute of Mining and Technology); Karlstrom, Karl (University of New Mexico); Cox, Grant (University of Adelaide); Crossey, Laura (University of New Mexico); Timmons, Mike (New Mexico Institute of Mining and Technology)",14,13,,5,,https://app.dimensions.ai/details/publication/pub.1083938028,04 Earth Sciences; 0403 Geology; 0402 Geochemistry,04 Earth Sciences,0403 Geology,0402 Geochemistry,,
11,200,pub.1099587856,10.1130/abs/2017am-297654,,,"ORGANIC-WALLED MICROFOSSILS FROM THE ~1 GA BYLOT SUPERGROUP, BAFFIN ISLAND",Abstracts with programs (Geological Society of America),,,2017,2017,,,,Closed,Proceeding,"Agić, Heda; Porter, Susannah M.; Wörndle, Sarah; Gibson, Timothy M.; Crockford, Peter W.; Kunzmann, Marcus; Halverson, Galen P.",,"Agić, Heda (); Porter, Susannah M. (); Wörndle, Sarah (); Gibson, Timothy M. (); Crockford, Peter W. (); Kunzmann, Marcus (); Halverson, Galen P. ()",0,0,,,,https://app.dimensions.ai/details/publication/pub.1099587856,,,,,,
12,100,pub.1028341491,10.1017/jpa.2016.49,,,"Organic-walled microfossils of the mid-Neoproterozoic Alinya Formation, Officer Basin, Australia",Journal of Paleontology,,,2016-09,2016,90,5,854-887,Closed,Article,"Riedman, Leigh Anne; Porter, Susannah",,"Riedman, Leigh Anne (University of California, Santa Barbara; Harvard University); Porter, Susannah (University of California, Santa Barbara)",18,10,,4.67,,https://app.dimensions.ai/details/publication/pub.1028341491,0602 Ecology; 06 Biological Sciences,0602 Ecology,06 Biological Sciences,,,
13,100,pub.1005547921,10.1017/jpa.2016.57,,,"Systematics of organic-walled microfossils from the ca. 780740 Ma Chuar Group, Grand Canyon, Arizona",Journal of Paleontology,,,2016-09,2016,90,5,815-853,Closed,Article,"Porter, Susannah M.; Riedman, Leigh Anne",,"Porter, Susannah M. (University of California, Santa Barbara); Riedman, Leigh Anne (University of California, Santa Barbara; Harvard University)",26,15,,6.96,,https://app.dimensions.ai/details/publication/pub.1005547921,04 Earth Sciences; 0403 Geology,04 Earth Sciences,0403 Geology,,,
14,400,pub.1027145686,10.1098/rspb.2016.0221,27194696,PMC4892792,"Tiny vampires in ancient seas: evidence for predation via perforation in fossils from the 780–740 million-year-old Chuar Group, Grand Canyon, USA",Proceedings of The Royal Society B Biological Sciences,,"Arizona; Biological Evolution; Eukaryota; Food Chain; Fossils; Microscopy, Electron, Scanning; Microscopy, Electron, Transmission; Oceans and Seas",2016-05-25,2016,283,1831,20160221,"All OA; Green, Published",Article,"Porter, Susannah M",,"Porter, Susannah M (University of California, Santa Barbara)",28,18,1.11,,http://europepmc.org/articles/pmc4892792?pdf=render,https://app.dimensions.ai/details/publication/pub.1027145686,11 Medical and Health Sciences; 06 Biological Sciences; 07 Agricultural and Veterinary Sciences,11 Medical and Health Sciences,06 Biological Sciences,07 Agricultural and Veterinary Sciences,,
15,200,pub.1068697345,10.18814/epiiugs/2016/v39i1/89231,,,A new rock-based definition for the Cryogenian Period (circa 720 – 635 Ma),Episodes,,,2016-03-01,2016,39,1,3-8,"All OA; Green, Accepted & Submitted",Article,"Shields-Zhou, Graham A.; Porter, Susannah; Halverson, Galen P.",,"Shields-Zhou, Graham A. (); Porter, Susannah (); Halverson, Galen P. ()",44,29,,11.78,http://discovery.ucl.ac.uk/1496826/1/Shields-Zhou%20et%20al%20%282016%29%20Cryogenian%20Period.pdf,https://app.dimensions.ai/details/publication/pub.1068697345,04 Earth Sciences; 0403 Geology,04 Earth Sciences,0403 Geology,,,
16,100,pub.1072096303,10.4028/www.scientific.net/kem.672.113,,,To Infer the early Evolution of Mollusc Shell Microstructures,,,,2016-01,2016,672,,113-133,Closed,Article,"Vendrasco, Michael J.; Rodríguez-Navarro, Alejandro B.; Checa, Antonio G.; Devaere, Léa; Porter, Susannah M.",,"Vendrasco, Michael J. (); Rodríguez-Navarro, Alejandro B. (); Checa, Antonio G. (); Devaere, Léa (University of Lille); Porter, Susannah M. (University of California System)",7,5,,1.87,,https://app.dimensions.ai/details/publication/pub.1072096303,04 Earth Sciences; 0403 Geology,04 Earth Sciences,0403 Geology,,,
17,100,pub.1014445539,10.1130/g35901.1,,,Organic-walled microfossil assemblages from glacial and interglacial Neoproterozoic units of Australia and Svalbard,Geology,,,2014-11,2014,42,11,1011-1014,Closed,Article,"Riedman, Leigh Anne; Porter, Susannah M.; Halverson, Galen P.; Hurtgen, Matthew T.; Junium, Christopher K.",,"Riedman, Leigh Anne (University of California, Santa Barbara); Porter, Susannah M. (University of California, Santa Barbara); Halverson, Galen P. (McGill University); Hurtgen, Matthew T. (Northwestern University); Junium, Christopher K. (Syracuse University)",28,9,,4.04,,https://app.dimensions.ai/details/publication/pub.1014445539,04 Earth Sciences; 0402 Geochemistry,04 Earth Sciences,0402 Geochemistry,,,
18,100,pub.1024975504,10.1111/pala.12090,,,"Chancelloriid sclerites from the Lower Cambrian (Meishucunian) of eastern Yunnan, China, and the early history of the group",Palaeontology,,,2014-07,2014,57,4,833-878,Closed,Article,"Moore, John L.; Li, Guoxiang; Porter, Susannah M.",,"Moore, John L. (University of California, Santa Barbara); Li, Guoxiang (Chinese Academy of Sciences); Porter, Susannah M. (University of California, Santa Barbara)",9,5,,1.52,,https://app.dimensions.ai/details/publication/pub.1024975504,04 Earth Sciences; 0403 Geology,04 Earth Sciences,0403 Geology,,,
19,100,pub.1053431121,10.1666/13-065,,,"Two Unusual Small Shelly Fossils from the Lower Cambrian of Southeastern Shaanxi Province, China",Journal of Paleontology,,,2014-03,2014,88,2,348-358,Closed,Article,"Moore, John L.; Porter, Susannah M.; Li, Guoxiang",,"Moore, John L. (University of California, Santa Barbara); Porter, Susannah M. (University of California, Santa Barbara); Li, Guoxiang (Nanjing Institute of Geology and Paleontology)",1,0,,0.19,,https://app.dimensions.ai/details/publication/pub.1053431121,04 Earth Sciences; 0403 Geology; 06 Biological Sciences; 0603 Evolutionary Biology,04 Earth Sciences,0403 Geology,06 Biological Sciences,0603 Evolutionary Biology,
20,200,pub.1088810710,10.1130/2012.2489(03),,,The Neoproterozoic Earth system revealed from the Chuar Group of Grand Canyon,Geological Society of America Special Papers,Grand Canyon Geology: Two Billion Years of Earth's History,,2012-11,2012,489,,49-72,Closed,Chapter,"Dehler, Carol M.; Porter, Susannah M.; Timmons, J. Michael",,"Dehler, Carol M. (); Porter, Susannah M. (); Timmons, J. Michael ()",5,0,,,,https://app.dimensions.ai/details/publication/pub.1088810710,,,,,,
21,200,pub.1002625789,10.1130/focus062011.1,,,The rise of predators,Geology,,,2011-06,2011,39,6,607-608,All OA; Gold,Article,"Porter, Susannah",,"Porter, Susannah (University of California, Santa Barbara)",50,20,,,https://pubs.geoscienceworld.org/gsa/geology/article-pdf/39/6/607/3541164/607.pdf,https://app.dimensions.ai/details/publication/pub.1002625789,04 Earth Sciences,04 Earth Sciences,,,,
22,100,pub.1038372445,10.1130/b30346.1,,,The earliest Cambrian record of animals and ocean geochemical change,Geological Society of America Bulletin,,,2010-11-01,2010,122,11-12,1731-1774,Closed,Article,"Maloof, Adam C.; Porter, Susannah M.; Moore, John L.; Dudás, Frank Ö.; Bowring, Samuel A.; Higgins, John A.; Fike, David A.; Eddy, Michael P.",,"Maloof, Adam C. (Princeton University); Porter, Susannah M. (University of California, Santa Barbara); Moore, John L. (University of California, Santa Barbara); Dudás, Frank Ö. (Massachusetts Institute of Technology); Bowring, Samuel A. (Massachusetts Institute of Technology); Higgins, John A. (Princeton University); Fike, David A. (Washington University in St. Louis); Eddy, Michael P. (Princeton University)",189,54,,19.69,,https://app.dimensions.ai/details/publication/pub.1038372445,04 Earth Sciences; 0403 Geology,04 Earth Sciences,0403 Geology,,,
23,100,pub.1011079924,10.1666/09-091.1,,,"Cambrothyra ampulliformis, an unusual coeloscleritophoran from the Lower Cambrian of Shaanxi Province, China",Journal of Paleontology,,,2010-11,2010,84,6,1040-1060,Closed,Article,"Moore, John L.; Porter, Susannah M.; Steiner, Michael; Li, Guoxiang",,"Moore, John L. (University of California, Santa Barbara); Porter, Susannah M. (University of California, Santa Barbara); Steiner, Michael (Free University of Berlin); Li, Guoxiang (Nanjing Institute of Geology and Paleontology)",8,2,,0.83,,https://app.dimensions.ai/details/publication/pub.1011079924,04 Earth Sciences; 0403 Geology,04 Earth Sciences,0403 Geology,,,
24,100,pub.1062734183,10.1130/g30726.1,,,"Constraints on early Cambrian carbon cycling from the duration of the Nemakit-Daldynian–Tommotian boundary δ13C shift, Morocco",Geology,,,2010-07,2010,38,7,623-626,Closed,Article,"Maloof, Adam C.; Ramezani, Jahandar; Bowring, Samuel A.; Fike, David A.; Porter, Susannah M.; Mazouad, Mohamed",,"Maloof, Adam C. (Princeton University); Ramezani, Jahandar (Massachusetts Institute of Technology); Bowring, Samuel A. (Massachusetts Institute of Technology); Fike, David A. (Washington University in St. Louis); Porter, Susannah M. (University of California, Santa Barbara); Mazouad, Mohamed (University of Hassan II Casablanca)",66,17,,6.87,,https://app.dimensions.ai/details/publication/pub.1062734183,04 Earth Sciences; 0403 Geology,04 Earth Sciences,0403 Geology,,,
25,100,pub.1005415450,10.1016/j.epsl.2009.11.059,,,"An emerging picture of Neoproterozoic ocean chemistry: Insights from the Chuar Group, Grand Canyon, USA",Earth and Planetary Science Letters,,,2010-02-15,2010,290,1-2,64-73,"All OA; Green, Accepted & Submitted",Article,"Johnston, David T.; Poulton, Simon W.; Dehler, Carol; Porter, Susannah; Husson, Jon; Canfield, Donald E.; Knoll, Andrew H.","Johnston, David T.","Johnston, David T. (Harvard University); Poulton, Simon W. (Newcastle University); Dehler, Carol (Utah State University); Porter, Susannah (University of California, Santa Barbara); Husson, Jon (Harvard University); Canfield, Donald E. (University of Southern Denmark); Knoll, Andrew H. (Harvard University)",137,27,,13.1,https://dash.harvard.edu/bitstream/1/10059265/1/Johnston%20et%20al%20EPSL%202010%20final%20ms.pdf,https://app.dimensions.ai/details/publication/pub.1005415450,04 Earth Sciences; 0402 Geochemistry,04 Earth Sciences,0402 Geochemistry,,,
26,100,pub.1050987612,10.1111/j.1475-4983.2009.00922.x,,,"New data on molluscs and their shell microstructures from the Middle Cambrian Gowers Formation, Australia",Palaeontology,,,2010-01,2010,53,1,97-135,All OA; Gold,Article,"VENDRASCO, MICHAEL J.; PORTER, SUSANNAH M.; KOUCHINSKY, ARTEM; LI, GUOXIANG; FERNANDEZ, CHRISTINE Z.",,"VENDRASCO, MICHAEL J. (University of California, Santa Barbara); PORTER, SUSANNAH M. (University of California, Santa Barbara); KOUCHINSKY, ARTEM (); LI, GUOXIANG (Nanjing Institute of Geology and Paleontology); FERNANDEZ, CHRISTINE Z. ()",33,11,,3.44,https://onlinelibrary.wiley.com/doi/pdf/10.1111/j.1475-4983.2009.00922.x,https://app.dimensions.ai/details/publication/pub.1050987612,04 Earth Sciences; 0403 Geology,04 Earth Sciences,0403 Geology,,,
27,100,pub.1034504277,10.1111/j.1475-4983.2009.00913.x,,,New data on the enigmatic Ocruranus–Eohalobia group of Early Cambrian small skeletal fossils,Palaeontology,,,2009-11,2009,52,6,1373-1396,All OA; Gold,Article,"VENDRASCO, MICHAEL J.; LI, GUOXIANG; PORTER, SUSANNAH M.; FERNANDEZ, CHRISTINE Z.",,"VENDRASCO, MICHAEL J. (University of California, Santa Barbara); LI, GUOXIANG (Nanjing Institute of Geology and Paleontology); PORTER, SUSANNAH M. (University of California, Santa Barbara); FERNANDEZ, CHRISTINE Z. ()",19,3,,3.48,https://onlinelibrary.wiley.com/doi/pdf/10.1111/j.1475-4983.2009.00913.x,https://app.dimensions.ai/details/publication/pub.1034504277,04 Earth Sciences; 0403 Geology,04 Earth Sciences,0403 Geology,,,
28,100,pub.1005144620,10.1038/ngeo525,,,Biotic turnover driven by eutrophication before the Sturtian low-latitude glaciation,Nature Geoscience,,,2009-06,2009,2,6,415-418,Closed,Article,"Nagy, Robin M.; Porter, Susannah M.; Dehler, Carol M.; Shen, Yanan","Porter, Susannah M.","Nagy, Robin M. (University of California, Santa Barbara); Porter, Susannah M. (University of California, Santa Barbara); Dehler, Carol M. (Utah State University); Shen, Yanan (University of Quebec at Montreal)",47,9,,8.61,,https://app.dimensions.ai/details/publication/pub.1005144620,04 Earth Sciences; 0403 Geology,04 Earth Sciences,0403 Geology,,,
29,100,pub.1046399580,10.1016/s0166-2635(09)01625-9,,,Chapter 10 Neoproterozoic-Cambrian Biogeochemical Evolution,Developments in Precambrian Geology,"Neoproterozoic-Cambrian Tectonics, Global Change And Evolution: A Focus On South Western Gondwana",,2009,2009,16,,351-365,Closed,Chapter,"Halverson, Galen P.; Hurtgen, Matthew T.; Porter, Susannah M.; Collins, Alan S.",,"Halverson, Galen P. (University of Adelaide); Hurtgen, Matthew T. (Northwestern University); Porter, Susannah M. (University of California, Santa Barbara); Collins, Alan S. (University of Adelaide)",31,5,,4.15,,https://app.dimensions.ai/details/publication/pub.1046399580,04 Earth Sciences; 0403 Geology; 0402 Geochemistry,04 Earth Sciences,0403 Geology,0402 Geochemistry,,
30,100,pub.1035444419,10.1111/j.1475-4983.2008.00792.x,,,SKELETAL MICROSTRUCTURE INDICATES CHANCELLORIIDS AND HALKIERIIDS ARE CLOSELY RELATED,Palaeontology,,,2008-07,2008,51,4,865-879,All OA; Gold,Article,"PORTER, SUSANNAH M.",,"PORTER, SUSANNAH M. (University of California, Santa Barbara)",30,10,,2.96,https://onlinelibrary.wiley.com/doi/pdf/10.1111/j.1475-4983.2008.00792.x,https://app.dimensions.ai/details/publication/pub.1035444419,04 Earth Sciences; 0403 Geology,04 Earth Sciences,0403 Geology,,,
31,400,pub.1062455109,10.1126/science.1137284,17540895,,Seawater Chemistry and Early Carbonate Biomineralization,Science,,"Animals; Biological Evolution; Calcification, Physiologic; Calcium; Calcium Carbonate; Chemical Precipitation; Crystallization; Fossils; Invertebrates; Magnesium; Seawater",2007-06-01,2007,316,5829,1302-1302,Closed,Article,"Porter, Susannah M.",,"Porter, Susannah M. (University of California, Santa Barbara)",121,16,0.94,12.57,,https://app.dimensions.ai/details/publication/pub.1062455109,04 Earth Sciences; 0403 Geology,04 Earth Sciences,0403 Geology,,,
32,200,pub.1022449615,10.1007/1-4020-5202-2_1,,,The Proterozoic Fossil Record of Heterotrophic Eukaryotes,Topics in Geobiology,Neoproterozoic Geobiology and Paleobiology,,2006,2006,27,,1-21,Closed,Chapter,"Porter, Susannah M.",,"Porter, Susannah M. (University of California, Santa Barbara)",35,4,,,,https://app.dimensions.ai/details/publication/pub.1022449615,,,,,,
33,200,pub.1088803661,10.1130/2005.fld006(01),,,"Neoproterozoic Uinta Mountain Group of northeastern Utah: Pre-Sturtian geographic, tectonic, and biologic evolution",,GSA Field Guide 6: Interior Western United States,,2005,2005,6,,1-25,Closed,Chapter,"Dehler, Carol M.; Sprinkel, Douglas A.; Porter, Susannah M.",,"Dehler, Carol M. (); Sprinkel, Douglas A. (); Porter, Susannah M. ()",3,0,,,,https://app.dimensions.ai/details/publication/pub.1088803661,,,,,,
34,100,pub.1046721604,10.1666/0022-3360(2004)078<0574:himcpl>2.0.co;2,,,Halkieriids in Middle Cambrian phosphatic limestones from Australia,Journal of Paleontology,,,2004-05,2004,78,3,574-590,"All OA; Green, Accepted & Submitted",Article,"Porter, Susannah M.",,"Porter, Susannah M. (Harvard University)",36,5,,3.22,http://www.geol.ucsb.edu/faculty/porter/Papers/Porter_2004_halkieriids.pdf,https://app.dimensions.ai/details/publication/pub.1046721604,04 Earth Sciences; 0403 Geology,04 Earth Sciences,0403 Geology,,,
35,100,pub.1012232083,10.1016/j.precamres.2003.10.015,,,"Chemostratigraphy of Neoproterozoic cap carbonates from the Volta Basin, West Africa",Precambrian Research,,,2004-04,2004,130,1-4,99-112,Closed,Article,"Porter, Susannah M.; Knoll, Andrew H.; Affaton, Pascal","Porter, Susannah M.","Porter, Susannah M. (University of California, Santa Barbara); Knoll, Andrew H. (Harvard University); Affaton, Pascal (Centre for Research and Teaching in Environmental Geoscience)",48,4,,4.17,,https://app.dimensions.ai/details/publication/pub.1012232083,04 Earth Sciences; 0403 Geology; 0402 Geochemistry,04 Earth Sciences,0403 Geology,0402 Geochemistry,,
36,100,pub.1004189313,10.1669/0883-1351(2004)019<0178:ctpwtf>2.0.co;2,,,Closing the Phosphatization Window: Testing for the Influence of Taphonomic Megabias on the Pattern of Small Shelly Fossil Decline,Palaios,,,2004-04,2004,29,3,,Closed,Article,"PORTER, SUSANNAH M.",,"PORTER, SUSANNAH M. ()",0,0,,0,,https://app.dimensions.ai/details/publication/pub.1004189313,04 Earth Sciences; 0403 Geology,04 Earth Sciences,0403 Geology,,,
37,100,pub.1034736751,10.1666/0022-3360(2003)077<0409:vmftnc>2.0.co;2,,,"VASE-SHAPED MICROFOSSILS FROM THE NEOPROTEROZOIC CHUAR GROUP, GRAND CANYON: A CLASSIFICATION GUIDED BY MODERN TESTATE AMOEBAE",Journal of Paleontology,,,2003-05,2003,77,3,409-429,"All OA; Green, Published",Article,"PORTER, SUSANNAH M.; MEISTERFELD, RALF; KNOLL, ANDREW H.",,"PORTER, SUSANNAH M. (Harvard University; University of California, Santa Barbara); MEISTERFELD, RALF (); KNOLL, ANDREW H. (Harvard University)",92,5,,6.76,http://www.geol.ucsb.edu/faculty/porter/Papers/Porteretal2003_VSMs.pdf,https://app.dimensions.ai/details/publication/pub.1034736751,0602 Ecology; 06 Biological Sciences,0602 Ecology,06 Biological Sciences,,,
38,100,pub.1026472457,10.1017/s0022336000044140,,,"Vase-shaped microfossils from the Neoproterozoic Chuar Group, Grand Canyon: A classification guided by modern testate amoebae",Journal of Paleontology,,,2003-05,2003,77,3,409-429,"All OA; Green, Published",Article,"Porter, Susannah M.; Meisterfeld, Ralf; Knoll, Andrew H.",,"Porter, Susannah M. (Harvard University); Meisterfeld, Ralf (); Knoll, Andrew H. (Harvard University)",125,22,,9.18,http://www.geol.ucsb.edu/faculty/porter/Papers/Porteretal2003_VSMs.pdf,https://app.dimensions.ai/details/publication/pub.1026472457,0602 Ecology; 06 Biological Sciences,0602 Ecology,06 Biological Sciences,,,
39,100,pub.1039708295,10.1666/0094-8373(2000)026<0360:taitne>2.0.co;2,,,"Testate amoebae in the Neoproterozoic Era: evidence from vase-shaped microfossils in the Chuar Group, Grand Canyon",Paleobiology,,,2000-09,2000,26,3,360-385,"All OA; Green, Published",Article,"Porter, Susannah M.; Knoll, Andrew H.",,"Porter, Susannah M. (Harvard University); Knoll, Andrew H. (Harvard University)",214,25,,15.97,http://www.geol.ucsb.edu/faculty/porter/Papers/PorterKnoll2000.pdf,https://app.dimensions.ai/details/publication/pub.1039708295,0602 Ecology; 06 Biological Sciences,0602 Ecology,06 Biological Sciences,,,
