,"""About the data: Exported on Nov 01, 2019. Criteria: Researcher is Christina L Tague. © 2019 Digital Science and Research Solutions Inc. All rights reserved. Unless otherwise agreed, redistribution / external use of this work is not permitted.""
",Unnamed: 1,Unnamed: 2,Unnamed: 3,Unnamed: 4,Unnamed: 5,Unnamed: 6,Unnamed: 7,Unnamed: 8,Unnamed: 9,Unnamed: 10,Unnamed: 11,Unnamed: 12,Unnamed: 13,Unnamed: 14,Unnamed: 15,Unnamed: 16,Unnamed: 17,Unnamed: 18,Unnamed: 19,Unnamed: 20,Unnamed: 21,Unnamed: 22,Unnamed: 23,Unnamed: 24,Unnamed: 25,Unnamed: 26,Unnamed: 27,Unnamed: 28,Unnamed: 29,Unnamed: 30
48,400,pub.1027671519,10.1007/s00267-013-0165-y,24065384,,Perspectives on Disconnects Between Scientific Information and Management Decisions on Post-fire Recovery in Western US,Environmental Management,,"Conservation of Natural Resources; Decision Making, Organizational; Decision Support Techniques; Fires; Government Agencies; Information Dissemination; Northwestern United States; Politics; Southwestern United States; Time Factors",2013-12,2013,52,6,1415-1426,"All OA; Green, Accepted & Submitted",Article,"Chen, Xiaoli; Emery, Nathan; Garcia, Elizabeth S.; Hanan, Erin J.; Hodges, Heather E.; Martin, Tyronne; Meyers, Matthew A.; Peavey, Lindsey E.; Peng, Hui; Santamaria, Jaime Sainz; Uyeda, Kellie A.; Anderson, Sarah E.; Tague, Christina","Anderson, Sarah E.","Chen, Xiaoli (University of California, Santa Barbara); Emery, Nathan (University of California, Santa Barbara); Garcia, Elizabeth S. (University of California, Santa Barbara); Hanan, Erin J. (University of California, Santa Barbara); Hodges, Heather E. (University of California System); Martin, Tyronne (University of California, Santa Barbara); Meyers, Matthew A. (University of California, Santa Barbara); Peavey, Lindsey E. (University of California, Santa Barbara); Peng, Hui (University of California, Santa Barbara; China Institute of Water Resources and Hydropower Research); Santamaria, Jaime Sainz (University of California, Santa Barbara); Uyeda, Kellie A. (University of California, Santa Barbara; San Diego State University); Anderson, Sarah E. (University of California, Santa Barbara); Tague, Christina (University of California, Santa Barbara)",5,1,0,0.94,https://escholarship.org/content/qt35n8t4pf/qt35n8t4pf.pdf?t=odg0uy,https://app.dimensions.ai/details/publication/pub.1027671519,05 Environmental Sciences; 0502 Environmental Science and Management,05 Environmental Sciences,0502 Environmental Science and Management,,,
49,400,pub.1053367374,10.1371/journal.pone.0080286,24282532,PMC3840024,"An Integrated Model of Environmental Effects on Growth, Carbohydrate Balance, and Mortality of Pinus ponderosa Forests in the Southern Rocky Mountains",PLoS ONE,,"Carbohydrate Metabolism; Carbon Cycle; Climate Change; Droughts; Ecosystem; Models, Theoretical; New Mexico; Pinus ponderosa; Plant Stems; Rain; Seasons",2013-11-25,2013,8,11,e80286,All OA; Gold,Article,"Tague, Christina L.; McDowell, Nathan G.; Allen, Craig D.",,"Tague, Christina L. (University of California, Santa Barbara); McDowell, Nathan G. (Los Alamos National Laboratory); Allen, Craig D. (United States Geological Survey)",23,4,0.25,3.63,https://journals.plos.org/plosone/article/file?id=10.1371/journal.pone.0080286&type=printable,https://app.dimensions.ai/details/publication/pub.1053367374,0602 Ecology; 0699 Other Biological Sciences; 0705 Forestry Sciences; 0607 Plant Biology; 06 Biological Sciences; 07 Agricultural and Veterinary Sciences,0602 Ecology,0699 Other Biological Sciences,0705 Forestry Sciences,0607 Plant Biology,06 Biological Sciences
50,100,pub.1015513024,10.5194/bgd-10-17145-2013,,,What is the importance of climate model bias when projecting the impacts of climate change on land surface processes?,Biogeosciences Discussions,,,2013-11-04,2013,10,11,17145-17192,All OA; Gold,Article,"Liu, M.; Rajagopalan, K.; Chung, S. H.; Jiang, X.; Harrison, J.; Nergui, T.; Guenther, A.; Miller, C.; Reyes, J.; Tague, C.; Choate, J.; Salathé, E. P.; Stöckle, C. O.; Adam, J. C.",,"Liu, M. (Washington State University); Rajagopalan, K. (Washington State University); Chung, S. H. (Washington State University); Jiang, X. (National Center for Atmospheric Research); Harrison, J. (Washington State University); Nergui, T. (Washington State University); Guenther, A. (National Center for Atmospheric Research); Miller, C. (Washington State University); Reyes, J. (Washington State University); Tague, C. (University of California, Santa Barbara); Choate, J. (University of California, Santa Barbara); Salathé, E. P. (University of Washington Bothell); Stöckle, C. O. (Washington State University); Adam, J. C. (Washington State University)",4,0,,0.51,https://escholarship.org/content/qt2mk7n31p/qt2mk7n31p.pdf?t=ntqtrw,https://app.dimensions.ai/details/publication/pub.1015513024,0406 Physical Geography and Environmental Geoscience; 04 Earth Sciences; 0401 Atmospheric Sciences,0406 Physical Geography and Environmental Geoscience,04 Earth Sciences,0401 Atmospheric Sciences,,
51,100,pub.1043836916,10.5194/hessd-10-11983-2013,,,Senstitivity of water balance components to environmental changes in a mountainous watershed: uncertainty assessment based on models comparison,Hydrology and Earth System Sciences Discussions,,,2013-10-01,2013,10,10,11983-12026,All OA; Gold,Article,"Morán-Tejeda, E.; Zabalza, J.; Rahman, K.; Gago-Silva, A.; López-Moreno, J. I.; Vicente-Serrano, S.; Lehmann, A.; Tague, C. L.; Beniston, M.",,"Morán-Tejeda, E. (University of Geneva); Zabalza, J. (Instituto Pirenaico de Ecología); Rahman, K. (University of Geneva); Gago-Silva, A. (University of Geneva); López-Moreno, J. I. (Instituto Pirenaico de Ecología); Vicente-Serrano, S. (Instituto Pirenaico de Ecología); Lehmann, A. (University of Geneva); Tague, C. L. (); Beniston, M. (University of Geneva)",2,1,,0.25,https://archive-ouverte.unige.ch/unige:83348/ATTACHMENT01,https://app.dimensions.ai/details/publication/pub.1043836916,0406 Physical Geography and Environmental Geoscience; 04 Earth Sciences; 0401 Atmospheric Sciences,0406 Physical Geography and Environmental Geoscience,04 Earth Sciences,0401 Atmospheric Sciences,,
52,100,pub.1033694698,10.1007/s10745-013-9590-z,,,"Water Scarcity in the Andes: A Comparison of Local Perceptions and Observed Climate, Land Use and Socioeconomic Changes",Human Ecology,,,2013-10,2013,41,5,667-681,Closed,Article,"Murtinho, Felipe; Tague, Christina; de Bievre, Bert; Eakin, Hallie; Lopez-Carr, David","Murtinho, Felipe","Murtinho, Felipe (Seattle University); Tague, Christina (University of California, Santa Barbara); de Bievre, Bert (); Eakin, Hallie (Arizona State University); Lopez-Carr, David (University of California, Santa Barbara)",19,5,,11.74,,https://app.dimensions.ai/details/publication/pub.1033694698,16 Studies in Human Society; 1601 Anthropology,16 Studies in Human Society,1601 Anthropology,,,
53,100,pub.1032728583,10.1890/120209,,,Watering the forest for the trees: an emerging priority for managing water in forest landscapes,Frontiers in Ecology and the Environment,,,2013-08-08,2013,11,6,314-321,Closed,Article,"Grant, Gordon E; Tague, Christina L; Allen, Craig D",,"Grant, Gordon E (Pacific Northwest Research Station); Tague, Christina L (University of California, Santa Barbara); Allen, Craig D ()",63,15,,11.47,,https://app.dimensions.ai/details/publication/pub.1032728583,0602 Ecology; 0705 Forestry Sciences; 0501 Ecological Applications; 06 Biological Sciences; 05 Environmental Sciences; 0502 Environmental Science and Management; 07 Agricultural and Veterinary Sciences,0602 Ecology,0705 Forestry Sciences,0501 Ecological Applications,06 Biological Sciences,05 Environmental Sciences
54,100,pub.1013436369,10.1002/jgrg.20073,,,The sensitivity of forest water use to the timing of precipitation and snowmelt recharge in the California Sierra: Implications for a warming climate,Journal of Geophysical Research Biogeosciences,,,2013-06,2013,118,2,875-887,All OA; Gold,Article,"Tague, Christina; Peng, Hui",,"Tague, Christina (University of California, Santa Barbara); Peng, Hui (University of California, Santa Barbara; China Institute of Water Resources and Hydropower Research)",47,16,,6.92,https://agupubs.onlinelibrary.wiley.com/doi/pdf/10.1002/jgrg.20073,https://app.dimensions.ai/details/publication/pub.1013436369,0406 Physical Geography and Environmental Geoscience; 04 Earth Sciences,0406 Physical Geography and Environmental Geoscience,04 Earth Sciences,,,
55,100,pub.1053185331,10.1002/wrcr.20140,,,Influence of spatial temperature estimation method in ecohydrologic modeling in the Western Oregon Cascades,Water Resources Research,,,2013-03,2013,49,3,1611-1624,All OA; Gold,Article,"Garcia, Elizabeth S.; Tague, Christina L.; Choate, Janet S.",,"Garcia, Elizabeth S. (University of California, Santa Barbara); Tague, Christina L. (University of California, Santa Barbara); Choate, Janet S. (University of California, Santa Barbara)",13,3,,4,https://agupubs.onlinelibrary.wiley.com/doi/pdf/10.1002/wrcr.20140,https://app.dimensions.ai/details/publication/pub.1053185331,09 Engineering; 14 Economics; 0905 Civil Engineering; 1402 Applied Economics; 0907 Environmental Engineering,09 Engineering,14 Economics,0905 Civil Engineering,1402 Applied Economics,0907 Environmental Engineering
56,100,pub.1008120119,10.1002/hyp.9628,,,Coupling snowpack and groundwater dynamics to interpret historical streamflow trends in the western United States,Hydrological Processes,,,2013-02-28,2013,27,5,655-668,Closed,Article,"Safeeq, Mohammad; Grant, Gordon E.; Lewis, Sarah L.; Tague, Christina. L.",,"Safeeq, Mohammad (Oregon State University); Grant, Gordon E. (US Forest Service); Lewis, Sarah L. (Oregon State University); Tague, Christina. L. (University of California, Santa Barbara)",40,10,,5.89,,https://app.dimensions.ai/details/publication/pub.1008120119,0406 Physical Geography and Environmental Geoscience; 04 Earth Sciences,0406 Physical Geography and Environmental Geoscience,04 Earth Sciences,,,
57,100,pub.1016962722,10.5194/hess-17-341-2013,,,Parameterizing sub-surface drainage with geology to improve modeling streamflow responses to climate in data limited environments,Hydrology and Earth System Sciences,,,2013-01-29,2013,17,1,341-354,All OA; Gold,Article,"Tague, C. L.; Choate, J. S.; Grant, G.",,"Tague, C. L. (University of California, Santa Barbara); Choate, J. S. (University of California, Santa Barbara); Grant, G. (Pacific Northwest Research Station)",20,4,,2.94,https://www.hydrol-earth-syst-sci.net/17/341/2013/hess-17-341-2013.pdf,https://app.dimensions.ai/details/publication/pub.1016962722,0406 Physical Geography and Environmental Geoscience; 04 Earth Sciences,0406 Physical Geography and Environmental Geoscience,04 Earth Sciences,,,
58,100,pub.1025225549,10.1071/wf11143,,,Research and development supporting risk-based wildfire effects prediction for fuels and fire management: status and needs,International Journal of Wildland Fire,,,2013,2013,22,1,37-50,Closed,Article,"Hyde, Kevin; Dickinson, Matthew B.; Bohrer, Gil; Calkin, David; Evers, Louisa; Gilbertson-Day, Julie; Nicolet, Tessa; Ryan, Kevin; Tague, Christina",,"Hyde, Kevin (); Dickinson, Matthew B. (Northern Research Station); Bohrer, Gil (The Ohio State University); Calkin, David (Rocky Mountain Research Station); Evers, Louisa (Bureau of Land Management); Gilbertson-Day, Julie (Rocky Mountain Research Station); Nicolet, Tessa (US Forest Service); Ryan, Kevin (US Forest Service); Tague, Christina (University of California, Santa Barbara)",27,6,,5.05,,https://app.dimensions.ai/details/publication/pub.1025225549,05 Environmental Sciences; 0502 Environmental Science and Management,05 Environmental Sciences,0502 Environmental Science and Management,,,
59,100,pub.1018951183,10.1016/b978-0-12-409548-9.00651-5,,,Landscape Modeling☆,,Reference Module in Earth Systems and Environmental Sciences,,2013,2013,,Vegetatio691987,,Closed,Chapter,"Lookingbill, T.R.; Gardner, R.H.; Wainger, L.A.; Tague, C.L.; Suarez-Rubio, M.",,"Lookingbill, T.R. (University of Richmond); Gardner, R.H. (University of Maryland Center For Environmental Sciences); Wainger, L.A. (University of Maryland Center For Environmental Sciences); Tague, C.L. (University of California, Santa Barbara); Suarez-Rubio, M. (University of Natural Resources and Life Sciences)",0,0,,0,,https://app.dimensions.ai/details/publication/pub.1018951183,0602 Ecology; 0502 Environmental Science and Management; 0501 Ecological Applications; 05 Environmental Sciences; 06 Biological Sciences,0602 Ecology,0502 Environmental Science and Management,0501 Ecological Applications,05 Environmental Sciences,06 Biological Sciences
60,100,pub.1019502532,10.1007/s10021-012-9545-z,,,Assessing the Role of Parameter and Input Uncertainty in Ecohydrologic Modeling: Implications for a Semi-arid and Urbanizing Coastal California Catchment,Ecosystems,,,2012-08,2012,15,5,775-791,Closed,Article,"Shields, Catherine A.; Tague, Christina L.","Shields, Catherine A.","Shields, Catherine A. (University of California, Santa Barbara); Tague, Christina L. (University of California, Santa Barbara)",22,7,,3.27,,https://app.dimensions.ai/details/publication/pub.1019502532,0602 Ecology; 0502 Environmental Science and Management; 0503 Soil Sciences; 05 Environmental Sciences; 06 Biological Sciences,0602 Ecology,0502 Environmental Science and Management,0503 Soil Sciences,05 Environmental Sciences,06 Biological Sciences
61,100,pub.1037283534,10.5194/hessd-9-8665-2012,,,Parameterizing sub-surface drainage with geology to improve modeling streamflow responses to climate in data limited environments,Hydrology and Earth System Sciences Discussions,,,2012-07-18,2012,9,7,8665-8700,All OA; Gold,Article,"Tague, C. L.; Choate, J. S.; Grant, G.",,"Tague, C. L. (University of California, Santa Barbara); Choate, J. S. (University of California, Santa Barbara); Grant, G. (Pacific Northwest Research Station)",2,1,,0.36,https://doi.org/10.5194/hessd-9-8665-2012,https://app.dimensions.ai/details/publication/pub.1037283534,0406 Physical Geography and Environmental Geoscience; 04 Earth Sciences,0406 Physical Geography and Environmental Geoscience,04 Earth Sciences,,,
62,100,pub.1008256467,10.1029/2011wr011301,,,Ecosystem processes at the watershed scale: Hydrologic vegetation gradient as an indicator for lateral hydrologic connectivity of headwater catchments,Water Resources Research,,,2012-06,2012,48,6,,All OA; Gold,Article,"Hwang, Taehee; Band, Lawrence E.; Vose, James M.; Tague, Christina",,"Hwang, Taehee (University of North Carolina at Chapel Hill); Band, Lawrence E. (University of North Carolina at Chapel Hill); Vose, James M. (US Forest Service); Tague, Christina (University of California, Santa Barbara)",58,23,,17.46,https://agupubs.onlinelibrary.wiley.com/doi/pdf/10.1029/2011WR011301,https://app.dimensions.ai/details/publication/pub.1008256467,09 Engineering; 14 Economics; 0905 Civil Engineering; 1402 Applied Economics; 0907 Environmental Engineering,09 Engineering,14 Economics,0905 Civil Engineering,1402 Applied Economics,0907 Environmental Engineering
63,200,pub.1025038953,10.1201/b11179-13,,,Response of Western Mountain Ecosystems to Climatic Variability and Change:,,Ecological Consequences of Climate Change,,2011-10-24,2011,,,163-190,Closed,Chapter,"Beever, Erik; Belant, Jerrold; Peterson, David; Allen, Craig; Baron, Jill; Fagre, Daniel; McKenzie, Donald; Stephenson, Nathan; Fountain, rew; Hicke, Jeffrey; Malanson, George; Ojima, Dennis; Tague, Christina; van Mantgem, Phillip",,"Beever, Erik (); Belant, Jerrold (); Peterson, David (); Allen, Craig (); Baron, Jill (); Fagre, Daniel (); McKenzie, Donald (); Stephenson, Nathan (); Fountain, rew (); Hicke, Jeffrey (); Malanson, George (); Ojima, Dennis (); Tague, Christina (); van Mantgem, Phillip ()",2,0,,,,https://app.dimensions.ai/details/publication/pub.1025038953,,,,,,
64,100,pub.1051231932,10.1016/j.gloenvcha.2010.09.011,,,Vulnerability of water supply from the Oregon Cascades to changing climate: Linking science to users and policy,Global Environmental Change,,,2011-02,2011,21,1,110-122,Closed,Article,"Farley, Kathleen A.; Tague, Christina; Grant, Gordon E.","Farley, Kathleen A.","Farley, Kathleen A. (San Diego State University); Tague, Christina (University of California, Santa Barbara); Grant, Gordon E. (Pacific Northwest Research Station; Oregon State University)",24,3,,2.91,,https://app.dimensions.ai/details/publication/pub.1051231932,0501 Ecological Applications; 0406 Physical Geography and Environmental Geoscience; 04 Earth Sciences; 05 Environmental Sciences,0501 Ecological Applications,0406 Physical Geography and Environmental Geoscience,04 Earth Sciences,05 Environmental Sciences,
65,100,pub.1035198299,10.1029/2009wr008078,,,Plot‐ and watershed‐scale soil moisture variability in a humid Piedmont watershed,Water Resources Research,,,2010-12,2010,46,12,,All OA; Gold,Article,"Tague, C.; Band, L.; Kenworthy, S.; Tenebaum, D.",,"Tague, C. (University of California, Santa Barbara); Band, L. (University of North Carolina System); Kenworthy, S. (); Tenebaum, D. (University of Massachusetts Boston)",27,8,,3.75,http://onlinelibrary.wiley.com/doi/10.1029/2009WR008078/pdf,https://app.dimensions.ai/details/publication/pub.1035198299,09 Engineering; 0907 Environmental Engineering,09 Engineering,0907 Environmental Engineering,,,
66,100,pub.1045848367,10.1577/t09-192.1,,,"Climate Change Impacts on Flood Frequency, Intensity, and Timing May Affect Trout Species in Sagehen Creek, California",Transactions of the American Fisheries Society,,,2010-11,2010,139,6,1657-1664,Closed,Article,"Meyers, Erica M.; Dobrowski, Bridget; Tague, Christina L.",,"Meyers, Erica M. (University of California, Santa Barbara); Dobrowski, Bridget (University of California, Santa Barbara); Tague, Christina L. (University of California, Santa Barbara)",5,2,,0.69,,https://app.dimensions.ai/details/publication/pub.1045848367,0704 Fisheries Sciences; 07 Agricultural and Veterinary Sciences,0704 Fisheries Sciences,07 Agricultural and Veterinary Sciences,,,
67,100,pub.1004123333,10.1111/j.1749-8198.2010.00400.x,,,Ecohydrology and Climate Change in the Mountains of the Western USA – A Review of Research and Opportunities,Geography Compass,,,2010-11,2010,4,11,1648-1663,Closed,Article,"Tague, Christina; Dugger, Aubrey L.",,"Tague, Christina (); Dugger, Aubrey L. ()",18,6,,2.04,,https://app.dimensions.ai/details/publication/pub.1004123333,0406 Physical Geography and Environmental Geoscience; 04 Earth Sciences,0406 Physical Geography and Environmental Geoscience,04 Earth Sciences,,,
68,100,pub.1043517050,10.1007/s10533-009-9375-z,,,"Longitudinal and seasonal variation of stream N uptake in an urbanizing watershed: effect of organic matter, stream size, transient storage and debris dams",Biogeochemistry,,,2010-04,2010,98,1-3,45-62,All OA; Gold,Article,"Claessens, Luc; Tague, Christina L.; Groffman, Peter M.; Melack, John M.","Claessens, Luc","Claessens, Luc (University of California, Santa Barbara; San Diego State University; Virginia Tech); Tague, Christina L. (University of California, Santa Barbara); Groffman, Peter M. (Cary Institute of Ecosystem Studies); Melack, John M. (University of California, Santa Barbara)",17,1,,2.38,https://link.springer.com/content/pdf/10.1007%2Fs10533-009-9375-z.pdf,https://app.dimensions.ai/details/publication/pub.1043517050,0402 Geochemistry; 0399 Other Chemical Sciences; 03 Chemical Sciences; 04 Earth Sciences; 05 Environmental Sciences; 0502 Environmental Science and Management,0402 Geochemistry,0399 Other Chemical Sciences,03 Chemical Sciences,04 Earth Sciences,05 Environmental Sciences
69,100,pub.1023965470,10.1007/s10533-009-9376-y,,,Longitudinal assessment of the effect of concentration on stream N uptake rates in an urbanizing watershed,Biogeochemistry,,,2010-04,2010,98,1-3,63-74,All OA; Gold,Article,"Claessens, Luc; Tague, Christina L.; Groffman, Peter M.; Melack, John M.","Claessens, Luc","Claessens, Luc (University of California, Santa Barbara; San Diego State University; Virginia Tech); Tague, Christina L. (University of California, Santa Barbara); Groffman, Peter M. (Cary Institute of Ecosystem Studies); Melack, John M. (University of California, Santa Barbara)",11,1,,1.54,https://link.springer.com/content/pdf/10.1007%2Fs10533-009-9376-y.pdf,https://app.dimensions.ai/details/publication/pub.1023965470,0402 Geochemistry; 0399 Other Chemical Sciences; 03 Chemical Sciences; 04 Earth Sciences; 05 Environmental Sciences; 0502 Environmental Science and Management,0402 Geochemistry,0399 Other Chemical Sciences,03 Chemical Sciences,04 Earth Sciences,05 Environmental Sciences
70,100,pub.1035754004,10.1002/eco.88,,,Topographic controls on spatial patterns of conifer transpiration and net primary productivity under climate warming in mountain ecosystems,Ecohydrology,,,2009-12,2009,2,4,541-554,All OA; Gold,Article,"Tague, C.; Heyn, K.; Christensen, L.",,"Tague, C. (University of California, Santa Barbara); Heyn, K. (University of California, Santa Barbara); Christensen, L. ()",45,10,,5.15,http://dx.doi.org/10.1002/eco.88,https://app.dimensions.ai/details/publication/pub.1035754004,0602 Ecology; 0502 Environmental Science and Management; 0699 Other Biological Sciences; 0607 Plant Biology; 05 Environmental Sciences; 06 Biological Sciences,0602 Ecology,0502 Environmental Science and Management,0699 Other Biological Sciences,0607 Plant Biology,05 Environmental Sciences
71,100,pub.1011187871,10.4319/lom.2009.7.811,,,Transport‐based method for estimating in‐stream nitrogen uptake at ambient concentration from nutrient addition experiments,Limnology and Oceanography Methods,,,2009-12,2009,7,12,811-822,All OA; Gold,Article,"Claessens, Luc; Tague, Christina L.",,"Claessens, Luc (); Tague, Christina L. (University of California, Santa Barbara)",11,0,,,https://aslopubs.onlinelibrary.wiley.com/doi/pdf/10.4319/lom.2009.7.811,https://app.dimensions.ai/details/publication/pub.1011187871,04 Earth Sciences; 06 Biological Sciences,04 Earth Sciences,06 Biological Sciences,,,
72,100,pub.1014022135,10.1029/2008wr007179,,,Groundwater dynamics mediate low‐flow response to global warming in snow‐dominated alpine regions,Water Resources Research,,,2009-07,2009,45,7,,All OA; Gold,Article,"Tague, Christina; Grant, Gordon E.",,"Tague, Christina (University of California, Santa Barbara); Grant, Gordon E. (US Forest Service)",118,30,,24.57,http://onlinelibrary.wiley.com/doi/10.1029/2008WR007179/pdf,https://app.dimensions.ai/details/publication/pub.1014022135,09 Engineering; 14 Economics; 0905 Civil Engineering; 1402 Applied Economics; 0907 Environmental Engineering,09 Engineering,14 Economics,0905 Civil Engineering,1402 Applied Economics,0907 Environmental Engineering
73,200,pub.1043580360,10.1002/hyp.7288,,,Assessing climate change impacts on alpine stream‐flow and vegetation water use: mining the linkages with subsurface hydrologic processes,Hydrological Processes,,,2009-06-15,2009,23,12,1815-1819,Closed,Article,"Tague, Christina L.",,"Tague, Christina L. (University of California, Santa Barbara)",16,5,,2.16,,https://app.dimensions.ai/details/publication/pub.1043580360,09 Engineering; 0905 Civil Engineering; 0406 Physical Geography and Environmental Geoscience; 04 Earth Sciences; 0907 Environmental Engineering,09 Engineering,0905 Civil Engineering,0406 Physical Geography and Environmental Geoscience,04 Earth Sciences,0907 Environmental Engineering
74,100,pub.1028717155,10.1007/s10584-008-9497-7,,,Modeling the eco-hydrologic response of a Mediterranean type ecosystem to the combined impacts of projected climate change and altered fire frequencies,Climatic Change,,,2009-03,2009,93,1-2,137-155,Closed,Article,"Tague, C.; Seaby, L.; Hope, A.","Tague, C.","Tague, C. (University of California, Santa Barbara); Seaby, L. (); Hope, A. (San Diego State University)",34,7,,3.3,,https://app.dimensions.ai/details/publication/pub.1028717155,0602 Ecology; 0699 Other Biological Sciences; 0406 Physical Geography and Environmental Geoscience; 0501 Ecological Applications; 04 Earth Sciences; 05 Environmental Sciences; 06 Biological Sciences,0602 Ecology,0699 Other Biological Sciences,0406 Physical Geography and Environmental Geoscience,0501 Ecological Applications,04 Earth Sciences
75,100,pub.1021188112,10.1007/s10533-008-9277-5,,,Challenges to incorporating spatially and temporally explicit phenomena (hotspots and hot moments) in denitrification models,Biogeochemistry,,,2009-03,2009,93,1-2,49-77,Closed,Article,"Groffman, Peter M.; Butterbach-Bahl, Klaus; Fulweiler, Robinson W.; Gold, Arthur J.; Morse, Jennifer L.; Stander, Emilie K.; Tague, Christina; Tonitto, Christina; Vidon, Philippe","Groffman, Peter M.","Groffman, Peter M. (Cary Institute of Ecosystem Studies); Butterbach-Bahl, Klaus (Karlsruhe Institute of Technology); Fulweiler, Robinson W. (Boston University); Gold, Arthur J. (University of Rhode Island); Morse, Jennifer L. (Duke University); Stander, Emilie K. (Rutgers, The State University of New Jersey); Tague, Christina (University of California, Santa Barbara); Tonitto, Christina (Cornell University); Vidon, Philippe (Indiana University – Purdue University Indianapolis)",315,76,,43.88,,https://app.dimensions.ai/details/publication/pub.1021188112,0402 Geochemistry; 0399 Other Chemical Sciences; 03 Chemical Sciences; 04 Earth Sciences; 05 Environmental Sciences; 0502 Environmental Science and Management,0402 Geochemistry,0399 Other Chemical Sciences,03 Chemical Sciences,04 Earth Sciences,05 Environmental Sciences
