,"""About the data: Exported on Nov 01, 2019. Criteria: Researcher is Christina L Tague. © 2019 Digital Science and Research Solutions Inc. All rights reserved. Unless otherwise agreed, redistribution / external use of this work is not permitted.""
",Unnamed: 1,Unnamed: 2,Unnamed: 3,Unnamed: 4,Unnamed: 5,Unnamed: 6,Unnamed: 7,Unnamed: 8,Unnamed: 9,Unnamed: 10,Unnamed: 11,Unnamed: 12,Unnamed: 13,Unnamed: 14,Unnamed: 15,Unnamed: 16,Unnamed: 17,Unnamed: 18,Unnamed: 19,Unnamed: 20,Unnamed: 21,Unnamed: 22,Unnamed: 23,Unnamed: 24,Unnamed: 25,Unnamed: 26,Unnamed: 27,Unnamed: 28,Unnamed: 29,Unnamed: 30
76,100,pub.1014734359,10.1007/s10533-008-9276-6,,,Modeling hydrologic controls on denitrification: sensitivity to parameter uncertainty and landscape representation,Biogeochemistry,,,2009-03,2009,93,1-2,79-90,Closed,Article,"Tague, Christina","Tague, Christina","Tague, Christina (University of California, Santa Barbara)",12,1,,1.61,,https://app.dimensions.ai/details/publication/pub.1014734359,05 Environmental Sciences; 0502 Environmental Science and Management,05 Environmental Sciences,0502 Environmental Science and Management,,,
77,100,pub.1048179532,10.1029/2009jg000951,,,"Energy, water, and carbon fluxes in a loblolly pine stand: Results from uniform and gappy canopy models with comparisons to eddy flux data",Journal of Geophysical Research,,,2009,2009,114,G4,,All OA; Gold,Article,"Song, Conghe; Katul, Gabriel; Oren, Ram; Band, Lawrence E.; Tague, Christina L.; Stoy, Paul C.; McCarthy, Heather R.",,"Song, Conghe (University of North Carolina at Chapel Hill); Katul, Gabriel (Duke University); Oren, Ram (Duke University); Band, Lawrence E. (University of North Carolina at Chapel Hill); Tague, Christina L. (University of California, Santa Barbara); Stoy, Paul C. (Duke University; University of Edinburgh); McCarthy, Heather R. (University of California, Irvine)",16,0,,2.37,https://agupubs.onlinelibrary.wiley.com/doi/pdf/10.1029/2009JG000951,https://app.dimensions.ai/details/publication/pub.1048179532,0705 Forestry Sciences; 07 Agricultural and Veterinary Sciences,0705 Forestry Sciences,07 Agricultural and Veterinary Sciences,,,
78,100,pub.1045742110,10.1029/2009jg001017,,,Hydro‐ecological linkages in urbanizing watersheds: An empirical assessment of in‐stream nitrate loss and evidence of saturation kinetics,Journal of Geophysical Research,,,2009,2009,114,G4,,All OA; Gold,Article,"Claessens, Luc; Tague, Christina L.; Band, Lawrence E.; Groffman, Peter M.; Kenworthy, Stephen T.",,"Claessens, Luc (University of California, Santa Barbara; San Diego State University; Virginia Tech); Tague, Christina L. (University of California, Santa Barbara); Band, Lawrence E. (University of North Carolina at Chapel Hill); Groffman, Peter M. (Cary Institute of Ecosystem Studies); Kenworthy, Stephen T. (Western Kentucky University)",12,3,,1.49,http://onlinelibrary.wiley.com/doi/10.1029/2009JG001017/pdf,https://app.dimensions.ai/details/publication/pub.1045742110,09 Engineering; 0907 Environmental Engineering,09 Engineering,0907 Environmental Engineering,,,
79,100,pub.1023649542,10.1002/hyp.7041,,,Hydrogeologic controls on streamflow sensitivity to climate variation,Hydrological Processes,,,2008-10-30,2008,22,22,4371-4385,Closed,Article,"Jefferson, Anne; Nolin, Anne; Lewis, Sarah; Tague, Christina",,"Jefferson, Anne (University of North Carolina at Charlotte); Nolin, Anne (Oregon State University); Lewis, Sarah (Oregon State University); Tague, Christina (University of California, Santa Barbara)",62,10,,6.13,,https://app.dimensions.ai/details/publication/pub.1023649542,0406 Physical Geography and Environmental Geoscience; 04 Earth Sciences,0406 Physical Geography and Environmental Geoscience,04 Earth Sciences,,,
80,100,pub.1040973561,10.1029/2007wr006418,,,Effect of geomorphic channel restoration on streamflow and groundwater in a snowmelt‐dominated watershed,Water Resources Research,,,2008-10,2008,44,10,,All OA; Gold,Article,"Tague, Christina; Valentine, Scott; Kotchen, Matthew",,"Tague, Christina (University of California, Santa Barbara); Valentine, Scott (Lake Tahoe Community College); Kotchen, Matthew (University of California, Santa Barbara)",15,7,,2.99,https://agupubs.onlinelibrary.wiley.com/doi/pdf/10.1029/2007WR006418,https://app.dimensions.ai/details/publication/pub.1040973561,09 Engineering; 14 Economics; 0905 Civil Engineering; 1402 Applied Economics; 0907 Environmental Engineering,09 Engineering,14 Economics,0905 Civil Engineering,1402 Applied Economics,0907 Environmental Engineering
81,100,pub.1013106181,10.1080/00045600802099055,,,The Potential Utility of Physically Based Hydrologic Modeling in Ungauged Urban Streams,Annals of the American Association of Geographers,,,2008-09-25,2008,98,4,818-833,Closed,Article,"Tague, Christina; Pohl-Costello, Molly",,"Tague, Christina (); Pohl-Costello, Molly ()",8,2,,0.79,,https://app.dimensions.ai/details/publication/pub.1013106181,0406 Physical Geography and Environmental Geoscience; 04 Earth Sciences,0406 Physical Geography and Environmental Geoscience,04 Earth Sciences,,,
82,100,pub.1023686971,10.1002/hyp.6961,,,Spatial patterns of simulated transpiration response to climate variability in a snow dominated mountain ecosystem,Hydrological Processes,,,2008-08-30,2008,22,18,3576-3588,Closed,Article,"Christensen, Lindsey; Tague, Christina L.; Baron, Jill S.",,"Christensen, Lindsey (Colorado State University); Tague, Christina L. (University of California, Santa Barbara); Baron, Jill S. (Colorado State University)",56,12,,5.53,,https://app.dimensions.ai/details/publication/pub.1023686971,0406 Physical Geography and Environmental Geoscience; 04 Earth Sciences,0406 Physical Geography and Environmental Geoscience,04 Earth Sciences,,,
83,100,pub.1008710907,10.1007/s10584-007-9294-8,,,Deep groundwater mediates streamflow response to climate warming in the Oregon Cascades,Climatic Change,,,2008-01,2008,86,1-2,189-210,"All OA; Green, Accepted & Submitted",Article,"Tague, Christina; Grant, Gordon; Farrell, Mike; Choate, Janet; Jefferson, Anne","Tague, Christina","Tague, Christina (University of California, Santa Barbara); Grant, Gordon (US Forest Service); Farrell, Mike (San Diego State University); Choate, Janet (University of California, Santa Barbara); Jefferson, Anne (Oregon State University)",119,19,,11.76,http://www.fsl.orst.edu/wpg/pubs/08_Tagueetal_Climate.pdf,https://app.dimensions.ai/details/publication/pub.1008710907,0406 Physical Geography and Environmental Geoscience; 04 Earth Sciences,0406 Physical Geography and Environmental Geoscience,04 Earth Sciences,,,
84,100,pub.1007824298,10.1016/b978-008045405-4.00193-2,,,Landscape Modeling,,Encyclopedia of Ecology,,2008,2008,,Ecological Modelling2002007,2108-2116,Closed,Chapter,"Lookingbill, T.R.; Gardner, R.H.; Wainger, L.A.; Tague, C.L.",,"Lookingbill, T.R. (University of Maryland Center For Environmental Sciences); Gardner, R.H. (University of Maryland Center For Environmental Sciences); Wainger, L.A. (University of Maryland Center For Environmental Sciences); Tague, C.L. (University of California, Santa Barbara)",1,0,,0.11,,https://app.dimensions.ai/details/publication/pub.1007824298,0602 Ecology; 0502 Environmental Science and Management; 0501 Ecological Applications; 05 Environmental Sciences; 06 Biological Sciences,0602 Ecology,0502 Environmental Science and Management,0501 Ecological Applications,05 Environmental Sciences,06 Biological Sciences
85,100,pub.1025275900,10.1002/hyp.6540,,,Water and carbon fluxes of European ecosystems: an evaluation of the ecohydrological model RHESSys,Hydrological Processes,,,2007-11-15,2007,21,24,3328-3339,Closed,Article,"Zierl, Bärbel; Bugmann, Harald; Tague, Christina L.",,"Zierl, Bärbel (Swiss Federal Institute of Technology in Zurich); Bugmann, Harald (Swiss Federal Institute of Technology in Zurich); Tague, Christina L. (San Diego State University)",31,8,,2.95,,https://app.dimensions.ai/details/publication/pub.1025275900,0406 Physical Geography and Environmental Geoscience; 04 Earth Sciences,0406 Physical Geography and Environmental Geoscience,04 Earth Sciences,,,
86,100,pub.1014584702,10.1002/hyp.6538,,,"Hydrogeologic controls on summer stream temperatures in the McKenzie River basin, Oregon",Hydrological Processes,,,2007-11-15,2007,21,24,3288-3300,Closed,Article,"Tague, Christina; Farrell, Michael; Grant, Gordon; Lewis, Sarah; Rey, Serge",,"Tague, Christina (University of California, Santa Barbara); Farrell, Michael (San Diego State University); Grant, Gordon (Pacific Northwest Research Station); Lewis, Sarah (Oregon State University); Rey, Serge (San Diego State University)",62,8,,5.9,,https://app.dimensions.ai/details/publication/pub.1014584702,0406 Physical Geography and Environmental Geoscience; 04 Earth Sciences,0406 Physical Geography and Environmental Geoscience,04 Earth Sciences,,,
87,100,pub.1020387011,10.1029/2006wr005299,,,Scale‐dependence of natural variability of flow regimes in a forested landscape,Water Resources Research,,,2007-08,2007,43,8,,All OA; Gold,Article,"Sanford, S. E.; Creed, I. F.; Tague, C. L.; Beall, F. D.; Buttle, J. M.",,"Sanford, S. E. (Western University); Creed, I. F. (Western University); Tague, C. L. (University of California, Santa Barbara); Beall, F. D. (Canadian Forest Service); Buttle, J. M. (Trent University)",22,4,,4.11,https://agupubs.onlinelibrary.wiley.com/doi/pdf/10.1029/2006WR005299,https://app.dimensions.ai/details/publication/pub.1020387011,09 Engineering; 14 Economics; 0905 Civil Engineering; 1402 Applied Economics; 0907 Environmental Engineering,09 Engineering,14 Economics,0905 Civil Engineering,1402 Applied Economics,0907 Environmental Engineering
88,100,pub.1007865206,10.1080/01431160600908924,,,Characterizing post‐fire vegetation recovery of California chaparral using TM/ETM+ time‐series data,International Journal of Remote Sensing,,,2007-03-20,2007,28,6,1339-1354,Closed,Article,"Hope, A.; Tague, C.; Clark, R.",,"Hope, A. (San Diego State University); Tague, C. (San Diego State University); Clark, R. (San Diego State University)",31,8,,3.83,,https://app.dimensions.ai/details/publication/pub.1007865206,09 Engineering; 0909 Geomatic Engineering; 04 Earth Sciences; 0406 Physical Geography and Environmental Geoscience,09 Engineering,0909 Geomatic Engineering,04 Earth Sciences,0406 Physical Geography and Environmental Geoscience,
89,100,pub.1023135286,10.2744/1071-8443(2006)5[175:stnhot]2.0.co;2,,,"Sea Turtle Nesting Habitat on the US Naval Station, Guantanamo Bay, Cuba: A Comparison of Habitat Suitability Index Models",Chelonian Conservation and Biology,,,2006-12,2006,5,2,175-187,Closed,Article,"Santos, Katherine Comer; Tague, Christina; Alberts, Allison C.; Franklin, Janet",,"Santos, Katherine Comer (); Tague, Christina (University of California, Santa Barbara); Alberts, Allison C. (Zoological Society of San Diego); Franklin, Janet (San Diego State University)",4,0,,0.47,,https://app.dimensions.ai/details/publication/pub.1023135286,05 Environmental Sciences; 0502 Environmental Science and Management,05 Environmental Sciences,0502 Environmental Science and Management,,,
90,100,pub.1043361840,10.1002/hyp.5895,,,"Analysis of soil moisture patterns in forested and suburban catchments in Baltimore, Maryland, using high‐resolution photogrammetric and LIDAR digital elevation datasets",Hydrological Processes,,,2006-02-15,2006,20,2,219-240,Closed,Article,"Tenenbaum, D. E.; Band, L. E.; Kenworthy, S. T.; Tague, C. L.",,"Tenenbaum, D. E. (University of North Carolina at Chapel Hill); Band, L. E. (University of North Carolina at Chapel Hill); Kenworthy, S. T. (Western Kentucky University); Tague, C. L. (San Diego State University)",35,5,,4.18,,https://app.dimensions.ai/details/publication/pub.1043361840,0406 Physical Geography and Environmental Geoscience; 04 Earth Sciences,0406 Physical Geography and Environmental Geoscience,04 Earth Sciences,,,
91,100,pub.1001227551,10.1002/0470848944.hsa109,,,Terrestrial Ecosystems,,Encyclopedia of Hydrological Sciences,,2005-10-21,2005,,,,Closed,Chapter,"Tague, Christina L; Band, Lawrence E; Franklin, Janet",,"Tague, Christina L (San Diego State University); Band, Lawrence E (University of North Carolina System); Franklin, Janet (San Diego State University)",0,0,,0,,https://app.dimensions.ai/details/publication/pub.1001227551,05 Environmental Sciences; 06 Biological Sciences; 0602 Ecology; 0502 Environmental Science and Management,05 Environmental Sciences,06 Biological Sciences,0602 Ecology,0502 Environmental Science and Management,
92,100,pub.1051716709,10.1111/j.1467-9671.2005.00225.x,,,Impacts of Spatial Partitioning in Hydroecological Models: Predicting Grassland Productivity with RHESSys,Transactions in GIS,,,2005-06,2005,9,3,421-442,Closed,Article,"Mitchell, Scott W; Csillag, Ferenc; Tague, Christina",,"Mitchell, Scott W (Carleton University); Csillag, Ferenc (University of Toronto); Tague, Christina (San Diego State University)",4,1,,0.86,,https://app.dimensions.ai/details/publication/pub.1051716709,08 Information and Computing Sciences; 09 Engineering; 16 Studies in Human Society; 0909 Geomatic Engineering; 1604 Human Geography; 0804 Data Format,08 Information and Computing Sciences,09 Engineering,16 Studies in Human Society,0909 Geomatic Engineering,1604 Human Geography
93,100,pub.1030879984,10.1007/0-387-24091-8_7,,,Heterogeneity in Hydrologic Processes: A Terrestrial Hydrologic Modeling Perspective,,Ecosystem Function in Heterogeneous Landscapes,,2005,2005,,,119-136,Closed,Chapter,"Tague, Christina",,"Tague, Christina (San Diego State University)",6,2,,0.55,,https://app.dimensions.ai/details/publication/pub.1030879984,0406 Physical Geography and Environmental Geoscience; 04 Earth Sciences,0406 Physical Geography and Environmental Geoscience,04 Earth Sciences,,,
94,100,pub.1049130009,10.1175/1087-3562(2004)8<1:rrhsso>2.0.co;2,,,"RHESSys: Regional Hydro-Ecologic Simulation System—An Object-Oriented Approach to Spatially Distributed Modeling of Carbon, Water, and Nutrient Cycling",Earth Interactions,,,2004-12,2004,8,19,1-42,"All OA; Green, Accepted & Submitted",Article,"Tague, C. L.; Band, L. E.",,"Tague, C. L. (); Band, L. E. ()",225,44,,23.23,http://www.unc.edu/courses/2007fall/geog/711/001/students/atrainor/earth_int.pdf,https://app.dimensions.ai/details/publication/pub.1049130009,0404 Geophysics; 0406 Physical Geography and Environmental Geoscience; 04 Earth Sciences; 0403 Geology,0404 Geophysics,0406 Physical Geography and Environmental Geoscience,04 Earth Sciences,0403 Geology,
95,100,pub.1020829711,10.1111/j.1752-1688.2004.tb04444.x,,,APPLICATION OF THE RHESSys MODEL TO A CALIFORNIA SEMIARID SHRUBLAND WATERSHED1,JAWRA Journal of the American Water Resources Association,,,2004-06,2004,40,3,575-589,Closed,Article,"Tague, Christina; McMichael, Christi; Hope, Allen; Choate, Janet; Clark, Robyn",,"Tague, Christina (San Diego State University); McMichael, Christi (); Hope, Allen (); Choate, Janet (); Clark, Robyn ()",26,3,,2.5,,https://app.dimensions.ai/details/publication/pub.1020829711,0406 Physical Geography and Environmental Geoscience; 04 Earth Sciences,0406 Physical Geography and Environmental Geoscience,04 Earth Sciences,,,
96,100,pub.1024589417,10.1029/2003wr002629,,,"A geological framework for interpreting the low‐flow regimes of Cascade streams, Willamette River Basin, Oregon",Water Resources Research,,,2004-04,2004,40,4,,Closed,Article,"Tague, Christina; Grant, Gordon E.",,"Tague, Christina (San Diego State University); Grant, Gordon E. (Pacific Northwest Research Station)",148,29,,27.63,,https://app.dimensions.ai/details/publication/pub.1024589417,09 Engineering; 14 Economics; 0905 Civil Engineering; 1402 Applied Economics; 0907 Environmental Engineering,09 Engineering,14 Economics,0905 Civil Engineering,1402 Applied Economics,0907 Environmental Engineering
97,200,pub.1046933215,10.1641/0006-3568(2002)052[1127:htatww]2.0.co;2,,,How to Avoid Train Wrecks When Using Science in Environmental Problem Solving,BioScience,,,2002,2002,52,12,1127-1136,All OA; Gold,Article,"BENDA, LEE E.; POFF, N. LEROY; TAGUE, CHRISTINA; PALMER, MARGARET A.; PIZZUTO, JAMES; COOPER, SCOTT; STANLEY, EMILY; MOGLEN, GLENN",,"BENDA, LEE E. (); POFF, N. LEROY (); TAGUE, CHRISTINA (); PALMER, MARGARET A. (); PIZZUTO, JAMES (); COOPER, SCOTT (); STANLEY, EMILY (); MOGLEN, GLENN ()",88,12,,,https://academic.oup.com/bioscience/article-pdf/52/12/1127/19409496/52-12-1127.pdf,https://app.dimensions.ai/details/publication/pub.1046933215,05 Environmental Sciences; 06 Biological Sciences,05 Environmental Sciences,06 Biological Sciences,,,
98,100,pub.1050298836,10.1002/hyp.253,,,Forest ecosystem processes at the watershed scale: hydrological and ecological controls of nitrogen export,Hydrological Processes,,,2001-07,2001,15,10,2013-2028,Closed,Article,"Band, L. E.; Tague, C. L.; Groffman, P.; Belt, K.",,"Band, L. E. (University of North Carolina at Chapel Hill); Tague, C. L. (San Diego State University); Groffman, P. (Cary Institute of Ecosystem Studies); Belt, K. ()",106,5,,11.49,,https://app.dimensions.ai/details/publication/pub.1050298836,0406 Physical Geography and Environmental Geoscience; 04 Earth Sciences,0406 Physical Geography and Environmental Geoscience,04 Earth Sciences,,,
99,100,pub.1003307360,10.1002/hyp.171,,,Evaluating explicit and implicit routing for watershed hydro‐ecological models of forest hydrology at the small catchment scale,Hydrological Processes,,,2001-06-15,2001,15,8,1415-1439,Closed,Article,"Tague, C. L.; Band, L. E.",,"Tague, C. L. (San Diego State University); Band, L. E. (University of North Carolina at Chapel Hill)",47,5,,5.09,,https://app.dimensions.ai/details/publication/pub.1003307360,0406 Physical Geography and Environmental Geoscience; 04 Earth Sciences,0406 Physical Geography and Environmental Geoscience,04 Earth Sciences,,,
100,100,pub.1046287006,10.1002/1096-9837(200102)26:2<135::aid-esp167>3.0.co;2-j,,,Simulating the impact of road construction and forest harvesting on hydrologic response,Earth Surface Processes and Landforms,,,2001-02,2001,26,2,135-151,Closed,Article,"Tague, Christina; Band, Larry",,"Tague, Christina (San Diego State University); Band, Larry (University of North Carolina at Chapel Hill)",58,6,,6.29,,https://app.dimensions.ai/details/publication/pub.1046287006,0406 Physical Geography and Environmental Geoscience; 04 Earth Sciences,0406 Physical Geography and Environmental Geoscience,04 Earth Sciences,,,
101,100,pub.1038701377,10.1175/1520-0450(2000)039<0931:cabhmf>2.0.co;2,,,Coupled Atmosphere–Biophysics–Hydrology Models for Environmental Modeling,Journal of Applied Meteorology,,,2000-06,2000,39,6,931-944,"All OA; Green, Accepted & Submitted",Article,"Walko, Robert L.; Band, Larry E.; Baron, Jill; Kittel, Timothy G. F.; Lammers, Richard; Lee, Tsengdar J.; Ojima, Dennis; Pielke, Roger A.; Taylor, Chris; Tague, Christina; Tremback, Craig J.; Vidale, Pier Luigi",,"Walko, Robert L. (); Band, Larry E. (); Baron, Jill (); Kittel, Timothy G. F. (); Lammers, Richard (); Lee, Tsengdar J. (); Ojima, Dennis (); Pielke, Roger A. (); Taylor, Chris (); Tague, Christina (); Tremback, Craig J. (); Vidale, Pier Luigi ()",401,36,,44.77,https://scholars.unh.edu/cgi/viewcontent.cgi?article=1151&context=faculty_pubs,https://app.dimensions.ai/details/publication/pub.1038701377,0406 Physical Geography and Environmental Geoscience; 04 Earth Sciences,0406 Physical Geography and Environmental Geoscience,04 Earth Sciences,,,
102,100,pub.1001882280,10.1111/1467-9671.00048,,,Modelling Watersheds as Spatial Object Hierarchies: Structure and Dynamics,Transactions in GIS,,,2000-06,2000,4,3,181-196,Closed,Article,"Band, Lawrence E.; Tague, Christina L.; Brun, Soren E.; Tenenbaum, David E.; Fernandes, Richard A.",,"Band, Lawrence E. (University of North Carolina System); Tague, Christina L. (San Diego State University); Brun, Soren E. (University of North Carolina System); Tenenbaum, David E. (University of North Carolina System); Fernandes, Richard A. (Natural Resources Canada)",51,2,,11.5,,https://app.dimensions.ai/details/publication/pub.1001882280,08 Information and Computing Sciences; 09 Engineering; 16 Studies in Human Society; 0909 Geomatic Engineering; 1604 Human Geography; 0804 Data Format,08 Information and Computing Sciences,09 Engineering,16 Studies in Human Society,0909 Geomatic Engineering,1604 Human Geography
103,100,pub.1008793058,10.1029/1998wr900096,,,Simulations of snow distribution and hydrology in a mountain basin,Water Resources Research,,,1999-05,1999,35,5,1587-1603,"All OA; Green, Published",Article,"Hartman, Melannie D.; Baron, Jill S.; Lammers, Richard B.; Cline, Donald W.; Band, Larry E.; Liston, Glen E.; Tague, Christina",,"Hartman, Melannie D. (); Baron, Jill S. (); Lammers, Richard B. (); Cline, Donald W. (); Band, Larry E. (); Liston, Glen E. (); Tague, Christina ()",73,7,,,https://scholars.unh.edu/cgi/viewcontent.cgi?article=1152&context=faculty_pubs,https://app.dimensions.ai/details/publication/pub.1008793058,09 Engineering; 14 Economics; 0905 Civil Engineering; 1402 Applied Economics; 0907 Environmental Engineering,09 Engineering,14 Economics,0905 Civil Engineering,1402 Applied Economics,0907 Environmental Engineering
