,"""About the data: Exported on Nov 01, 2019. Criteria: Researcher is Hunter Stanton Lenihan. © 2019 Digital Science and Research Solutions Inc. All rights reserved. Unless otherwise agreed, redistribution / external use of this work is not permitted.""
",Unnamed: 1,Unnamed: 2,Unnamed: 3,Unnamed: 4,Unnamed: 5,Unnamed: 6,Unnamed: 7,Unnamed: 8,Unnamed: 9,Unnamed: 10,Unnamed: 11,Unnamed: 12,Unnamed: 13,Unnamed: 14,Unnamed: 15,Unnamed: 16,Unnamed: 17,Unnamed: 18,Unnamed: 19,Unnamed: 20,Unnamed: 21,Unnamed: 22,Unnamed: 23,Unnamed: 24,Unnamed: 25,Unnamed: 26,Unnamed: 27,Unnamed: 28,Unnamed: 29,Unnamed: 30
43,100,pub.1050780252,10.1007/s00338-011-0763-1,,,Associational refuges among corals mediate impacts of a crown-of-thorns starfish Acanthaster planci outbreak,Coral Reefs,,,2011-09,2011,30,3,827-837,Closed,Article,"Kayal, Mohsen; Lenihan, Hunter S.; Pau, Cédric; Penin, Lucie; Adjeroud, Mehdi","Kayal, Mohsen","Kayal, Mohsen (Centre de Recherches Insulaires et Observatoire de l'Environnement; University of Perpignan); Lenihan, Hunter S. (University of California, Santa Barbara); Pau, Cédric (Centre de Recherches Insulaires et Observatoire de l'Environnement; University of Perpignan); Penin, Lucie (University of Perpignan; Centre de Recherches Insulaires et Observatoire de l'Environnement; ARC Centre of Excellence For Coral Reef Studies); Adjeroud, Mehdi (University of Perpignan; Institute of Research for the Development)",32,10,,4.22,,https://app.dimensions.ai/details/publication/pub.1050780252,05 Environmental Sciences; 06 Biological Sciences; 0602 Ecology; 0502 Environmental Science and Management,05 Environmental Sciences,06 Biological Sciences,0602 Ecology,0502 Environmental Science and Management,
44,100,pub.1021177222,10.1111/j.1526-100x.2010.00672.x,,,Impacts of Channel Reconstruction on Invertebrate Assemblages in a Restored River,Restoration Ecology,,,2011-09,2011,19,5,627-638,Closed,Article,"Albertson, Lindsey K.; Cardinale, Bradley J.; Zeug, Steven C.; Harrison, Lee R.; Lenihan, Hunter S.; Wydzga, M. Aleksandra",,"Albertson, Lindsey K. (University of California, Santa Barbara); Cardinale, Bradley J. (University of California, Santa Barbara); Zeug, Steven C. (University of California, Santa Barbara); Harrison, Lee R. (University of California, Santa Barbara); Lenihan, Hunter S. (University of California, Santa Barbara); Wydzga, M. Aleksandra (California Polytechnic State University)",13,1,,1.72,,https://app.dimensions.ai/details/publication/pub.1021177222,05 Environmental Sciences; 06 Biological Sciences; 0602 Ecology; 0502 Environmental Science and Management,05 Environmental Sciences,06 Biological Sciences,0602 Ecology,0502 Environmental Science and Management,
45,100,pub.1033528892,10.1111/j.1365-2400.2010.00769.x,,,Predictors of Chinook salmon extirpation in California’s Central Valley,Fisheries Management and Ecology,,,2011-02,2011,18,1,61-71,Closed,Article,"ZEUG, S. C.; ALBERTSON, L. K.; LENIHAN, H.; HARDY, J.; CARDINALE, B.",,"ZEUG, S. C. (University of California, Santa Barbara); ALBERTSON, L. K. (); LENIHAN, H. (); HARDY, J. (); CARDINALE, B. ()",11,3,,1.16,,https://app.dimensions.ai/details/publication/pub.1033528892,0602 Ecology; 06 Biological Sciences,0602 Ecology,06 Biological Sciences,,,
46,100,pub.1030751027,10.1525/bio.2011.61.2.5,,,"Oyster Reefs at Risk and Recommendations for Conservation, Restoration, and Management",BioScience,,,2011-02,2011,61,2,107-116,"All OA; Green, Published",Article,"Beck, Michael W.; Brumbaugh, Robert D.; Airoldi, Laura; Carranza, Alvar; Coen, Loren D.; Crawford, Christine; Defeo, Omar; Edgar, Graham J.; Hancock, Boze; Kay, Matthew C.; Lenihan, Hunter S.; Luckenbach, Mark W.; Toropova, Caitlyn L.; Zhang, Guofan; Guo, Ximing",,"Beck, Michael W. (); Brumbaugh, Robert D. (); Airoldi, Laura (); Carranza, Alvar (); Coen, Loren D. (); Crawford, Christine (); Defeo, Omar (); Edgar, Graham J. (University of Tasmania); Hancock, Boze (); Kay, Matthew C. (); Lenihan, Hunter S. (); Luckenbach, Mark W. (); Toropova, Caitlyn L. (); Zhang, Guofan (); Guo, Ximing ()",420,122,,52.76,https://scholarworks.wm.edu/cgi/viewcontent.cgi?article=1659&context=vimsarticles,https://app.dimensions.ai/details/publication/pub.1030751027,0602 Ecology; 0502 Environmental Science and Management; 0501 Ecological Applications; 05 Environmental Sciences; 06 Biological Sciences,0602 Ecology,0502 Environmental Science and Management,0501 Ecological Applications,05 Environmental Sciences,06 Biological Sciences
47,400,pub.1009013142,10.1021/nn1034857,21261306,,Nanomaterials in the environment: from materials to high-throughput screening to organisms.,ACS Nano,,Animals; Combinatorial Chemistry Techniques; Drug Design; Ecotoxicology; Environment; High-Throughput Screening Assays; Humans; Nanostructures; Toxicity Tests,2011-01-25,2011,5,1,13-20,Closed,Article,"Thomas, Courtney R.; George, Saji; Horst, Allison M.; Ji, Zhaoxia; Miller, Robert J.; Peralta-Videa, Jose R.; Xia, Tian; Pokhrel, Suman; Mädler, Lutz; Gardea-Torresdey, Jorge L.; Holden, Patricia A.; Keller, Arturo A.; Lenihan, Hunter S.; Nel, Andre E.; Zink, Jeffrey I.",,"Thomas, Courtney R. (University of California Los Angeles); George, Saji (University of California Los Angeles); Horst, Allison M. (University of California, Santa Barbara); Ji, Zhaoxia (University of California Los Angeles); Miller, Robert J. (University of California, Santa Barbara); Peralta-Videa, Jose R. (The University of Texas at El Paso); Xia, Tian (University of California Los Angeles); Pokhrel, Suman (University of Bremen); Mädler, Lutz (University of Bremen); Gardea-Torresdey, Jorge L. (The University of Texas at El Paso); Holden, Patricia A. (University of California, Santa Barbara); Keller, Arturo A. (University of California, Santa Barbara); Lenihan, Hunter S. (University of California, Santa Barbara); Nel, Andre E. (University of California Los Angeles); Zink, Jeffrey I. (University of California Los Angeles)",108,17,3.61,14.61,,https://app.dimensions.ai/details/publication/pub.1009013142,03 Chemical Sciences; 0306 Physical Chemistry (incl. Structural),03 Chemical Sciences,0306 Physical Chemistry (incl. Structural),,,
48,400,pub.1055501373,10.1021/es100247x,20469893,,Impacts of metal oxide nanoparticles on marine phytoplankton.,Environmental Science & Technology,,Marine Biology; Metal Nanoparticles; Phytoplankton; Solubility; Titanium; Zinc Oxide,2010-10,2010,44,19,7329-34,Closed,Article,"Miller, Robert J; Lenihan, Hunter S; Muller, Erik B; Tseng, Nancy; Hanna, Shannon K; Keller, Arturo A",,"Miller, Robert J (University of California, Santa Barbara); Lenihan, Hunter S (); Muller, Erik B (); Tseng, Nancy (); Hanna, Shannon K (); Keller, Arturo A ()",187,35,7.17,20.51,,https://app.dimensions.ai/details/publication/pub.1055501373,03 Chemical Sciences; 0602 Ecology; 06 Biological Sciences; 0306 Physical Chemistry (incl. Structural),03 Chemical Sciences,0602 Ecology,06 Biological Sciences,0306 Physical Chemistry (incl. Structural),
49,200,pub.1071168715,10.3354/meps08595,,,Response of Pocillopora verrucosa to corallivory varies with environmental conditions,Marine Ecology Progress Series,,,2010-06-23,2010,409,,51-63,All OA; Gold,Article,"Lenihan, HS; Edmunds, PJ",,"Lenihan, HS (); Edmunds, PJ ()",14,3,,1.63,https://www.int-res.com/articles/meps_oa/m409p051.pdf,https://app.dimensions.ai/details/publication/pub.1071168715,0602 Ecology; 0405 Oceanography; 04 Earth Sciences; 06 Biological Sciences; 0608 Zoology,0602 Ecology,0405 Oceanography,04 Earth Sciences,06 Biological Sciences,0608 Zoology
50,400,pub.1006059264,10.1007/s00227-009-1372-1,24391245,PMC3873055,Effect of sub-lethal damage to juvenile colonies of massive Porites spp. under contrasting regimes of temperature and water flow,Marine Biology,,,2010-04,2010,157,4,887-897,All OA; Gold,Article,"Edmunds, Peter J.; Lenihan, Hunter S.","Edmunds, Peter J.","Edmunds, Peter J. (California State University, Northridge); Lenihan, Hunter S. (University of California, Santa Barbara)",11,2,0.07,1.03,https://link.springer.com/content/pdf/10.1007%2Fs00227-009-1372-1.pdf,https://app.dimensions.ai/details/publication/pub.1006059264,0602 Ecology; 06 Biological Sciences,0602 Ecology,06 Biological Sciences,,,
51,400,pub.1055517116,10.1021/es902987d,20151631,,Stability and aggregation of metal oxide nanoparticles in natural aqueous matrices.,Environmental Science & Technology,,"Cerium; Fresh Water; Geologic Sediments; Metal Nanoparticles; Particle Size; Seawater; Titanium; Water Pollutants, Chemical; Zinc Oxide",2010-03-15,2010,44,6,1962-7,Closed,Article,"Keller, Arturo A; Wang, Hongtao; Zhou, Dongxu; Lenihan, Hunter S; Cherr, Gary; Cardinale, Bradley J; Miller, Robert; Ji, Zhaoxia",,"Keller, Arturo A (University of California, Santa Barbara); Wang, Hongtao (); Zhou, Dongxu (); Lenihan, Hunter S (); Cherr, Gary (); Cardinale, Bradley J (); Miller, Robert (); Ji, Zhaoxia ()",775,179,27.4,99.83,,https://app.dimensions.ai/details/publication/pub.1055517116,03 Chemical Sciences; 0306 Physical Chemistry (incl. Structural),03 Chemical Sciences,0306 Physical Chemistry (incl. Structural),,,
52,100,pub.1068060246,10.1577/c08-026.1,,,A Management Strategy for Sedentary Nearshore Species that Uses Marine Protected Areas as a Reference,Marine and Coastal Fisheries,,,2010-01,2010,2010,2010,14-27,All OA; Gold,Article,"Wilson, Jono R.; Prince, Jeremy D.; Lenihan, Hunter S.",,"Wilson, Jono R. (); Prince, Jeremy D. (); Lenihan, Hunter S. ()",30,4,,,https://doi.org/10.1577/c08-026.1,https://app.dimensions.ai/details/publication/pub.1068060246,09 Engineering,09 Engineering,,,,
53,200,pub.1071168174,10.3354/meps08164,,,Success of constructed oyster reefs in no-harvest sanctuaries: implications for restoration,Marine Ecology Progress Series,,,2009-09-04,2009,389,,159-170,All OA; Gold,Article,"Powers, SP; Peterson, CH; Grabowski, JH; Lenihan, HS",,"Powers, SP (); Peterson, CH (); Grabowski, JH (); Lenihan, HS ()",96,22,,10.7,https://www.int-res.com/articles/meps_oa/m389p159.pdf,https://app.dimensions.ai/details/publication/pub.1071168174,0602 Ecology; 0405 Oceanography; 04 Earth Sciences; 06 Biological Sciences; 0608 Zoology,0602 Ecology,0405 Oceanography,04 Earth Sciences,06 Biological Sciences,0608 Zoology
54,300,pub.1001534943,10.1021/es8034544,19764201,,The University of California Center for the Environmental Implications of Nanotechnology.,Environmental Science & Technology,,California; Ecotoxicology; Environmental Health; Environmental Monitoring; Environmental Pollutants; Nanostructures; Nanotechnology; Research; Risk Assessment; Universities,2009-09,2009,43,17,6453-7,All OA; Gold,Article,"Godwin, Hilary A; Chopra, Kabir; Bradley, Kenneth A; Cohen, Yoram; Harthorn, Barbara Herr; Hoek, Eric M V; Holden, Patricia; Keller, Arturo A; Lenihan, Hunter S; Nisbet, Roger M; Nel, Andre E",,"Godwin, Hilary A (University of California Los Angeles); Chopra, Kabir (); Bradley, Kenneth A (); Cohen, Yoram (); Harthorn, Barbara Herr (); Hoek, Eric M V (); Holden, Patricia (); Keller, Arturo A (); Lenihan, Hunter S (); Nisbet, Roger M (); Nel, Andre E ()",42,4,1.25,,https://pubs.acs.org/doi/pdf/10.1021/es8034544,https://app.dimensions.ai/details/publication/pub.1001534943,,,,,,
55,400,pub.1035397332,10.1007/s00442-009-1390-1,19551410,,Imprint of past environmental regimes on structure and succession of a deep-sea hydrothermal vent community,Oecologia,,Acclimatization; Analysis of Variance; Animals; Ecosystem; Environment; Invertebrates; Pacific Ocean; Species Specificity; Temperature,2009-08,2009,161,2,387-400,Closed,Article,"Mullineaux, Lauren S.; Micheli, Fiorenza; Peterson, Charles H.; Lenihan, Hunter S.; Markus, Nilauro","Mullineaux, Lauren S.","Mullineaux, Lauren S. (Woods Hole Oceanographic Institution); Micheli, Fiorenza (Stanford University); Peterson, Charles H. (University of North Carolina at Chapel Hill); Lenihan, Hunter S. (University of California, Santa Barbara); Markus, Nilauro ()",8,1,0.09,0.71,,https://app.dimensions.ai/details/publication/pub.1035397332,0602 Ecology; 06 Biological Sciences,0602 Ecology,06 Biological Sciences,,,
56,100,pub.1091745421,10.21236/ada514157,,,Assessing Withering Syndrome Resistance in California Black Abalone: Implications for Conservation and Restoration,,,,2009-01,2009,,,,"All OA; Green, Accepted & Submitted",Article,"Lenihan, Hunter S.",,"Lenihan, Hunter S. ()",0,0,,0,https://escholarship.org/content/qt7c39q78n/qt7c39q78n.pdf?t=lnrajk,https://app.dimensions.ai/details/publication/pub.1091745421,0602 Ecology; 06 Biological Sciences,0602 Ecology,06 Biological Sciences,,,
57,100,pub.1014676103,10.1016/j.dsr.2008.07.007,,,Biotic interactions at hydrothermal vents: Recruitment inhibition by the mussel Bathymodiolus thermophilus,Deep Sea Research Part I Oceanographic Research Papers,,,2008-12,2008,55,12,1707-1717,Closed,Article,"Lenihan, H.S.; Mills, S.W.; Mullineaux, L.S.; Peterson, C.H.; Fisher, C.R.; Micheli, F.","Lenihan, H.S.","Lenihan, H.S. (University of California, Santa Barbara); Mills, S.W. (Woods Hole Oceanographic Institution); Mullineaux, L.S. (Woods Hole Oceanographic Institution); Peterson, C.H. (University of North Carolina at Chapel Hill); Fisher, C.R. (Pennsylvania State University); Micheli, F. (Stanford University)",17,2,,1.52,,https://app.dimensions.ai/details/publication/pub.1014676103,04 Earth Sciences; 0403 Geology; 0405 Oceanography; 0402 Geochemistry,04 Earth Sciences,0403 Geology,0405 Oceanography,0402 Geochemistry,
58,200,pub.1071167486,10.3354/meps07622,,,Reef structure regulates small-scale spatial variation in coral bleaching,Marine Ecology Progress Series,,,2008-10-28,2008,370,,127-141,All OA; Gold,Article,"Lenihan, HS; Adjeroud, M; Kotchen, MJ; Hench, JL; Nakamura, T",,"Lenihan, HS (); Adjeroud, M (); Kotchen, MJ (); Hench, JL (); Nakamura, T ()",35,9,,3.71,https://www.int-res.com/articles/meps2008/370/m370p127.pdf,https://app.dimensions.ai/details/publication/pub.1071167486,0602 Ecology; 0405 Oceanography; 04 Earth Sciences; 06 Biological Sciences; 0608 Zoology,0602 Ecology,0405 Oceanography,04 Earth Sciences,06 Biological Sciences,0608 Zoology
59,100,pub.1062457738,10.1126/science.1158007,,,"Response to Comment on ""A Global Map of Human Impact on Marine Ecosystems""",Science,,,2008-09-12,2008,321,5895,1446-1446,All OA; Gold,Article,"Selkoe, Kimberly A.; Kappel, Carrie V.; Halpern, Benjamin S.; Micheli, Fiorenza; D'Agrosa, Caterina; Bruno, John; Casey, Kenneth S.; Ebert, Colin; Fox, Helen E.; Fujita, Rod; Heinemann, Dennis; Lenihan, Hunter S.; Madin, Elizabeth M. P.; Perry, Matt; Selig, Elizabeth R.; Spalding, Mark; Steneck, Robert; Walbridge, Shaun; Watson, Reg",,"Selkoe, Kimberly A. (University of California, Santa Barbara; University of Hawaii at Manoa); Kappel, Carrie V. (University of California, Santa Barbara); Halpern, Benjamin S. (University of California, Santa Barbara); Micheli, Fiorenza (Stanford University); D'Agrosa, Caterina (Wildlife Conservation Society); Bruno, John (University of North Carolina at Chapel Hill); Casey, Kenneth S. (National Oceanic and Atmospheric Administration); Ebert, Colin (University of California, Santa Barbara); Fox, Helen E. (); Fujita, Rod (Environmental Defense Fund); Heinemann, Dennis (Ocean Conservancy); Lenihan, Hunter S. (University of California, Santa Barbara); Madin, Elizabeth M. P. (University of California, Santa Barbara); Perry, Matt (University of North Carolina at Chapel Hill); Selig, Elizabeth R. (University of North Carolina at Chapel Hill); Spalding, Mark (); Steneck, Robert (University of Maine); Walbridge, Shaun (University of California, Santa Barbara); Watson, Reg (University of British Columbia)",7,1,,0.6,http://science.sciencemag.org/content/sci/321/5895/1446.3.full.pdf,https://app.dimensions.ai/details/publication/pub.1062457738,0602 Ecology; 06 Biological Sciences,0602 Ecology,06 Biological Sciences,,,
60,400,pub.1047222897,10.1126/science.1149345,18276889,,A Global Map of Human Impact on Marine Ecosystems,Science,,"Animals; Climate; Conservation of Natural Resources; Ecosystem; Fisheries; Human Activities; Humans; Mathematics; Models, Theoretical; Oceans and Seas",2008-02-15,2008,319,5865,948-952,Closed,Article,"Halpern, Benjamin S.; Walbridge, Shaun; Selkoe, Kimberly A.; Kappel, Carrie V.; Micheli, Fiorenza; D'Agrosa, Caterina; Bruno, John F.; Casey, Kenneth S.; Ebert, Colin; Fox, Helen E.; Fujita, Rod; Heinemann, Dennis; Lenihan, Hunter S.; Madin, Elizabeth M. P.; Perry, Matthew T.; Selig, Elizabeth R.; Spalding, Mark; Steneck, Robert; Watson, Reg",,"Halpern, Benjamin S. (University of California, Santa Barbara); Walbridge, Shaun (University of California, Santa Barbara); Selkoe, Kimberly A. (University of California, Santa Barbara; University of Hawaii at Manoa); Kappel, Carrie V. (University of California, Santa Barbara); Micheli, Fiorenza (Stanford University); D'Agrosa, Caterina (Wildlife Conservation Society); Bruno, John F. (University of North Carolina at Chapel Hill); Casey, Kenneth S. (National Oceanic and Atmospheric Administration); Ebert, Colin (University of California, Santa Barbara); Fox, Helen E. (World Wildlife Fund); Fujita, Rod (); Heinemann, Dennis (Ocean Conservancy); Lenihan, Hunter S. (University of California, Santa Barbara); Madin, Elizabeth M. P. (University of California, Santa Barbara); Perry, Matthew T. (University of California, Santa Barbara); Selig, Elizabeth R. (National Oceanic and Atmospheric Administration; University of North Carolina at Chapel Hill); Spalding, Mark (); Steneck, Robert (University of Maine); Watson, Reg (University of British Columbia)",2980,808,33.41,332.24,,https://app.dimensions.ai/details/publication/pub.1047222897,0602 Ecology; 0502 Environmental Science and Management; 0501 Ecological Applications; 05 Environmental Sciences; 06 Biological Sciences,0602 Ecology,0502 Environmental Science and Management,0501 Ecological Applications,05 Environmental Sciences,06 Biological Sciences
61,400,pub.1053350362,10.1016/j.crvi.2006.12.003,17303544,,High spatial variability in coral bleaching around Moorea (French Polynesia): patterns across locations and water depths,Comptes Rendus Biologies,,Animals; Anthozoa; Dinoflagellida; Geography; Marine Biology; Polynesia; Rheology; Seawater; Species Specificity; Symbiosis; Temperature,2007-02,2007,330,2,171-181,Closed,Article,"Penin, Lucie; Adjeroud, Mehdi; Schrimm, Muriel; Lenihan, Hunter Stanton","Penin, Lucie","Penin, Lucie (University of Perpignan; Centre de Recherches Insulaires et Observatoire de l'Environnement); Adjeroud, Mehdi (University of Perpignan; Centre de Recherches Insulaires et Observatoire de l'Environnement); Schrimm, Muriel (University of Perpignan; Centre de Recherches Insulaires et Observatoire de l'Environnement); Lenihan, Hunter Stanton (University of California, Santa Barbara)",29,5,0.35,2.42,,https://app.dimensions.ai/details/publication/pub.1053350362,0602 Ecology; 06 Biological Sciences,0602 Ecology,06 Biological Sciences,,,
62,100,pub.1005254493,10.1007/s00227-006-0289-1,,,Invertebrate community responses to recreational clam digging,Marine Biology,,,2006-09,2006,149,6,1489-1497,Closed,Article,"Griffiths, Jennifer; Dethier, Megan N.; Newsom, Amanda; Byers, James E.; Meyer, John J.; Oyarzun, Fernanda; Lenihan, Hunter","Griffiths, Jennifer","Griffiths, Jennifer (University of Washington); Dethier, Megan N. (University of Washington); Newsom, Amanda (University of Washington); Byers, James E. (University of New Hampshire); Meyer, John J. (University of New Hampshire); Oyarzun, Fernanda (University of Washington); Lenihan, Hunter (University of California, Santa Barbara)",19,4,,1.83,,https://app.dimensions.ai/details/publication/pub.1005254493,05 Environmental Sciences; 06 Biological Sciences; 0602 Ecology; 0502 Environmental Science and Management,05 Environmental Sciences,06 Biological Sciences,0602 Ecology,0502 Environmental Science and Management,
63,400,pub.1047102464,10.1126/science.1128035,16794081,,"Depletion, Degradation, and Recovery Potential of Estuaries and Coastal Seas",Science,,"Animals; Biodiversity; Conservation of Natural Resources; Ecosystem; Environment; Eutrophication; Geography; History, 18th Century; History, 19th Century; History, 20th Century; History, 21st Century; History, Ancient; History, Medieval; Human Activities; Humans; Invertebrates; Plants; Population Density; Population Dynamics; Seawater; Vertebrates; Water; Water Pollution",2006-06-23,2006,312,5781,1806-1809,"All OA; Green, Accepted & Submitted",Article,"Lotze, Heike K.; Lenihan, Hunter S.; Bourque, Bruce J.; Bradbury, Roger H.; Cooke, Richard G.; Kay, Matthew C.; Kidwell, Susan M.; Kirby, Michael X.; Peterson, Charles H.; Jackson, Jeremy B. C.",,"Lotze, Heike K. (Dalhousie University); Lenihan, Hunter S. (University of California, Santa Barbara); Bourque, Bruce J. (Bates College); Bradbury, Roger H. (Australian National University); Cooke, Richard G. (Smithsonian Tropical Research Institute); Kay, Matthew C. (University of California, Santa Barbara); Kidwell, Susan M. (); Kirby, Michael X. (University of Florida); Peterson, Charles H. (University of North Carolina at Chapel Hill); Jackson, Jeremy B. C. (Smithsonian Tropical Research Institute; Scripps Institution of Oceanography)",1539,360,14.29,148.45,https://repository.si.edu/bitstream/handle/10088/4128/Lotze_et_al_2006_Science.pdf,https://app.dimensions.ai/details/publication/pub.1047102464,05 Environmental Sciences; 06 Biological Sciences; 0602 Ecology; 0502 Environmental Science and Management,05 Environmental Sciences,06 Biological Sciences,0602 Ecology,0502 Environmental Science and Management,
64,100,pub.1049542184,10.2112/03-0136.1,,,Deposition and Long-Shore Transport of Dredge Spoils to Nourish Beaches: Impacts on Benthic Infauna of an Ebb-Tidal Delta,Journal of Coastal Research,,,2006-05,2006,223,,530-546,Closed,Article,"Bishop, Melanie J.; Peterson, Charles H.; Summerson, Henry C.; Lenihan, Hunter S.; Grabowski, Jonathan H.",,"Bishop, Melanie J. (University of North Carolina at Chapel Hill); Peterson, Charles H. (University of North Carolina at Chapel Hill); Summerson, Henry C. (University of North Carolina at Chapel Hill); Lenihan, Hunter S. (University of North Carolina at Chapel Hill); Grabowski, Jonathan H. (University of North Carolina at Chapel Hill)",19,1,,,,https://app.dimensions.ai/details/publication/pub.1049542184,09 Engineering; 04 Earth Sciences,09 Engineering,04 Earth Sciences,,,
65,100,pub.1035998113,10.1146/annurev.ecolsys.36.102003.152638,,,INTRODUCTION OF NON-NATIVE OYSTERS: Ecosystem Effects and Restoration Implications,Annual Review of Ecology Evolution and Systematics,,,2005-12,2005,36,1,643-689,Closed,Article,"Ruesink, Jennifer L.; Lenihan, Hunter S.; Trimble, Alan C.; Heiman, Kimberly W.; Micheli, Fiorenza; Byers, James E.; Kay, Matthew C.",,"Ruesink, Jennifer L. (University of Washington); Lenihan, Hunter S. (University of California, Santa Barbara); Trimble, Alan C. (University of Washington); Heiman, Kimberly W. (Stanford University); Micheli, Fiorenza (Stanford University); Byers, James E. (University of New Hampshire); Kay, Matthew C. (University of California, Santa Barbara)",259,41,,24.58,,https://app.dimensions.ai/details/publication/pub.1035998113,0602 Ecology; 0502 Environmental Science and Management; 0501 Ecological Applications; 05 Environmental Sciences; 06 Biological Sciences,0602 Ecology,0502 Environmental Science and Management,0501 Ecological Applications,05 Environmental Sciences,06 Biological Sciences
66,100,pub.1048062649,10.1016/j.dsr.2004.12.002,,,Selective predation by the zoarcid fish Thermarces cerberus at hydrothermal vents,Deep Sea Research Part I Oceanographic Research Papers,,,2005-05,2005,52,5,837-844,Closed,Article,"Sancho, G.; Fisher, C.R.; Mills, S.; Micheli, F.; Johnson, G.A.; Lenihan, H.S.; Peterson, C.H.; Mullineaux, L.S.","Sancho, G.","Sancho, G. (College of Charleston); Fisher, C.R. (Pennsylvania State University); Mills, S. (Woods Hole Oceanographic Institution); Micheli, F. (Stanford University); Johnson, G.A. (University of North Carolina at Chapel Hill); Lenihan, H.S. (); Peterson, C.H. (University of North Carolina at Chapel Hill); Mullineaux, L.S. (Woods Hole Oceanographic Institution)",21,3,,1.79,,https://app.dimensions.ai/details/publication/pub.1048062649,04 Earth Sciences; 0403 Geology; 0405 Oceanography; 0402 Geochemistry,04 Earth Sciences,0403 Geology,0405 Oceanography,0402 Geochemistry,
67,400,pub.1052499032,10.1016/j.marpolbul.2004.01.007,15234873,,"Benthic changes during 10 years of organic enrichment by McMurdo Station, Antarctica",Marine Pollution Bulletin,,Animals; Antarctic Regions; Environmental Monitoring; Polychaeta; Population Dynamics; Sewage; Water Pollutants,2004-07,2004,49,1-2,43-60,Closed,Article,"Conlan, Kathleen E.; Kim, Stacy L.; Lenihan, Hunter S.; Oliver, John S.","Conlan, Kathleen E.","Conlan, Kathleen E. (Canadian Museum of Nature); Kim, Stacy L. (California State University Los Angeles); Lenihan, Hunter S. (California State University Los Angeles); Oliver, John S. (California State University Los Angeles)",56,4,0.76,4,,https://app.dimensions.ai/details/publication/pub.1052499032,0602 Ecology; 06 Biological Sciences,0602 Ecology,06 Biological Sciences,,,
