,"""About the data: Exported on Nov 01, 2019. Criteria: Researcher is Hunter Stanton Lenihan. © 2019 Digital Science and Research Solutions Inc. All rights reserved. Unless otherwise agreed, redistribution / external use of this work is not permitted.""
",Unnamed: 1,Unnamed: 2,Unnamed: 3,Unnamed: 4,Unnamed: 5,Unnamed: 6,Unnamed: 7,Unnamed: 8,Unnamed: 9,Unnamed: 10,Unnamed: 11,Unnamed: 12,Unnamed: 13,Unnamed: 14,Unnamed: 15,Unnamed: 16,Unnamed: 17,Unnamed: 18,Unnamed: 19,Unnamed: 20,Unnamed: 21,Unnamed: 22,Unnamed: 23,Unnamed: 24,Unnamed: 25,Unnamed: 26,Unnamed: 27,Unnamed: 28,Unnamed: 29,Unnamed: 30
68,200,pub.1071177083,10.3354/meps261063,,,Variation in marine benthic community composition allows discrimination of multiple stressors,Marine Ecology Progress Series,,,2003,2003,261,,63-73,All OA; Gold,Article,"Lenihan, HS; Peterson, CH; Kim, SL; Conlan, KE; Fairey, R; McDonald, C; Grabowski, JH; Oliver, JS",,"Lenihan, HS (); Peterson, CH (); Kim, SL (); Conlan, KE (); Fairey, R (); McDonald, C (); Grabowski, JH (); Oliver, JS ()",49,4,,4.35,https://www.int-res.com/articles/meps2003/261/m261p063.pdf,https://app.dimensions.ai/details/publication/pub.1071177083,0602 Ecology; 0405 Oceanography; 04 Earth Sciences; 06 Biological Sciences; 0608 Zoology,0602 Ecology,0405 Oceanography,04 Earth Sciences,06 Biological Sciences,0608 Zoology
69,100,pub.1019066858,10.1890/0012-9615(2002)072[0365:pscads]2.0.co;2,,,PREDATION STRUCTURES COMMUNITIES AT DEEP‐SEA HYDROTHERMAL VENTS,Ecological Monographs,,,2002-08,2002,72,3,365-382,Closed,Article,"Micheli, Fiorenza; Peterson, Charles H.; Mullineaux, Lauren S.; Fisher, Charles R.; Mills, Susan W.; Sancho, Gorka; Johnson, Galen A.; Lenihan, Hunter S.",,"Micheli, Fiorenza (Stanford University); Peterson, Charles H. (University of North Carolina at Chapel Hill); Mullineaux, Lauren S. (Woods Hole Oceanographic Institution); Fisher, Charles R. (Pennsylvania State University); Mills, Susan W. (Woods Hole Oceanographic Institution); Sancho, Gorka (Woods Hole Oceanographic Institution); Johnson, Galen A. (University of North Carolina at Chapel Hill); Lenihan, Hunter S. (University of California, Santa Barbara)",90,8,,8,,https://app.dimensions.ai/details/publication/pub.1019066858,05 Environmental Sciences; 06 Biological Sciences; 0602 Ecology; 0502 Environmental Science and Management,05 Environmental Sciences,06 Biological Sciences,0602 Ecology,0502 Environmental Science and Management,
70,400,pub.1006839889,10.1126/science.1059199,11474098,,Historical Overfishing and the Recent Collapse of Coastal Ecosystems,Science,,Animals; Archaeology; Bacteria; Cnidaria; Conservation of Natural Resources; Ecosystem; Eutrophication; Fishes; Geologic Sediments; Humans; Marine Biology; Seaweed; Shellfish; Time Factors,2001-07-27,2001,293,5530,629-637,"All OA; Green, Accepted & Submitted",Article,"Jackson, Jeremy B. C.; Kirby, Michael X.; Berger, Wolfgang H.; Bjorndal, Karen A.; Botsford, Louis W.; Bourque, Bruce J.; Bradbury, Roger H.; Cooke, Richard; Erlandson, Jon; Estes, James A.; Hughes, Terence P.; Kidwell, Susan; Lange, Carina B.; Lenihan, Hunter S.; Pandolfi, John M.; Peterson, Charles H.; Steneck, Robert S.; Tegner, Mia J.; Warner, Robert R.",,"Jackson, Jeremy B. C. (University of California, San Diego; Smithsonian Tropical Research Institute); Kirby, Michael X. (University of California, Santa Barbara); Berger, Wolfgang H. (University of California, San Diego); Bjorndal, Karen A. (University of Florida); Botsford, Louis W. (University of California, Davis); Bourque, Bruce J. (Bates College); Bradbury, Roger H. (Australian National University); Cooke, Richard (Smithsonian Tropical Research Institute); Erlandson, Jon (University of Oregon); Estes, James A. (University of California, Santa Cruz); Hughes, Terence P. (James Cook University); Kidwell, Susan (); Lange, Carina B. (University of California, San Diego); Lenihan, Hunter S. (University of North Carolina at Chapel Hill); Pandolfi, John M. (National Museum of Natural History); Peterson, Charles H. (University of North Carolina at Chapel Hill); Steneck, Robert S. (University of Maine); Tegner, Mia J. (University of California, San Diego); Warner, Robert R. (University of California, Santa Barbara)",3418,482,23.76,350.69,https://repository.si.edu/bitstream/handle/10088/1463/jacksonsciencepaper.pdf,https://app.dimensions.ai/details/publication/pub.1006839889,05 Environmental Sciences; 06 Biological Sciences; 0602 Ecology; 0502 Environmental Science and Management,05 Environmental Sciences,06 Biological Sciences,0602 Ecology,0502 Environmental Science and Management,
71,100,pub.1012347576,10.1890/1051-0761(2001)011[0764:cohdor]2.0.co;2,,,CASCADING OF HABITAT DEGRADATION: OYSTER REEFS INVADED BY REFUGEE FISHES ESCAPING STRESS,Ecological Applications,,,2001-06,2001,11,3,764-782,All OA; Gold,Article,"Lenihan, Hunter S.; Peterson, Charles H.; Byers, James E.; Grabowski, Jonathan H.; Thayer, Gordon W.; Colby, David R.",,"Lenihan, Hunter S. (); Peterson, Charles H. (); Byers, James E. (); Grabowski, Jonathan H. (); Thayer, Gordon W. (); Colby, David R. ()",135,12,,13.85,https://esajournals.onlinelibrary.wiley.com/doi/pdf/10.1890/1051-0761%282001%29011%5B0764%3ACOHDOR%5D2.0.CO%3B2,https://app.dimensions.ai/details/publication/pub.1012347576,05 Environmental Sciences; 06 Biological Sciences; 0602 Ecology; 0502 Environmental Science and Management,05 Environmental Sciences,06 Biological Sciences,0602 Ecology,0502 Environmental Science and Management,
72,200,pub.1070048900,10.2307/2657157,,,Physical-Biological Coupling on Oyster Reefs: How Habitat Structure Influences Individual Performance,Ecological Monographs,,,1999-08,1999,69,3,251,Closed,Article,"Lenihan, Hunter S.",,"Lenihan, Hunter S. ()",11,1,,,,https://app.dimensions.ai/details/publication/pub.1070048900,0602 Ecology; 0406 Physical Geography and Environmental Geoscience; 0501 Ecological Applications; 04 Earth Sciences; 05 Environmental Sciences; 06 Biological Sciences,0602 Ecology,0406 Physical Geography and Environmental Geoscience,0501 Ecological Applications,04 Earth Sciences,05 Environmental Sciences
73,100,pub.1050325482,10.1890/0012-9615(1999)069[0251:pbcoor]2.0.co;2,,,PHYSICAL–BIOLOGICAL COUPLING ON OYSTER REEFS: HOW HABITAT STRUCTURE INFLUENCES INDIVIDUAL PERFORMANCE,Ecological Monographs,,,1999-08,1999,69,3,251-275,Closed,Article,"Lenihan, Hunter S.",,"Lenihan, Hunter S. (University of North Carolina at Chapel Hill)",184,25,,,,https://app.dimensions.ai/details/publication/pub.1050325482,05 Environmental Sciences; 06 Biological Sciences; 0602 Ecology; 0502 Environmental Science and Management,05 Environmental Sciences,06 Biological Sciences,0602 Ecology,0502 Environmental Science and Management,
74,100,pub.1018184212,10.4319/lo.1999.44.3_part_2.0910,,,The influence of multiple environmental stressors on susceptibility to parasites: An experimental determination with oysters,Limnology and Oceanography,,,1999-05,1999,44,3part2,910-924,"All OA; Green, Accepted & Submitted",Article,"Lenihan, Hunter S.; Micheli, Fiorenza; Shelton, Stephen W.; Peterson, Charles H.",,"Lenihan, Hunter S. (University of North Carolina at Chapel Hill); Micheli, Fiorenza (University of North Carolina at Chapel Hill); Shelton, Stephen W. (); Peterson, Charles H. ()",88,8,,,http://www.aslo.org/lo/toc/vol_44/issue_3_part_2/0910.pdf,https://app.dimensions.ai/details/publication/pub.1018184212,0602 Ecology; 06 Biological Sciences,0602 Ecology,06 Biological Sciences,,,
75,100,pub.1007279613,10.1890/1051-0761(1998)008[0128:hhdtfd]2.0.co;2,,,HOW HABITAT DEGRADATION THROUGH FISHERY DISTURBANCE ENHANCES IMPACTS OF HYPOXIA ON OYSTER REEFS,Ecological Applications,,,1998-02,1998,8,1,128-140,Closed,Article,"Lenihan, Hunter S.; Peterson, Charles H.",,"Lenihan, Hunter S. (University of North Carolina at Chapel Hill); Peterson, Charles H. (University of North Carolina at Chapel Hill)",229,27,,,,https://app.dimensions.ai/details/publication/pub.1007279613,0602 Ecology; 0502 Environmental Science and Management; 0704 Fisheries Sciences; 0501 Ecological Applications; 05 Environmental Sciences; 06 Biological Sciences; 07 Agricultural and Veterinary Sciences,0602 Ecology,0502 Environmental Science and Management,0704 Fisheries Sciences,0501 Ecological Applications,05 Environmental Sciences
76,200,pub.1071174536,10.3354/meps166001,,,Ice scour disturbance to benthic communities in the Canadian High Arctic,Marine Ecology Progress Series,,,1998,1998,166,,1-16,All OA; Gold,Article,"Conlan, KE; Lenihan, HS; Kvitek, RG; Oliver, JS",,"Conlan, KE (); Lenihan, HS (); Kvitek, RG (); Oliver, JS ()",77,12,,,https://www.int-res.com/articles/meps/166/m166p001.pdf,https://app.dimensions.ai/details/publication/pub.1071174536,0602 Ecology; 0405 Oceanography; 04 Earth Sciences; 06 Biological Sciences; 0608 Zoology,0602 Ecology,0405 Oceanography,04 Earth Sciences,06 Biological Sciences,0608 Zoology
77,100,pub.1052047792,10.4319/lo.1996.41.6.1359,,,Does flow speed also have a direct effect on growth of active suspension‐feeders: An experimental test on oysters,Limnology and Oceanography,,,1996-09,1996,41,6,1359-1366,All OA; Gold,Article,"Lenihan, Hunter S.; Peterson, Charles H.; Allen, Jennifer M.",,"Lenihan, Hunter S. (); Peterson, Charles H. (); Allen, Jennifer M. ()",65,7,,,http://onlinelibrary.wiley.com/doi/10.4319/lo.1996.41.6.1359/pdf,https://app.dimensions.ai/details/publication/pub.1052047792,04 Earth Sciences; 05 Environmental Sciences; 06 Biological Sciences,04 Earth Sciences,05 Environmental Sciences,06 Biological Sciences,,
78,100,pub.1009607509,10.1016/0022-0981(95)00070-8,,,Patterns of survival and behavior in Antarctic benthic invertebrates exposed to contaminated sediments: field and laboratory bioassay experiments,Journal of Experimental Marine Biology and Ecology,,,1995-11,1995,192,2,233-255,Closed,Article,"Lenihan, Hunter S.; Kiest, Kim A.; Conlan, Kathleen E.; Slattery, Peter N.; Konar, Brenda H.; Oliver, John S.","Lenihan, Hunter S.","Lenihan, Hunter S. (California State University Los Angeles); Kiest, Kim A. (California State University Los Angeles); Conlan, Kathleen E. (Canadian Museum of Nature); Slattery, Peter N. (California State University Los Angeles); Konar, Brenda H. (California State University Los Angeles); Oliver, John S. (California State University Los Angeles)",38,2,,,,https://app.dimensions.ai/details/publication/pub.1009607509,0602 Ecology; 06 Biological Sciences,0602 Ecology,06 Biological Sciences,,,
79,100,pub.1038690751,10.1016/0025-326x(92)90689-4,,,"Benthic marine pollution around McMurdo Station, Antarctica: A summary of findings",Marine Pollution Bulletin,,,1992-01,1992,25,9-12,318-323,Closed,Article,"Lenihan, Hunter S.",,"Lenihan, Hunter S. (California State University Los Angeles)",47,3,,,,https://app.dimensions.ai/details/publication/pub.1038690751,05 Environmental Sciences; 06 Biological Sciences; 0602 Ecology; 0502 Environmental Science and Management,05 Environmental Sciences,06 Biological Sciences,0602 Ecology,0502 Environmental Science and Management,
80,100,pub.1042741548,10.1016/0025-326x(90)90761-v,,,"Intense and localized benthic marine pollution around McMurdo Station, Antarctica",Marine Pollution Bulletin,,,1990-09,1990,21,9,422-430,Closed,Article,"Lenihan, Hunter S.; Oliver, John S.; Oakden, James M.; Stephenson, Mark D.",,"Lenihan, Hunter S. (California State University Los Angeles); Oliver, John S. (California State University Los Angeles); Oakden, James M. (California State University Los Angeles); Stephenson, Mark D. (California State University Los Angeles)",88,5,,,,https://app.dimensions.ai/details/publication/pub.1042741548,05 Environmental Sciences; 06 Biological Sciences; 0602 Ecology; 0502 Environmental Science and Management,05 Environmental Sciences,06 Biological Sciences,0602 Ecology,0502 Environmental Science and Management,
81,200,pub.1071166282,10.3354/meps060147,,,Changes in hard bottom communities related to boat mooring and tributyltin in San Diego Bay a natural experiment,Marine Ecology Progress Series,,,1990,1990,60,,147-159,All OA; Gold,Article,"Lenihan, HS; Oliver, JS; Stephenson, MA",,"Lenihan, HS (); Oliver, JS (); Stephenson, MA ()",25,2,,,https://doi.org/10.3354/meps060147,https://app.dimensions.ai/details/publication/pub.1071166282,0602 Ecology; 0405 Oceanography; 04 Earth Sciences; 06 Biological Sciences; 0608 Zoology,0602 Ecology,0405 Oceanography,04 Earth Sciences,06 Biological Sciences,0608 Zoology
