,"""About the data: Exported on Nov 01, 2019. Criteria: Researcher is Jay C Means. © 2019 Digital Science and Research Solutions Inc. All rights reserved. Unless otherwise agreed, redistribution / external use of this work is not permitted.""
",Unnamed: 1,Unnamed: 2,Unnamed: 3,Unnamed: 4,Unnamed: 5,Unnamed: 6,Unnamed: 7,Unnamed: 8,Unnamed: 9,Unnamed: 10,Unnamed: 11,Unnamed: 12,Unnamed: 13,Unnamed: 14,Unnamed: 15,Unnamed: 16,Unnamed: 17,Unnamed: 18,Unnamed: 19,Unnamed: 20,Unnamed: 21,Unnamed: 22,Unnamed: 23,Unnamed: 24,Unnamed: 25,Unnamed: 26,Unnamed: 27,Unnamed: 28,Unnamed: 29,Unnamed: 30
0,Rank,Publication ID,DOI,PMID,PMCID,Title,Source title,Anthology title,MeSH terms,Publication Date,PubYear,Volume,Issue,Pagination,Open Access,Publication Type,Authors,Corresponding Author,Authors Affiliations,Times cited,Recent citations,RCR,FCR,Source Linkout,Dimensions URL,FOR (ANZSRC) Categories,FOR 1,FOR 2,FOR 3,FOR 4,FOR 5
1,500,pub.1055089801,10.1021/acs.est.6b05015,27998057,,Spatial Models of Sewer Pipe Leakage Predict the Occurrence of Wastewater Indicators in Shallow Urban Groundwater.,Environmental Science & Technology,,"Groundwater; Models, Theoretical; Sweetening Agents; Waste Disposal, Fluid; Waste Water; Water Pollutants, Chemical",2017-02-07,2017,51,3,1213-1223,Closed,Article,"Roehrdanz, Patrick R; Feraud, Marina; Lee, Do Gyun; Means, Jay C; Snyder, Shane A; Holden, Patricia A",,"Roehrdanz, Patrick R (University of California, Santa Barbara); Feraud, Marina (University of California, Santa Barbara); Lee, Do Gyun (University of California, Santa Barbara; Incheon National University); Means, Jay C (University of California, Santa Barbara); Snyder, Shane A (University of Arizona); Holden, Patricia A (University of California, Santa Barbara)",7,7,0,2.29,,https://app.dimensions.ai/details/publication/pub.1055089801,09 Engineering; 0907 Environmental Engineering,09 Engineering,0907 Environmental Engineering,,,
2,400,pub.1028200135,10.1016/j.watres.2015.08.048,26379202,,Wastewater compounds in urban shallow groundwater wells correspond to exfiltration probabilities of nearby sewers,Water Research,,"California; Groundwater; Models, Theoretical; Sewage; Waste Disposal, Fluid; Waste Water; Water Pollutants, Chemical; Water Wells",2015-11,2015,85,J. Environ. Manag. 144 2014,467-475,All OA; Gold,Article,"Lee, Do Gyun; Roehrdanz, Patrick R; Feraud, Marina; Ervin, Jared; Anumol, Tarun; Jia, Ai; Park, Minkyu; Tamez, Carlos; Morelius, Erving W; Gardea-Torresdey, Jorge L; Izbicki, John; Means, Jay C; Snyder, Shane A; Holden, Patricia A","Holden, Patricia A","Lee, Do Gyun (); Roehrdanz, Patrick R (); Feraud, Marina (); Ervin, Jared (); Anumol, Tarun (University of Arizona); Jia, Ai (University of Arizona); Park, Minkyu (University of Arizona); Tamez, Carlos (); Morelius, Erving W (); Gardea-Torresdey, Jorge L (); Izbicki, John (); Means, Jay C (); Snyder, Shane A (University of Arizona); Holden, Patricia A ()",12,6,1.59,2.33,https://manuscript.elsevier.com/S0043135415301998/pdf/S0043135415301998.pdf,https://app.dimensions.ai/details/publication/pub.1028200135,09 Engineering; 0907 Environmental Engineering,09 Engineering,0907 Environmental Engineering,,,
3,400,pub.1079035016,,25620179,,Profile of select hepatic insulin signaling pathway genes in response to 2-aminoanthracene dietary ingestion.,Journal of Biological Regulators and Homeostatic Agents,,"AMP-Activated Protein Kinases; Animals; Anthracenes; Glucose Transporter Type 4; Glucose-6-Phosphatase; Insulin; Male; RNA, Messenger; Rats; Rats, Inbred F344; Signal Transduction; Suppressor of Cytokine Signaling Proteins",2014,2014,28,4,693-704,Closed,Article,"Mattis, N D; Jay, J W; Barnett, G W; Rosaldo, J J; Howerth, E W; Means, J C; Gato, W E",,"Mattis, N D (Georgia Southern University); Jay, J W (Georgia Southern University); Barnett, G W (Georgia Southern University); Rosaldo, J J (Georgia Southern University); Howerth, E W (University of Georgia); Means, J C (University of California, Santa Barbara); Gato, W E (Georgia Southern University)",3,0,0.36,1,,https://app.dimensions.ai/details/publication/pub.1079035016,11 Medical and Health Sciences; 1103 Clinical Sciences,11 Medical and Health Sciences,1103 Clinical Sciences,,,
4,400,pub.1072240667,10.4103/0971-6580.128796,24748736,PMC3989916,Time-Dependent Regulation of Apoptosis by AEN and BAX in Response to 2-Aminoanthracene Dietary Consumption.,Toxicology International,,,2014,2014,21,1,57-64,"All OA; Green, Published",Article,"Gato, Worlanyo Eric; McGee, Stacey R; Hales, Dale B; Means, Jay C",,"Gato, Worlanyo Eric (Georgia Southern University); McGee, Stacey R (Southern Illinois University System); Hales, Dale B (Southern Illinois University System); Means, Jay C (University of California, Santa Barbara)",2,1,0.08,0.26,https://www.ncbi.nlm.nih.gov/pmc/articles/PMC3989916/pdf,https://app.dimensions.ai/details/publication/pub.1072240667,0604 Genetics; 06 Biological Sciences,0604 Genetics,06 Biological Sciences,,,
5,100,pub.1036819633,10.3923/crc.2012.1.17,,,Mass Spectrometric Investigation of Liver Proteins Isolated from 2-Aminoanthracene Exposed Fisher-344 Rats,Current Research in Chemistry,,,2012-01-01,2012,4,1,1-17,Closed,Article,"Gato, Worlanyo E.; Abshiro, Henok D.; Zargham, Emilia O.; Means, Jay C.",,"Gato, Worlanyo E. (); Abshiro, Henok D. (); Zargham, Emilia O. (); Means, Jay C. ()",0,0,,0,,https://app.dimensions.ai/details/publication/pub.1036819633,0601 Biochemistry and Cell Biology; 06 Biological Sciences,0601 Biochemistry and Cell Biology,06 Biological Sciences,,,
6,400,pub.1047941919,10.2131/jts.37.1001,23038007,,Hepatic gene expression analysis of 2-aminoanthracene exposed Fisher-344 rats reveal patterns indicative of liver carcinoma and type 2 diabetes,The Journal of Toxicological Sciences,,"Animals; Anthracenes; Carcinogens; Carcinoma, Hepatocellular; Diabetes Mellitus, Type 2; Gene Expression Profiling; Gene Expression Regulation; Liver; Liver Neoplasms; Male; Mutagens; Rats; Rats, Inbred F344",2012,2012,37,5,1001,All OA; Gold,Article,"Gato, Worlanyo E; Hales, Dale B; Means, Jay C",,"Gato, Worlanyo E (Southern Illinois University Carbondale); Hales, Dale B (); Means, Jay C ()",10,5,0.44,2.66,https://www.jstage.jst.go.jp/article/jts/37/5/37_1001/_pdf,https://app.dimensions.ai/details/publication/pub.1047941919,11 Medical and Health Sciences; 1103 Clinical Sciences,11 Medical and Health Sciences,1103 Clinical Sciences,,,
7,100,pub.1020714703,10.3923/rjet.2011.251.265,,,Exploring Transcriptional Relationships Within Fisher-344 Rats Exposed to 2-Aminoanthracene using VisANT Network Modeling and Gene Ontology Tools,Research Journal of Environmental Toxicology,,,2011-04-01,2011,5,4,251-265,All OA; Gold,Article,"Gato, Worlanyo E.; Means, Jay C.",,"Gato, Worlanyo E. (); Means, Jay C. ()",2,0,,0.18,https://scialert.net/qredirect.php?doi=rjet.2011.251.265&linkid=pdf,https://app.dimensions.ai/details/publication/pub.1020714703,0604 Genetics; 0601 Biochemistry and Cell Biology; 06 Biological Sciences,0604 Genetics,0601 Biochemistry and Cell Biology,06 Biological Sciences,,
8,100,pub.1048942578,10.3923/ajbmb.2011.275.283,,,Single Cell Gel Electrophoretic Analysis of 2-Aminoanthracene Exposed F-344 Rats,American Journal of Biochemistry and Molecular Biology,,,2011-03-01,2011,1,3,275-283,All OA; Gold,Article,"Gato, Worlanyo E.; Means, Jay C.",,"Gato, Worlanyo E. (); Means, Jay C. ()",7,1,,0.61,https://scialert.net/qredirect.php?doi=ajbmb.2011.275.283&linkid=pdf,https://app.dimensions.ai/details/publication/pub.1048942578,0604 Genetics; 06 Biological Sciences,0604 Genetics,06 Biological Sciences,,,
9,100,pub.1027395962,10.3923/jpt.2011.234.248,,,Pancreatic Gene Expression Altered Following Dietary Exposure to 2-Aminoanthracene: Links to Diabetogenic Activity,Journal of Pharmacology and Toxicology,,,2011-03-01,2011,6,3,234-248,All OA; Gold,Article,"Gato, W.E.; Means, J.C.",,"Gato, W.E. (); Means, J.C. ()",11,1,,1.64,https://scialert.net/qredirect.php?doi=jpt.2011.234.248&linkid=pdf,https://app.dimensions.ai/details/publication/pub.1027395962,0304 Medicinal and Biomolecular Chemistry; 11 Medical and Health Sciences; 1115 Pharmacology and Pharmaceutical Sciences; 03 Chemical Sciences,0304 Medicinal and Biomolecular Chemistry,11 Medical and Health Sciences,1115 Pharmacology and Pharmaceutical Sciences,03 Chemical Sciences,
