,"""About the data: Exported on Nov 01, 2019. Criteria: Researcher is Richard Lee Church. © 2019 Digital Science and Research Solutions Inc. All rights reserved. Unless otherwise agreed, redistribution / external use of this work is not permitted.""
",Unnamed: 1,Unnamed: 2,Unnamed: 3,Unnamed: 4,Unnamed: 5,Unnamed: 6,Unnamed: 7,Unnamed: 8,Unnamed: 9,Unnamed: 10,Unnamed: 11,Unnamed: 12,Unnamed: 13,Unnamed: 14,Unnamed: 15,Unnamed: 16,Unnamed: 17,Unnamed: 18,Unnamed: 19,Unnamed: 20,Unnamed: 21,Unnamed: 22,Unnamed: 23,Unnamed: 24,Unnamed: 25,Unnamed: 26,Unnamed: 27,Unnamed: 28,Unnamed: 29,Unnamed: 30
74,100,pub.1030229813,10.1016/s0169-2046(00)00119-5,,,Habitat evaluation using GIS A case study applied to the San Joaquin Kit Fox,Landscape and Urban Planning,,,2001-01,2001,52,4,239-255,Closed,Article,"Gerrard, Ross; Stine, Peter; Church, Richard; Gilpin, Michael","Gerrard, Ross","Gerrard, Ross (University of California, Santa Barbara); Stine, Peter (California State University, Sacramento); Church, Richard (University of California, Santa Barbara); Gilpin, Michael (University of California, San Diego)",27,3,,3.56,,https://app.dimensions.ai/details/publication/pub.1030229813,05 Environmental Sciences; 0502 Environmental Science and Management,05 Environmental Sciences,0502 Environmental Science and Management,,,
75,100,pub.1004047085,10.1023/a:1018991116559,,,Forest management models and combinatorial algorithms: analysis of state of the art,Annals of Operations Research,,,2000-11,2000,96,1-4,271-285,Closed,Article,"Weintraub, Andres; Church, Richard L.; Murray, Alan T.; Guignard, Monique",,"Weintraub, Andres (University of Chile); Church, Richard L. (University of California, Santa Barbara); Murray, Alan T. (The Ohio State University); Guignard, Monique (University of Pennsylvania)",24,4,,,,https://app.dimensions.ai/details/publication/pub.1004047085,"08 Information and Computing Sciences; 01 Mathematical Sciences; 15 Commerce, Management, Tourism and Services",08 Information and Computing Sciences,01 Mathematical Sciences,"15 Commerce, Management, Tourism and Services",,
76,100,pub.1048836045,10.1111/j.1538-4632.2000.tb00430.x,,,Contiguity Constraints for Single‐Region Site Search Problems,Geographical Analysis,,,2000-10,2000,32,4,306-329,All OA; Gold,Article,"Cova, Thomas J.; Church, Richard L.",,"Cova, Thomas J. (University of Utah); Church, Richard L. (University of California, Santa Barbara)",77,8,,13.43,https://onlinelibrary.wiley.com/doi/pdf/10.1111/j.1538-4632.2000.tb00430.x,https://app.dimensions.ai/details/publication/pub.1048836045,09 Engineering; 16 Studies in Human Society; 0909 Geomatic Engineering; 0406 Physical Geography and Environmental Geoscience; 1604 Human Geography; 04 Earth Sciences,09 Engineering,16 Studies in Human Society,0909 Geomatic Engineering,0406 Physical Geography and Environmental Geoscience,1604 Human Geography
77,100,pub.1042421907,10.1016/s0198-9715(00)00015-6,,,Exploratory spatial optimization in site search: a neighborhood operator approach,Computers Environment and Urban Systems,,,2000-09,2000,24,5,401-419,Closed,Article,"Cova, T.J.; Church, R.L.","Cova, T.J.","Cova, T.J. (University of Utah); Church, R.L. (University of California, Santa Barbara)",31,4,,5.89,,https://app.dimensions.ai/details/publication/pub.1042421907,09 Engineering; 0909 Geomatic Engineering; 12 Built Environment and Design; 1205 Urban and Regional Planning,09 Engineering,0909 Geomatic Engineering,12 Built Environment and Design,1205 Urban and Regional Planning,
78,100,pub.1003940681,10.1016/s0038-0121(99)00019-1,,,The school boundary stability problem over time,Socio-Economic Planning Sciences,,,2000-09,2000,34,3,159-176,Closed,Article,"Lemberg, David S; Church, Richard L","Lemberg, David S","Lemberg, David S (Western Michigan University); Church, Richard L (University of California, Santa Barbara)",24,6,,5.24,,https://app.dimensions.ai/details/publication/pub.1003940681,0102 Applied Mathematics; 01 Mathematical Sciences; 12 Built Environment and Design; 1205 Urban and Regional Planning,0102 Applied Mathematics,01 Mathematical Sciences,12 Built Environment and Design,1205 Urban and Regional Planning,
79,100,pub.1043915187,10.1016/s0377-2217(99)00215-5,,,Support system development for forest ecosystem management,European Journal of Operational Research,,,2000-03,2000,121,2,247-258,Closed,Article,"Church, Richard L; Murray, Alan T; Figueroa, Michael A; Barber, Klaus H","Murray, Alan T","Church, Richard L (University of California, Santa Barbara); Murray, Alan T (The Ohio State University); Figueroa, Michael A (University of California, Santa Barbara); Barber, Klaus H ()",30,8,,7.65,,https://app.dimensions.ai/details/publication/pub.1043915187,08 Information and Computing Sciences; 0801 Artificial Intelligence and Image Processing; 0806 Information Systems,08 Information and Computing Sciences,0801 Artificial Intelligence and Image Processing,0806 Information Systems,,
80,100,pub.1007852171,10.1016/s0968-090x(00)00019-x,,,Mapping evacuation risk on transportation networks using a spatial optimization model,Transportation Research Part C Emerging Technologies,,,2000-02,2000,8,1-6,321-336,Closed,Article,"Church, Richard L.; Cova, Thomas J.","Church, Richard L.","Church, Richard L. (University of California, Santa Barbara); Cova, Thomas J. (University of Utah)",74,16,,,,https://app.dimensions.ai/details/publication/pub.1007852171,"08 Information and Computing Sciences; 09 Engineering; 15 Commerce, Management, Tourism and Services",08 Information and Computing Sciences,09 Engineering,"15 Commerce, Management, Tourism and Services",,
81,100,pub.1049936935,10.1023/a:1018922728855,,,Forest planning at the tactical level,Annals of Operations Research,,,2000-01,2000,95,1-4,3-18,Closed,Article,"Church, Richard L.; Murray, Alan T.; Barber, Klaus H.",,"Church, Richard L. (University of California, Santa Barbara); Murray, Alan T. (The Ohio State University); Barber, Klaus H. ()",8,2,,1.98,,https://app.dimensions.ai/details/publication/pub.1049936935,08 Information and Computing Sciences; 0801 Artificial Intelligence and Image Processing,08 Information and Computing Sciences,0801 Artificial Intelligence and Image Processing,,,
82,100,pub.1023252154,10.1007/s001680050101,,,Location expression standards for ITS: Testing the LRMS Cross Street Profile,The Annals of Regional Science,,,1999-05,1999,33,2,197-212,Closed,Article,"Noronha, Val; Goodchild, Michael; Church, Richard; Fohl, Pete",,"Noronha, Val (University of California, Santa Barbara); Goodchild, Michael (University of California, Santa Barbara); Church, Richard (University of California, Santa Barbara); Fohl, Pete ()",3,0,,,,https://app.dimensions.ai/details/publication/pub.1023252154,16 Studies in Human Society; 1604 Human Geography; 12 Built Environment and Design; 1205 Urban and Regional Planning,16 Studies in Human Society,1604 Human Geography,12 Built Environment and Design,1205 Urban and Regional Planning,
83,100,pub.1039389794,10.1016/s0966-8349(98)00051-5,,,Locational issues in forest management,Location Science,,,1998-05,1998,6,1-4,137-153,Closed,Article,"Church, Richard L.; Murray, Alan T.; Weintraub, Andres","Church, Richard L.","Church, Richard L. (University of California, Santa Barbara); Murray, Alan T. (University of Queensland); Weintraub, Andres (University of Chile)",29,3,,,,https://app.dimensions.ai/details/publication/pub.1039389794,0705 Forestry Sciences; 07 Agricultural and Veterinary Sciences,0705 Forestry Sciences,07 Agricultural and Veterinary Sciences,,,
84,100,pub.1023677852,10.1111/j.1435-5597.1998.tb00706.x,,,IMPACT MODELS FOR SITING UNDESIRABLE FACILITIES,Papers in Regional Science,,,1998-01,1998,77,1,19-36,Closed,Article,"Murray, Alan T.; Church, Richard L.; Gerrard, Ross A.; Tsui, Wing‐Sing",,"Murray, Alan T. (); Church, Richard L. (University of California, Santa Barbara); Gerrard, Ross A. (University of California, Santa Barbara); Tsui, Wing‐Sing ()",26,4,,,,https://app.dimensions.ai/details/publication/pub.1023677852,1402 Applied Economics; 14 Economics,1402 Applied Economics,14 Economics,,,
85,100,pub.1048851811,10.1111/j.1467-9671.1997.tb00004.x,,,Selecting conservation reserves using species‐covering models: Adapting the ARC/INFO GIS,Transactions in GIS,,,1997-10,1997,2,1,45-60,Closed,Article,"GERRARD, ROSS A; CHURCH, RICHARD L; STOMS, DAVID M; DAVIS, FRANK W",,"GERRARD, ROSS A (University of California, Santa Barbara); CHURCH, RICHARD L (University of California, Santa Barbara); STOMS, DAVID M (University of California, Santa Barbara); DAVIS, FRANK W (University of California, Santa Barbara)",15,2,,,,https://app.dimensions.ai/details/publication/pub.1048851811,08 Information and Computing Sciences; 09 Engineering; 16 Studies in Human Society; 0909 Geomatic Engineering; 1604 Human Geography; 0804 Data Format,08 Information and Computing Sciences,09 Engineering,16 Studies in Human Society,0909 Geomatic Engineering,1604 Human Geography
86,100,pub.1031447264,10.1016/s0377-2217(96)00175-0,,,Facets for node packing,European Journal of Operational Research,,,1997-09,1997,101,3,598-608,Closed,Article,"Murray, Alan T.; Church, Richard L.",,"Murray, Alan T. (Queensland University of Technology); Church, Richard L. (Queensland University of Technology; University of California, Santa Barbara)",17,2,,,,https://app.dimensions.ai/details/publication/pub.1031447264,08 Information and Computing Sciences; 0803 Computer Software,08 Information and Computing Sciences,0803 Computer Software,,,
87,100,pub.1026890142,10.1016/s0305-0548(96)00048-2,,,Solving the anti-covering location problem using Lagrangian relaxation,Computers & Operations Research,,,1997-02,1997,24,2,127-140,Closed,Article,"Murray, Alan T.; Church, Richard L.","Murray, Alan T.","Murray, Alan T. (Queensland University of Technology); Church, Richard L. (University of California, Santa Barbara)",18,3,,,,https://app.dimensions.ai/details/publication/pub.1026890142,0103 Numerical and Computational Mathematics; 01 Mathematical Sciences,0103 Numerical and Computational Mathematics,01 Mathematical Sciences,,,
88,100,pub.1050768995,10.1016/s0966-8349(97)00001-6,,,Closest assignment constraints and location models: Properties and structure,Location Science,,,1996-12,1996,4,4,251-270,Closed,Article,"Gerrard, Ross A.; Church, Richard L.",,"Gerrard, Ross A. (University of California, Santa Barbara); Church, Richard L. (University of California, Santa Barbara)",50,9,,,,https://app.dimensions.ai/details/publication/pub.1050768995,03 Chemical Sciences; 0306 Physical Chemistry (incl. Structural),03 Chemical Sciences,0306 Physical Chemistry (incl. Structural),,,
89,100,pub.1004497617,10.1007/bf00226292,,,Applying simulated annealing to location-planning models,Journal of Heuristics,,,1996-06,1996,2,1,31-53,Closed,Article,"Murray, Alan T.; Church, Richard L.",,"Murray, Alan T. (Queensland University of Technology); Church, Richard L. (University of California, Santa Barbara)",105,19,,,,https://app.dimensions.ai/details/publication/pub.1004497617,08 Information and Computing Sciences; 0801 Artificial Intelligence and Image Processing,08 Information and Computing Sciences,0801 Artificial Intelligence and Image Processing,,,
90,100,pub.1020378779,10.1016/0006-3207(95)00102-6,,,Reserve selection as a maximal covering location problem,Biological Conservation,,,1996,1996,76,2,105-112,Closed,Article,"Church, Richard L.; Stoms, David M.; Davis, Frank W.","Church, Richard L.","Church, Richard L. (University of California, Santa Barbara); Stoms, David M. (University of California, Santa Barbara); Davis, Frank W. (University of California, Santa Barbara)",299,13,,,,https://app.dimensions.ai/details/publication/pub.1020378779,05 Environmental Sciences; 0502 Environmental Science and Management,05 Environmental Sciences,0502 Environmental Science and Management,,,
91,200,pub.1057604538,10.1061/(asce)0733-9488(1995)121:3(109),,,Solid-Waste–Disposal Site Location,Journal of Urban Planning and Development,,,1995-09,1995,121,3,109-114,Closed,Article,"Murray, Alan T.; Church, Richard L.",,"Murray, Alan T. (); Church, Richard L. ()",2,0,,,,https://app.dimensions.ai/details/publication/pub.1057604538,"12 Built Environment and Design; 1507 Transportation and Freight Services; 1205 Urban and Regional Planning; 15 Commerce, Management, Tourism and Services",12 Built Environment and Design,1507 Transportation and Freight Services,1205 Urban and Regional Planning,"15 Commerce, Management, Tourism and Services",
92,100,pub.1012428404,10.1007/bf01719265,,,Heuristic solution approaches to operational forest planning problems,OR Spectrum,,,1995-06,1995,17,2-3,193-203,Closed,Article,"Murray, Alan T.; Church, Richard L.","Murray, Alan T.","Murray, Alan T. (University of California, Santa Barbara); Church, Richard L. (University of California, Santa Barbara)",98,11,,,,https://app.dimensions.ai/details/publication/pub.1012428404,"15 Commerce, Management, Tourism and Services; 0102 Applied Mathematics; 1503 Business and Management; 0103 Numerical and Computational Mathematics; 01 Mathematical Sciences","15 Commerce, Management, Tourism and Services",0102 Applied Mathematics,1503 Business and Management,0103 Numerical and Computational Mathematics,01 Mathematical Sciences
93,100,pub.1058156609,10.1068/b220213,,,A General Construct for the Zonally Constrained p-Median Problem,Environment and Planning B Urban Analytics and City Science,,,1995,1995,22,2,213-236,Closed,Article,"Gerrard, R A; Church, R L",,"Gerrard, R A (University of California, Santa Barbara); Church, R L (University of California, Santa Barbara)",6,2,,,,https://app.dimensions.ai/details/publication/pub.1058156609,1201 Architecture; 1203 Design Practice and Management; 12 Built Environment and Design; 1205 Urban and Regional Planning,1201 Architecture,1203 Design Practice and Management,12 Built Environment and Design,1205 Urban and Regional Planning,
94,100,pub.1050603332,10.1111/j.1435-5597.1994.tb00623.x,,,A GENERALIZED APPROACH TO MODELING THE HIERARCHICAL MAXIMAL COVERING LOCATION PROBLEM WITH REFERRAL,Papers in Regional Science,,,1994-10,1994,73,4,425-453,Closed,Article,"Gerrard, Ross A.; Church, Richard L.",,"Gerrard, Ross A. (University of California, Santa Barbara); Church, Richard L. (University of California, Santa Barbara)",13,2,,,,https://app.dimensions.ai/details/publication/pub.1050603332,12 Built Environment and Design; 14 Economics; 16 Studies in Human Society; 1604 Human Geography; 1402 Applied Economics; 1205 Urban and Regional Planning,12 Built Environment and Design,14 Economics,16 Studies in Human Society,1604 Human Geography,1402 Applied Economics
95,100,pub.1015432336,10.1016/0305-0548(94)90064-7,,,Analyzing tradeoffs between zonal constraints and accessibility in facility location,Computers & Operations Research,,,1994-01,1994,21,1,79-99,Closed,Article,"Gerrard, Ross.A.; Church, Richard L.","Church, Richard L.","Gerrard, Ross.A. (University of California, Santa Barbara); Church, Richard L. (University of California, Santa Barbara)",7,1,,,,https://app.dimensions.ai/details/publication/pub.1015432336,0102 Applied Mathematics; 0103 Numerical and Computational Mathematics; 01 Mathematical Sciences,0102 Applied Mathematics,0103 Numerical and Computational Mathematics,01 Mathematical Sciences,,
96,200,pub.1057604501,10.1061/(asce)0733-9488(1993)119:1(23),,,Modeling School Utilization and Consolidation,Journal of Urban Planning and Development,,,1993-03,1993,119,1,23-38,Closed,Article,"Church, Richard L.; Murray, Alan T.",,"Church, Richard L. (); Murray, Alan T. ()",33,7,,,,https://app.dimensions.ai/details/publication/pub.1057604501,"12 Built Environment and Design; 1507 Transportation and Freight Services; 1205 Urban and Regional Planning; 15 Commerce, Management, Tourism and Services",12 Built Environment and Design,1507 Transportation and Freight Services,1205 Urban and Regional Planning,"15 Commerce, Management, Tourism and Services",
97,100,pub.1012708709,10.1002/1520-6750(199302)40:1<129::aid-nav3220400109>3.0.co;2-t,,,Maximal covering tree problems,Naval Research Logistics,,,1993-02,1993,40,1,129-142,Closed,Article,"Church, Richard; Current, John",,"Church, Richard (University of California, Santa Barbara); Current, John (The Ohio State University)",10,1,,,,https://app.dimensions.ai/details/publication/pub.1012708709,"15 Commerce, Management, Tourism and Services; 0102 Applied Mathematics; 1503 Business and Management; 0103 Numerical and Computational Mathematics; 01 Mathematical Sciences","15 Commerce, Management, Tourism and Services",0102 Applied Mathematics,1503 Business and Management,0103 Numerical and Computational Mathematics,01 Mathematical Sciences
98,100,pub.1058156503,10.1068/b200447,,,The Choice Alternative to School Assignment,Environment and Planning B Urban Analytics and City Science,,,1993,1993,20,4,447-457,Closed,Article,"Church, R L; Schoepfle, O B",,"Church, R L (University of California, Santa Barbara); Schoepfle, O B (Boston University)",12,3,,,,https://app.dimensions.ai/details/publication/pub.1058156503,1201 Architecture; 1203 Design Practice and Management; 12 Built Environment and Design; 1205 Urban and Regional Planning,1201 Architecture,1203 Design Practice and Management,12 Built Environment and Design,1205 Urban and Regional Planning,
99,100,pub.1011431431,10.1016/0098-3004(92)90023-k,,,An interface for exploring spatial alternatives for a corridor location problem,Computers & Geosciences,,,1992-09,1992,18,8,1095-1105,Closed,Article,"Church, Richard L.; Loban, Scott R.; Lombard, Kristi",,"Church, Richard L. (University of California, Santa Barbara); Loban, Scott R. (University of California, Santa Barbara); Lombard, Kristi (University of California, Santa Barbara)",27,1,,,,https://app.dimensions.ai/details/publication/pub.1011431431,08 Information and Computing Sciences; 0806 Information Systems,08 Information and Computing Sciences,0806 Information Systems,,,
100,100,pub.1053653031,10.1111/j.1435-5597.1992.tb01843.x,,,THE FIXED CHARGE MAXIMAL COVERING LOCATION PROBLEM,Papers in Regional Science,,,1992-07,1992,71,3,199-215,Closed,Article,"Church, Richard L.; Davis, Rhonda R.",,"Church, Richard L. (University of California, Santa Barbara); Davis, Rhonda R. (University of California, Santa Barbara)",1,0,,,,https://app.dimensions.ai/details/publication/pub.1053653031,12 Built Environment and Design; 14 Economics; 16 Studies in Human Society; 1604 Human Geography; 1402 Applied Economics; 1205 Urban and Regional Planning,12 Built Environment and Design,14 Economics,16 Studies in Human Society,1604 Human Geography,1402 Applied Economics
101,100,pub.1049116079,10.1007/bf01434264,,,The fixed charge maximal covering location problem,Papers in Regional Science,,,1992-07,1992,71,3,199-215,Closed,Article,"Church, Richard L.; Davis, Rhonda R.",,"Church, Richard L. (University of California, Santa Barbara); Davis, Rhonda R. (University of California, Santa Barbara)",7,1,,,,https://app.dimensions.ai/details/publication/pub.1049116079,12 Built Environment and Design; 14 Economics; 16 Studies in Human Society; 1604 Human Geography; 1402 Applied Economics; 1205 Urban and Regional Planning,12 Built Environment and Design,14 Economics,16 Studies in Human Society,1604 Human Geography,1402 Applied Economics
102,100,pub.1014485762,10.1080/03155986.1991.11732159,,,The Nested Hierarchical Median Facility Location Model,INFOR Information Systems and Operational Research,,,1991-05,1991,29,2,100-102,Closed,Article,"Weaver, Jerry R.; Church, Richard L.",,"Weaver, Jerry R. (University of Alabama, Tuscaloosa); Church, Richard L. (University of California, Santa Barbara)",18,0,,,,https://app.dimensions.ai/details/publication/pub.1014485762,08 Information and Computing Sciences; 0806 Information Systems,08 Information and Computing Sciences,0806 Information Systems,,,
103,100,pub.1029605911,10.1007/bf01463441,,,Thep-median scheduling and location problem,Papers in Regional Science,,,1991-01,1991,70,1,21-35,Closed,Article,"Bloxham, Craig A.; Church, Richard L.",,"Bloxham, Craig A. (University of California, Santa Barbara); Church, Richard L. (University of California, Santa Barbara)",0,0,,,,https://app.dimensions.ai/details/publication/pub.1029605911,1402 Applied Economics; 14 Economics,1402 Applied Economics,14 Economics,,,
104,100,pub.1029413930,10.1016/0038-0121(91)90017-l,,,A new network representation of a “classic” school districting problem,Socio-Economic Planning Sciences,,,1991-01,1991,25,3,189-197,Closed,Article,"Schoepfle, O.Benjamin; Church, Richard L.",,"Schoepfle, O.Benjamin (Boston University); Church, Richard L. (University of California, Santa Barbara)",22,4,,,,https://app.dimensions.ai/details/publication/pub.1029413930,0102 Applied Mathematics; 01 Mathematical Sciences; 12 Built Environment and Design; 1205 Urban and Regional Planning,0102 Applied Mathematics,01 Mathematical Sciences,12 Built Environment and Design,1205 Urban and Regional Planning,
105,100,pub.1020341084,10.1111/j.1435-5597.1991.tb01717.x,,,THE p‐MEDIAN SCHEDULING AND LOCATION PROBLEM,Papers in Regional Science,,,1991-01,1991,70,1,21-35,Closed,Article,"Bloxham, Craig A.; Church, Richard L.",,"Bloxham, Craig A. (University of California, Santa Barbara); Church, Richard L. (University of California, Santa Barbara)",0,0,,,,https://app.dimensions.ai/details/publication/pub.1020341084,1402 Applied Economics; 14 Economics,1402 Applied Economics,14 Economics,,,
106,100,pub.1014919906,10.1111/j.1540-5915.1991.tb01260.x,,,A Bicriterion Maximal Covering Location Formulation Which Considers the Satisfaction of Uncovered Demand,Decision Sciences,,,1991-01,1991,22,1,38-52,Closed,Article,"Church, Richard; Current, John; Storbeck, James",,"Church, Richard (University of California, Santa Barbara); Current, John (The Ohio State University); Storbeck, James (The Ohio State University)",23,2,,,,https://app.dimensions.ai/details/publication/pub.1014919906,"15 Commerce, Management, Tourism and Services; 1505 Marketing; 1504 Commercial Services; 1503 Business and Management","15 Commerce, Management, Tourism and Services",1505 Marketing,1504 Commercial Services,1503 Business and Management,
107,100,pub.1009022676,10.1111/j.1538-4632.1990.tb00198.x,,,Unpacking Central Place Geometry I: Single Level Theoretical k Systems,Geographical Analysis,,,1990-04,1990,22,2,95-115,All OA; Gold,Article,"Church, Richard L.; Bell, Thomas L.",,"Church, Richard L. (University of California, Santa Barbara); Bell, Thomas L. (University of Tennessee at Knoxville)",5,1,,,https://onlinelibrary.wiley.com/doi/pdf/10.1111/j.1538-4632.1990.tb00198.x,https://app.dimensions.ai/details/publication/pub.1009022676,09 Engineering; 16 Studies in Human Society; 0909 Geomatic Engineering; 0406 Physical Geography and Environmental Geoscience; 1604 Human Geography; 04 Earth Sciences,09 Engineering,16 Studies in Human Society,0909 Geomatic Engineering,0406 Physical Geography and Environmental Geoscience,1604 Human Geography
108,100,pub.1005723420,10.1016/0305-0548(90)90053-a,,,A heuristic for a hybrid fleet model,Computers & Operations Research,,,1990-01,1990,17,5,481-494,Closed,Article,"Bianchi, Geoffrey; Church, Richard L.",,"Bianchi, Geoffrey (University of California, Santa Barbara); Church, Richard L. (University of California, Santa Barbara)",1,0,,,,https://app.dimensions.ai/details/publication/pub.1005723420,0103 Numerical and Computational Mathematics; 01 Mathematical Sciences,0103 Numerical and Computational Mathematics,01 Mathematical Sciences,,,
109,200,pub.1009347751,10.1007/bf01908605,,,Book reviews,Journal of Classification,,,1989-12,1989,6,1,279-306,Closed,Article,"Weinberg, Sharon L.; Bryant, Peter G.; Milligan, Glenn W.; Church, Richard; Gordon, A. D.; Brossier, Gildas; Escofier, Brigitte; Carley, Kathleen M.; Critchle, Frank",,"Weinberg, Sharon L. (); Bryant, Peter G. (University of Colorado Denver); Milligan, Glenn W. (The Ohio State University); Church, Richard (University of California, Santa Barbara); Gordon, A. D. (University of St Andrews); Brossier, Gildas (); Escofier, Brigitte (Institute for Research in IT and Random Systems); Carley, Kathleen M. (Carnegie Mellon University); Critchle, Frank (University of Warwick)",0,0,,,,https://app.dimensions.ai/details/publication/pub.1009347751,"01 Mathematical Sciences; 15 Commerce, Management, Tourism and Services",01 Mathematical Sciences,"15 Commerce, Management, Tourism and Services",,,
110,200,pub.1070008713,10.2307/2583139,,,"A Fast, Network-Based, Hybrid Heuristic for the Assignment of Students to Schools",Journal of the Operational Research Society,,,1989-11,1989,40,11,1029,Closed,Article,"Schoepfle, O. Benjamin; Church, Richard L.",,"Schoepfle, O. Benjamin (); Church, Richard L. ()",0,0,,,,https://app.dimensions.ai/details/publication/pub.1070008713,"08 Information and Computing Sciences; 01 Mathematical Sciences; 15 Commerce, Management, Tourism and Services",08 Information and Computing Sciences,01 Mathematical Sciences,"15 Commerce, Management, Tourism and Services",,
111,100,pub.1033422646,10.1057/jors.1989.176,,,"A Fast, Network-based, Hybrid Heuristic for the Assignment of Students to Schools",Journal of the Operational Research Society,,,1989-11,1989,40,11,1029-1040,Closed,Article,"Schoepfle, O. Benjamin; Church, Richard L.",,"Schoepfle, O. Benjamin (Boston University); Church, Richard L. (University of California, Santa Barbara)",16,2,,,,https://app.dimensions.ai/details/publication/pub.1033422646,08 Information and Computing Sciences; 0802 Computation Theory and Mathematics,08 Information and Computing Sciences,0802 Computation Theory and Mathematics,,,
