,"""About the data: Exported on Nov 01, 2019. Criteria: Researcher is Phillip B Gans. © 2019 Digital Science and Research Solutions Inc. All rights reserved. Unless otherwise agreed, redistribution / external use of this work is not permitted.""
",Unnamed: 1,Unnamed: 2,Unnamed: 3,Unnamed: 4,Unnamed: 5,Unnamed: 6,Unnamed: 7,Unnamed: 8,Unnamed: 9,Unnamed: 10,Unnamed: 11,Unnamed: 12,Unnamed: 13,Unnamed: 14,Unnamed: 15,Unnamed: 16,Unnamed: 17,Unnamed: 18,Unnamed: 19,Unnamed: 20,Unnamed: 21,Unnamed: 22,Unnamed: 23,Unnamed: 24,Unnamed: 25,Unnamed: 26,Unnamed: 27,Unnamed: 28,Unnamed: 29,Unnamed: 30
0,Rank,Publication ID,DOI,PMID,PMCID,Title,Source title,Anthology title,MeSH terms,Publication Date,PubYear,Volume,Issue,Pagination,Open Access,Publication Type,Authors,Corresponding Author,Authors Affiliations,Times cited,Recent citations,RCR,FCR,Source Linkout,Dimensions URL,FOR (ANZSRC) Categories,FOR 1,FOR 2,FOR 3,FOR 4,FOR 5
1,200,pub.1112546592,10.1130/ges01698e.1,,,ERRATUM: Stratigraphy and geochronology of the Nacientes del Teno and Río Damas Formations: Insights into Middle to Late Jurassic Andean volcanism,Geosphere,,,2019-03-11,2019,,,,All OA; Gold,Article,"Junkin, William D.; Gans, Phillip B.",,"Junkin, William D. (); Gans, Phillip B. ()",0,0,,,https://pubs.geoscienceworld.org/gsa/geosphere/article-pdf/15/2/605/4670023/605.pdf,https://app.dimensions.ai/details/publication/pub.1112546592,0403 Geology; 04 Earth Sciences; 0404 Geophysics; 0402 Geochemistry,0403 Geology,04 Earth Sciences,0404 Geophysics,0402 Geochemistry,
2,100,pub.1111329635,10.1130/ges01698.1,,,Stratigraphy and geochronology of the Nacientes del Teno and Río Damas Formations: Insights into Middle to Late Jurassic Andean volcanism,Geosphere,,,2019-03-05,2019,,,,All OA; Gold,Article,"Junkin, William D.; Gans, Phillip B.",,"Junkin, William D. (University of California, Santa Barbara); Gans, Phillip B. (University of California, Santa Barbara)",0,0,,,https://doi.org/10.1130/ges01698.1,https://app.dimensions.ai/details/publication/pub.1111329635,04 Earth Sciences; 0403 Geology,04 Earth Sciences,0403 Geology,,,
3,100,pub.1105556348,10.1130/b31998.1,,,"Late Cretaceous to Miocene volcanism, sedimentation, and upper-crustal faulting and folding in the Principal Cordillera, central Chile: Field and geochronological evidence for protracted arc volcanism and transpressive deformation",Geological Society of America Bulletin,,,2018-07-12,2018,,,,Closed,Article,"Mosolf, Jesse G.; Gans, Phillip B.; Wyss, Andre R.; Cottle, John M.; Flynn, John J.",,"Mosolf, Jesse G. (University of California, Santa Barbara; Montana Tech of the University of Montana); Gans, Phillip B. (University of California, Santa Barbara); Wyss, Andre R. (University of California, Santa Barbara); Cottle, John M. (University of California, Santa Barbara); Flynn, John J. (American Museum of Natural History)",4,4,,,,https://app.dimensions.ai/details/publication/pub.1105556348,04 Earth Sciences; 0403 Geology,04 Earth Sciences,0403 Geology,,,
4,200,pub.1112258175,10.5962/bhl.title.156684,,,"Chlorocyon phantasma, a late Eocene borhyaenoid (Mammalia, Metatheria, Sparassodonta) from the Los Helados locality, Andean Main Range, central Chile /",,,,2018,2018,,,,All OA; Gold,Monograph,"Engelman, Russell K.; Croft, Darin A.; Flynn, John J.; Gans, Phillip B.; Wyss, André R",,"Engelman, Russell K. (); Croft, Darin A. (); Flynn, John J. (); Gans, Phillip B. (); Wyss, André R ()",0,0,,,https://doi.org/10.5962/bhl.title.156684,https://app.dimensions.ai/details/publication/pub.1112258175,,,,,,
5,200,pub.1104690206,10.1130/abs/2018rm-314196,,,LARAMIDE MAGMATISM AND EXTENSIONAL EXHUMATION RECORDED IN MIOCENE METAMORPHIC CORE COMPLEXES IN WEST-CENTRAL ARIZONA,Abstracts with programs (Geological Society of America),,,2018,2018,,,,Closed,Proceeding,"Singleton, John S.; Wong, Martin S.; Strickland, Evan D.; Prior, Michael G.; Wrobel, Alexander J.; Pollard, Brittney M.; Stockli, Daniel F.; Gans, Phillip B.; Seymour, Nikki M.",,"Singleton, John S. (); Wong, Martin S. (); Strickland, Evan D. (); Prior, Michael G. (); Wrobel, Alexander J. (); Pollard, Brittney M. (); Stockli, Daniel F. (); Gans, Phillip B. (); Seymour, Nikki M. ()",0,0,,,,https://app.dimensions.ai/details/publication/pub.1104690206,,,,,,
6,200,pub.1095874877,10.1130/abs/2017cd-292651,,,INSIGHTS INTO MIDDLE-LATE JURASSIC ANDEAN BACKARC VOLCANISM--GEOLOGY AND GEOCHRONOLOGY OF THE NACIENTES DEL TENO FORMATION (35°10'S),Abstracts with programs (Geological Society of America),,,2017,2017,,,,Closed,Proceeding,"Junkin, William; Gans, Phillip B.",,"Junkin, William (); Gans, Phillip B. ()",0,0,,,,https://app.dimensions.ai/details/publication/pub.1095874877,,,,,,
7,200,pub.1095874444,10.1130/abs/2017cd-293072,,,"EXPLORING THE GEOCHEMICAL CHARACTER OF VOLCANISM IN THE WHIPPLE MOUNTAINS REGION, CA AND AZ; DID CRUSTAL MELTING PLAY A ROLE IN THE EXTENSIONAL COLLAPSE OF THE COLORADO RIVER EXTENSIONAL CORRIDOR?",Abstracts with programs (Geological Society of America),,,2017,2017,,,,Closed,Proceeding,"Fidler, Mary Kate; Gans, Phillip B.",,"Fidler, Mary Kate (); Gans, Phillip B. ()",0,0,,,,https://app.dimensions.ai/details/publication/pub.1095874444,,,,,,
8,200,pub.1095874175,10.1130/abs/2017cd-292942,,,"CHARACTERIZING PRE-MIOCENE LOWER PLATE STRUCTURES OF THE NORTHERN SNAKE RANGE METAMORPHIC CORE COMPLEX, EASTERN NEVADA: INSIGHTS INTO THE ROLE OF TECTONIC HEREDITY IN METAMORPHIC CORE COMPLEX EVOLUTION",Abstracts with programs (Geological Society of America),,,2017,2017,,,,Closed,Proceeding,"Wrobel, Alexander J.; Gans, Phillip B.",,"Wrobel, Alexander J. (); Gans, Phillip B. ()",0,0,,,,https://app.dimensions.ai/details/publication/pub.1095874175,,,,,,
9,100,pub.1000910835,10.1002/2016tc004215,,,"Dike emplacement, footwall rotation, and the transition from magmatic to tectonic extension in the Whipple Mountains metamorphic core complex, southeastern California",Tectonics,,,2016-11,2016,35,11,2564-2608,Closed,Article,"Gans, Phillip B.; Gentry, Beau J.",,"Gans, Phillip B. (University of California, Santa Barbara); Gentry, Beau J. (University of California, Santa Barbara)",8,7,,2.14,,https://app.dimensions.ai/details/publication/pub.1000910835,04 Earth Sciences; 0403 Geology,04 Earth Sciences,0403 Geology,,,
10,200,pub.1108096262,10.1130/abs/2016am-286435,,,"GEOLOGIC MAP OF THE WESTERN WHIPPLE MOUNTAINS AND EASTERN MOPAH RANGE, SOUTHEAST CALIFORNIA: UNRAVELING THE ERUPTIVE AND STRUCTURAL HISTORY OF A SYNEXTENSIONAL MIOCENE VOLCANIC PROVINCE",Abstracts with programs (Geological Society of America),,,2016,2016,,,,Closed,Proceeding,"Fidler, Mary Kate; Gans, Phillip B.; Gentry, Beau; Lackey, Jade Star",,"Fidler, Mary Kate (); Gans, Phillip B. (); Gentry, Beau (); Lackey, Jade Star ()",0,0,,,,https://app.dimensions.ai/details/publication/pub.1108096262,,,,,,
11,100,pub.1005552191,10.1002/2013tc003517,,,"Timing, rate, and magnitude of slip on the Buckskin‐Rawhide detachment fault, west central Arizona",Tectonics,,,2014-08,2014,33,8,1596-1615,All OA; Gold,Article,"Singleton, John S.; Stockli, Daniel F.; Gans, Phillip B.; Prior, Michael G.",,"Singleton, John S. (George Mason University; The University of Texas at Austin); Stockli, Daniel F. (The University of Texas at Austin); Gans, Phillip B. (University of California, Santa Barbara); Prior, Michael G. (The University of Texas at Austin)",18,12,,3.04,http://onlinelibrary.wiley.com/doi/10.1002/2013TC003517/pdf,https://app.dimensions.ai/details/publication/pub.1005552191,04 Earth Sciences; 0403 Geology,04 Earth Sciences,0403 Geology,,,
12,100,pub.1019941680,10.1002/2014tc003598,,,"Eocene and Oligocene basins and ridges of the Coral Sea‐New Caledonia region: Tectonic link between Melanesia, Fiji, and Zealandia",Tectonics,,,2014-07,2014,33,7,1386-1407,All OA; Gold,Article,"Mortimer, Nick; Gans, Phillip B.; Palin, J. Michael; Herzer, Richard H.; Pelletier, Bernard; Monzier, Michel",,"Mortimer, Nick (GNS Science); Gans, Phillip B. (University of California, Santa Barbara); Palin, J. Michael (University of Otago); Herzer, Richard H. (GNS Science); Pelletier, Bernard (Institute of Research for the Development); Monzier, Michel (Institute of Research for the Development)",11,8,,1.85,http://onlinelibrary.wiley.com/doi/10.1002/2014TC003598/pdf,https://app.dimensions.ai/details/publication/pub.1019941680,04 Earth Sciences; 0403 Geology,04 Earth Sciences,0403 Geology,,,
13,100,pub.1041187126,10.1016/j.tecto.2013.06.030,,,"Crustal exhumation of the Western Gneiss Region UHP terrane, Norway: 40Ar/39Ar thermochronology and fault-slip analysis",Tectonophysics,,,2013-11,2013,608,Tectonophysics 285 1998,1159-1179,Closed,Article,"Walsh, Emily O.; Hacker, Bradley R.; Gans, Phillip B.; Wong, Martin S.; Andersen, Torgeir B.","Walsh, Emily O.","Walsh, Emily O. (University of California, Santa Barbara; Cornell College); Hacker, Bradley R. (University of California, Santa Barbara); Gans, Phillip B. (University of California, Santa Barbara); Wong, Martin S. (University of California, Santa Barbara; Colgate University); Andersen, Torgeir B. ()",16,6,,2.44,,https://app.dimensions.ai/details/publication/pub.1041187126,04 Earth Sciences; 0403 Geology,04 Earth Sciences,0403 Geology,,,
14,100,pub.1043767022,10.1002/ggge.20199,,,Revised and updated paleomagnetic results from Costa Rica,Geochemistry Geophysics Geosystems,,,2013-09,2013,14,9,3379-3388,All OA; Gold,Article,"Cromwell, G.; Constable, C. G.; Staudigel, H.; Tauxe, L.; Gans, P.",,"Cromwell, G. (University of California, San Diego); Constable, C. G. (Scripps Institution of Oceanography); Staudigel, H. (Scripps Institution of Oceanography); Tauxe, L. (); Gans, P. (University of California, Santa Barbara)",8,3,,1.22,https://agupubs.onlinelibrary.wiley.com/doi/pdf/10.1002/ggge.20199,https://app.dimensions.ai/details/publication/pub.1043767022,04 Earth Sciences; 0403 Geology,04 Earth Sciences,0403 Geology,,,
15,100,pub.1008124707,10.1206/3737.2,,,"New Leontiniid Notoungulata (Mammalia) from Chile and Argentina: Comparative Anatomy, Character Analysis, and Phylogenetic Hypotheses",American Museum Novitates,,,2012-02,2012,2012,3737,1-64,"All OA; Green, Accepted & Submitted",Article,"Shockey, Bruce J.; Flynn, John J.; Croft, Darin A.; Gans, Phillip; Wyss, André R.",,"Shockey, Bruce J. (Manhattan College); Flynn, John J. (); Croft, Darin A. (Case Western Reserve University); Gans, Phillip (University of California, Santa Barbara); Wyss, André R. (University of California, Santa Barbara)",18,8,,15.91,http://digitallibrary.amnh.org/bitstream/2246/6161/1/N3737.pdf,https://app.dimensions.ai/details/publication/pub.1008124707,2102 Curatorial and Related Studies; 21 History and Archaeology,2102 Curatorial and Related Studies,21 History and Archaeology,,,
16,200,pub.1014406273,10.1144/0016-76492010-075,,,Structure and 40Ar/39Ar thermochronology of an ultrahigh-pressure transition in western Norway,Journal of the Geological Society,,,2011-07,2011,168,4,887-898,Closed,Article,"Young, D.J.; Hacker, B.R.; Andersen, T.B.; Gans, P.B.",,"Young, D.J. (); Hacker, B.R. (); Andersen, T.B. (); Gans, P.B. ()",18,3,,2.56,,https://app.dimensions.ai/details/publication/pub.1014406273,0403 Geology; 04 Earth Sciences; 0404 Geophysics,0403 Geology,04 Earth Sciences,0404 Geophysics,,
17,100,pub.1036444942,10.1029/2009jb007032,,,"The 40Ar/39Ar thermochronology of core complexes and other basement rocks in Sonora, Mexico: Implications for Cenozoic tectonic evolution of northwestern Mexico",Journal of Geophysical Research,,,2010,2010,115,B7,,All OA; Gold,Article,"Wong, Martin S.; Gans, Phillip B.; Scheier, Jeremy",,"Wong, Martin S. (Colgate University); Gans, Phillip B. (University of California, Santa Barbara); Scheier, Jeremy (Colgate University)",12,2,,1.25,https://agupubs.onlinelibrary.wiley.com/doi/pdf/10.1029/2009JB007032,https://app.dimensions.ai/details/publication/pub.1036444942,04 Earth Sciences; 0403 Geology,04 Earth Sciences,0403 Geology,,,
18,100,pub.1038842039,10.1206/662.1,,,"Paleontology and Geochronology of the Deseadan (late Oligocene) of Moquegua, Per",American Museum Novitates,,,2009-11-30,2009,3668,,1-24,"All OA; Green, Accepted & Submitted",Article,"Shockey, Bruce J.; Gismondi, Rodolfo Salas; Gans, Phillip; Jeong, Annie; Flynn, John J.",,"Shockey, Bruce J. (); Gismondi, Rodolfo Salas (); Gans, Phillip (); Jeong, Annie (); Flynn, John J. ()",20,4,,15.99,http://digitallibrary.amnh.org/bitstream/2246/6027/1/N3668.pdf,https://app.dimensions.ai/details/publication/pub.1038842039,2102 Curatorial and Related Studies; 21 History and Archaeology,2102 Curatorial and Related Studies,21 History and Archaeology,,,
19,100,pub.1036118768,10.1016/j.jvolgeores.2009.06.014,,,"Perils of petrotectonic modeling: A view from southern Sonora, Mexico",Journal of Volcanology and Geothermal Research,,,2009-10,2009,186,3-4,160-168,"All OA; Green, Published",Article,"Till, Christy B.; Gans, Phillip B.; Spera, Frank J.; MacMillan, Ian; Blair, Karen D.","Till, Christy B.","Till, Christy B. (University of California, Santa Barbara); Gans, Phillip B. (University of California, Santa Barbara); Spera, Frank J. (University of California, Santa Barbara); MacMillan, Ian (University of California, Santa Barbara); Blair, Karen D. (University of California, Santa Barbara)",11,2,,1.47,"http://magma.geol.ucsb.edu/papers/Till_et_al.,Sonora,2009.pdf",https://app.dimensions.ai/details/publication/pub.1036118768,04 Earth Sciences; 0403 Geology; 0402 Geochemistry,04 Earth Sciences,0403 Geology,0402 Geochemistry,,
20,100,pub.1035375858,10.1111/j.1365-246x.2008.04024.x,,,Late Cenozoic volcanism and rates of active faulting in eastern Iran,Geophysical Journal International,,,2009-05,2009,177,2,783-805,All OA; Gold,Article,"Walker, R. T.; Gans, P.; Allen, M. B.; Jackson, J.; Khatib, M.; Marsh, N.; Zarrinkoub, M.",,"Walker, R. T. (University of Oxford); Gans, P. (University of California System); Allen, M. B. (Durham University); Jackson, J. (); Khatib, M. (University of Birjand); Marsh, N. (University of Leicester); Zarrinkoub, M. (University of Birjand)",59,6,,10.8,https://academic.oup.com/gji/article-pdf/177/2/783/5931576/177-2-783.pdf,https://app.dimensions.ai/details/publication/pub.1035375858,04 Earth Sciences; 0403 Geology,04 Earth Sciences,0403 Geology,,,
21,100,pub.1051404886,10.1016/j.jvolgeores.2008.09.003,,,"A middle-late Quaternary age for the adakitic arc volcanics of Hautere (Solander Island), Southern Ocean",Journal of Volcanology and Geothermal Research,,,2008-12,2008,178,4,701-707,Closed,Article,"Mortimer, N.; Gans, P.B.; Mildenhall, D.C.","Mortimer, N.","Mortimer, N. (GNS Science); Gans, P.B. (University of California System); Mildenhall, D.C. (GNS Science)",7,1,,0.69,,https://app.dimensions.ai/details/publication/pub.1051404886,04 Earth Sciences; 0403 Geology,04 Earth Sciences,0403 Geology,,,
22,100,pub.1030982400,10.1016/j.jsames.2008.05.006,,,"Chronologic implications of new Miocene mammals from the Cura-Mallín and Trapa Trapa formations, Laguna del Laja area, south central Chile",Journal of South American Earth Sciences,,,2008-12,2008,26,4,412-423,"All OA; Green, Accepted & Submitted",Article,"Flynn, John J.; Charrier, Reynaldo; Croft, Darin A.; Gans, Phillip B.; Herriott, Trystan M.; Wertheim, Jill A.; Wyss, André R.","Flynn, John J.","Flynn, John J. (American Museum of Natural History); Charrier, Reynaldo (University of Chile); Croft, Darin A. (Case Western Reserve University); Gans, Phillip B. (University of California, Santa Barbara); Herriott, Trystan M. (University of California, Santa Barbara); Wertheim, Jill A. (University of California, Santa Barbara); Wyss, André R. (University of California, Santa Barbara)",35,9,,3.45,http://repositorio.uchile.cl/bitstream/2250/125201/1/Flynn_John.pdf,https://app.dimensions.ai/details/publication/pub.1030982400,04 Earth Sciences; 0403 Geology,04 Earth Sciences,0403 Geology,,,
23,100,pub.1015418655,10.1029/2007tc002173,,,"Geologic, structural, and thermochronologic constraints on the tectonic evolution of the Sierra Mazatán core complex, Sonora, Mexico: New insights into metamorphic core complex formation",Tectonics,,,2008-08,2008,27,4,n/a-n/a,All OA; Gold,Article,"Wong, Martin S.; Gans, Phillip B.",,"Wong, Martin S. (Colgate University); Gans, Phillip B. (University of California, Santa Barbara)",42,4,,4.14,https://agupubs.onlinelibrary.wiley.com/doi/pdf/10.1029/2007TC002173,https://app.dimensions.ai/details/publication/pub.1015418655,04 Earth Sciences; 0403 Geology,04 Earth Sciences,0403 Geology,,,
24,100,pub.1048303070,10.1130/b25849.1,,,Carson Pass–Kirkwood paleocanyon system: Paleogeography of the ancestral Cascades arc and implications for landscape evolution of the Sierra Nevada (California),Geological Society of America Bulletin,,,2008-03-01,2008,120,3-4,274-299,Closed,Article,"Busby, C.J.; DeOreo, S.B.; Skilling, I.; Gans, P.B.; Hagan, J.C.",,"Busby, C.J. (University of California, Santa Barbara); DeOreo, S.B. (University of California, Santa Barbara); Skilling, I. (University of Pittsburgh); Gans, P.B. (University of California, Santa Barbara); Hagan, J.C. (University of California, Santa Barbara)",35,1,,3.45,,https://app.dimensions.ai/details/publication/pub.1048303070,04 Earth Sciences; 0403 Geology,04 Earth Sciences,0403 Geology,,,
25,200,pub.1088799027,10.1130/2008.2438(12),,,The ancestral Cascades arc: Cenozoic evolution of the central Sierra Nevada (California) and the birth of the new plate boundary,,"Special Paper 438: Ophiolites, Arcs, and Batholiths: A Tribute to Cliff Hopson",,2008,2008,438,,331-378,Closed,Chapter,"Busby, Cathy J.; Hagan, Jeanette C.; Putirka, Keith; Pluhar, Christopher J.; Gans, Phillip B.; Wagner, David L.; Rood, Dylan; DeOreo, Steve B.; Skilling, Ian",,"Busby, Cathy J. (); Hagan, Jeanette C. (); Putirka, Keith (); Pluhar, Christopher J. (); Gans, Phillip B. (); Wagner, David L. (); Rood, Dylan (); DeOreo, Steve B. (); Skilling, Ian ()",32,4,,,,https://app.dimensions.ai/details/publication/pub.1088799027,,,,,,
26,200,pub.1088799018,10.1130/2008.2438(20),,,"A mantle plume beneath California? The mid-Miocene Lovejoy flood basalt, northern California",,"Special Paper 438: Ophiolites, Arcs, and Batholiths: A Tribute to Cliff Hopson",,2008,2008,438,,551-572,Closed,Chapter,"Garrison, Noah J.; Busby, Cathy J.; Gans, Phillip B.; Putirka, Keith; Wagner, David L.",,"Garrison, Noah J. (); Busby, Cathy J. (); Gans, Phillip B. (); Putirka, Keith (); Wagner, David L. ()",13,2,,,,https://app.dimensions.ai/details/publication/pub.1088799018,,,,,,
27,100,pub.1062734824,10.1130/ges00143.1,,,"Structural and stratigraphic evolution of the Calico Mountains: Implications for early Miocene extension and Neogene transpression in the central Mojave Desert, California",Geosphere,,,2008,2008,4,3,459-479,All OA; Gold,Article,"Singleton, John S.; Gans, Phillip B.",,"Singleton, John S. (University of California, Santa Barbara); Gans, Phillip B. (University of California, Santa Barbara)",2,0,,0.2,https://pubs.geoscienceworld.org/gsa/geosphere/article-pdf/4/3/459/3337602/i1553-040X-4-3-459.pdf,https://app.dimensions.ai/details/publication/pub.1062734824,04 Earth Sciences; 0403 Geology,04 Earth Sciences,0403 Geology,,,
28,100,pub.1000213714,10.1130/b25817.1,,,"Protolith ages and exhumation histories of (ultra)high-pressure rocks across the Western Gneiss Region, Norway",Geological Society of America Bulletin,,,2007-03-01,2007,119,3-4,289-301,Closed,Article,"Walsh, Emily O.; Hacker, Bradley R.; Gans, Phillip B.; Grove, Marty; Gehrels, George",,"Walsh, Emily O. (University of California, Santa Barbara); Hacker, Bradley R. (University of California, Santa Barbara); Gans, Phillip B. (University of California, Santa Barbara); Grove, Marty (University of California Los Angeles); Gehrels, George (University of Arizona)",50,8,,5.19,,https://app.dimensions.ai/details/publication/pub.1000213714,04 Earth Sciences; 0403 Geology,04 Earth Sciences,0403 Geology,,,
29,100,pub.1038628386,10.1007/s00445-006-0053-x,,,"The 322 ka Tiribí Tuff: stratigraphy, geochronology and mechanisms of deposition of the largest and most recent ignimbrite in the Valle Central, Costa Rica",Bulletin of Volcanology,,,2006-07,2006,69,1,25-40,Closed,Article,"Pérez, Wendy; Alvarado, Guillermo E.; Gans, Phillip B.","Pérez, Wendy","Pérez, Wendy (Kiel University; University of Costa Rica); Alvarado, Guillermo E. (University of Costa Rica); Gans, Phillip B. (University of California, Santa Barbara)",17,5,,2,,https://app.dimensions.ai/details/publication/pub.1038628386,04 Earth Sciences; 0403 Geology,04 Earth Sciences,0403 Geology,,,
30,100,pub.1020908954,10.1111/j.1525-1314.2005.00561.x,,,"Discrete ultrahigh‐pressure domains in the Western Gneiss Region, Norway: implications for formation and exhumation",Journal of Metamorphic Geology,,,2005-01,2005,23,1,45-61,"All OA; Green, Accepted & Submitted",Article,"ROOT, D. B.; HACKER, B. R.; GANS, P. B.; DUCEA, M. N.; EIDE, E. A.; MOSENFELDER, J. L.",,"ROOT, D. B. (University of California, Santa Barbara); HACKER, B. R. (University of California, Santa Barbara); GANS, P. B. (University of California, Santa Barbara); DUCEA, M. N. (University of Arizona); EIDE, E. A. (Norwegian Geological Survey); MOSENFELDER, J. L. (California Institute of Technology)",100,13,,9.74,http://w3.geo.arizona.edu/tectonics/Ducea/publications/rootetal.pdf,https://app.dimensions.ai/details/publication/pub.1020908954,04 Earth Sciences; 0403 Geology,04 Earth Sciences,0403 Geology,,,
31,100,pub.1006638369,10.1016/j.tecto.2004.04.014,,,Middle Miocene to present plate tectonic history of the southern Central American Volcanic Arc,Tectonophysics,,,2004-11,2004,392,1-4,325-348,Closed,Article,"MacMillan, Ian; Gans, Phillip B.; Alvarado, Guillermo","MacMillan, Ian","MacMillan, Ian (University of California, Santa Barbara); Gans, Phillip B. (University of California, Santa Barbara); Alvarado, Guillermo (University of Costa Rica)",79,9,,7.07,,https://app.dimensions.ai/details/publication/pub.1006638369,04 Earth Sciences; 0403 Geology,04 Earth Sciences,0403 Geology,,,
32,100,pub.1040947061,10.1016/j.epsl.2004.07.013,,,Silicic ignimbrites within the Costa Rican volcanic front: evidence for the formation of continental crust,Earth and Planetary Science Letters,,,2004-09,2004,226,1-2,149-159,Closed,Article,"Vogel, Thomas A.; Patino, Lina C.; Alvarado, Guillermo E.; Gans, Phillip B.","Vogel, Thomas A.","Vogel, Thomas A. (Michigan State University); Patino, Lina C. (Michigan State University); Alvarado, Guillermo E. (University of Costa Rica); Gans, Phillip B. (University of California, Santa Barbara)",54,5,,4.69,,https://app.dimensions.ai/details/publication/pub.1040947061,04 Earth Sciences; 0403 Geology; 0402 Geochemistry,04 Earth Sciences,0403 Geology,0402 Geochemistry,,
33,100,pub.1014064650,10.1029/2003gc000661,,,Paleomagnetic results from the Snake River Plain: Contribution to the time‐averaged field global database,Geochemistry Geophysics Geosystems,,,2004-08,2004,5,8,,"All OA; Green, Accepted & Submitted",Article,"Tauxe, Lisa; Luskin, Casey; Selkin, Peter; Gans, Phillip; Calvert, Andy",,"Tauxe, Lisa (Scripps Institution of Oceanography); Luskin, Casey (Scripps Institution of Oceanography); Selkin, Peter (Scripps Institution of Oceanography); Gans, Phillip (University of California, Santa Barbara); Calvert, Andy (University of California, Santa Barbara)",32,2,,2.86,https://escholarship.org/content/qt4sd5r6zm/qt4sd5r6zm.pdf?t=lnq0fu,https://app.dimensions.ai/details/publication/pub.1014064650,04 Earth Sciences; 0403 Geology,04 Earth Sciences,0403 Geology,,,
34,100,pub.1040856183,10.1029/2003gc000656,,,"Paleomagnetism and 40Ar/39Ar ages from volcanics extruded during the Matuyama and Brunhes Chrons near McMurdo Sound, Antarctica",Geochemistry Geophysics Geosystems,,,2004-06,2004,5,6,,All OA; Gold,Article,"Tauxe, Lisa; Gans, Phillip; Mankinen, Edward A.",,"Tauxe, Lisa (Scripps Institution of Oceanography); Gans, Phillip (University of California, Santa Barbara); Mankinen, Edward A. (United States Geological Survey)",30,1,,2.68,https://agupubs.onlinelibrary.wiley.com/doi/pdf/10.1029/2003GC000656,https://app.dimensions.ai/details/publication/pub.1040856183,04 Earth Sciences; 0403 Geology,04 Earth Sciences,0403 Geology,,,
35,100,pub.1053397938,10.1029/2003gl017085,,,Magnetostratigraphy of the Eldorado Mountains volcanic complex and the calibration of the early to middle Miocene polarity time scale,Geophysical Research Letters,,,2003-06,2003,30,12,,All OA; Gold,Article,"Wilson, Douglas S.; Gans, Phillip B.",,"Wilson, Douglas S. (University of California, Santa Barbara); Gans, Phillip B. (University of California, Santa Barbara)",1,0,,0.09,https://agupubs.onlinelibrary.wiley.com/doi/pdf/10.1029/2003GL017085,https://app.dimensions.ai/details/publication/pub.1053397938,04 Earth Sciences; 0403 Geology,04 Earth Sciences,0403 Geology,,,
36,100,pub.1050974729,10.1130/g19843.1,,,"Tectonic implications of early Miocene extensional unroofing of the Sierra Mazatán metamorphic core complex, Sonora, Mexico",Geology,,,2003,2003,31,11,953-956,Closed,Article,"Wong, Martin S.; Gans, Phillip B.",,"Wong, Martin S. (University of California, Santa Barbara); Gans, Phillip B. (University of California, Santa Barbara)",25,3,,2.18,,https://app.dimensions.ai/details/publication/pub.1050974729,04 Earth Sciences; 0403 Geology,04 Earth Sciences,0403 Geology,,,
