,"""About the data: Exported on Nov 01, 2019. Criteria: Researcher is Sarah E Anderson. © 2019 Digital Science and Research Solutions Inc. All rights reserved. Unless otherwise agreed, redistribution / external use of this work is not permitted.""
",Unnamed: 1,Unnamed: 2,Unnamed: 3,Unnamed: 4,Unnamed: 5,Unnamed: 6,Unnamed: 7,Unnamed: 8,Unnamed: 9,Unnamed: 10,Unnamed: 11,Unnamed: 12,Unnamed: 13,Unnamed: 14,Unnamed: 15,Unnamed: 16,Unnamed: 17,Unnamed: 18,Unnamed: 19,Unnamed: 20,Unnamed: 21,Unnamed: 22,Unnamed: 23,Unnamed: 24,Unnamed: 25,Unnamed: 26,Unnamed: 27,Unnamed: 28,Unnamed: 29,Unnamed: 30
0,Rank,Publication ID,DOI,PMID,PMCID,Title,Source title,Anthology title,MeSH terms,Publication Date,PubYear,Volume,Issue,Pagination,Open Access,Publication Type,Authors,Corresponding Author,Authors Affiliations,Times cited,Recent citations,RCR,FCR,Source Linkout,Dimensions URL,FOR (ANZSRC) Categories,FOR 1,FOR 2,FOR 3,FOR 4,FOR 5
1,100,pub.1115981373,10.1080/10871209.2019.1622055,,,Drivers of support: The case of species reintroductions with an ill-informed public,Human Dimensions of Wildlife,,,2019-09-03,2019,24,5,1-17,Closed,Article,"Hiroyasu, Elizabeth H.T.; Miljanich, Christopher P.; Anderson, Sarah E.",,"Hiroyasu, Elizabeth H.T. (University of California, Santa Barbara); Miljanich, Christopher P. (University of California System); Anderson, Sarah E. (University of California, Santa Barbara)",1,1,,,,https://app.dimensions.ai/details/publication/pub.1115981373,05 Environmental Sciences; 06 Biological Sciences,05 Environmental Sciences,06 Biological Sciences,,,
2,500,pub.1119861362,10.1371/journal.pone.0220320,31344095,PMC6657883,Economic losses or environmental gains? Framing effects on public support for environmental management,PLoS ONE,,,2019-07-25,2019,14,7,e0220320,All OA; Gold,Article,"DeGolia, Alexander H.; Hiroyasu, Elizabeth H. T.; Anderson, Sarah E.",,"DeGolia, Alexander H. (University of California, Santa Barbara); Hiroyasu, Elizabeth H. T. (University of California, Santa Barbara); Anderson, Sarah E. (University of California, Santa Barbara)",0,0,,,http://dx.doi.org/10.1371/journal.pone.0220320,https://app.dimensions.ai/details/publication/pub.1119861362,05 Environmental Sciences; 0502 Environmental Science and Management,05 Environmental Sciences,0502 Environmental Science and Management,,,
3,100,pub.1112897732,10.1111/ecin.12781,,,SALIENCE AND THE GOVERNMENT PROVISION OF PUBLIC GOODS,Economic Inquiry,,,2019-07,2019,57,3,1547-1567,"All OA; Green, Accepted & Submitted",Article,"Wibbenmeyer, Matthew; Anderson, Sarah E.; Plantinga, Andrew J.",,"Wibbenmeyer, Matthew (Resources For The Future); Anderson, Sarah E. (University of California, Santa Barbara); Plantinga, Andrew J. (University of California, Santa Barbara)",2,2,,,https://escholarship.org/content/qt6s43g37z/qt6s43g37z.pdf?t=psxmyx,https://app.dimensions.ai/details/publication/pub.1112897732,14 Economics,14 Economics,,,,
4,100,pub.1112938562,10.1111/psj.12331,,,"Policy Entrepreneurs, Legislators, and Agenda Setting: Information and Influence",Policy Studies Journal,,,2019-03-22,2019,,,,Closed,Article,"Anderson, Sarah E.; DeLeo, Rob A.; Taylor, Kristin",,"Anderson, Sarah E. (); DeLeo, Rob A. (); Taylor, Kristin ()",5,5,,,,https://app.dimensions.ai/details/publication/pub.1112938562,1605 Policy and Administration; 16 Studies in Human Society,1605 Policy and Administration,16 Studies in Human Society,,,
5,100,pub.1108063160,10.1142/s2010007819500039,,,THE CRITICAL ROLE OF MARKETS IN CLIMATE CHANGE ADAPTATION,Climate Change Economics,,,2019-02,2019,10,01,1950003,Closed,Article,"ANDERSON, SARAH E.; ANDERSON, TERRY L.; HILL, ALICE C.; KAHN, MATTHEW E.; KUNREUTHER, HOWARD; LIBECAP, GARY D.; MANTRIPRAGADA, HARI; MÉREL, PIERRE; PLANTINGA, ANDREW J.; KERRY SMITH, V.",,"ANDERSON, SARAH E. (University of California, Santa Barbara); ANDERSON, TERRY L. (Stanford University); HILL, ALICE C. (Hoover Institution); KAHN, MATTHEW E. (); KUNREUTHER, HOWARD (University of Pennsylvania); LIBECAP, GARY D. (Stanford University; University of California, Santa Barbara); MANTRIPRAGADA, HARI (University of Pittsburgh); MÉREL, PIERRE (University of California, Davis); PLANTINGA, ANDREW J. (University of California, Santa Barbara); KERRY SMITH, V. (Arizona State University)",0,0,,,,https://app.dimensions.ai/details/publication/pub.1108063160,1402 Applied Economics; 14 Economics,1402 Applied Economics,14 Economics,,,
6,100,pub.1104468771,10.1038/s41558-018-0208-8,,,The dangers of disaster-driven responses to climate change,Nature Climate Change,,,2018-08,2018,8,8,651-653,Closed,Article,"Anderson, Sarah E.; Bart, Ryan R.; Kennedy, Maureen C.; MacDonald, Andrew J.; Moritz, Max A.; Plantinga, Andrew J.; Tague, Christina L.; Wibbenmeyer, Matthew","Anderson, Sarah E.","Anderson, Sarah E. (University of California, Santa Barbara); Bart, Ryan R. (University of California, Santa Barbara; University of California, Merced); Kennedy, Maureen C. (University of Washington Tacoma); MacDonald, Andrew J. (University of California, Santa Barbara; Stanford University); Moritz, Max A. (University of California, Santa Barbara); Plantinga, Andrew J. (University of California, Santa Barbara); Tague, Christina L. (University of California, Santa Barbara); Wibbenmeyer, Matthew (University of California, Berkeley)",3,3,,,,https://app.dimensions.ai/details/publication/pub.1104468771,0406 Physical Geography and Environmental Geoscience; 04 Earth Sciences; 05 Environmental Sciences; 0502 Environmental Science and Management; 0401 Atmospheric Sciences,0406 Physical Geography and Environmental Geoscience,04 Earth Sciences,05 Environmental Sciences,0502 Environmental Science and Management,0401 Atmospheric Sciences
7,200,pub.1091987076,10.1002/bes2.1336,,,The Accuracy of Citizen Science Data: A Quantitative Review,Bulletin of the Ecological Society of America,,,2017-10,2017,98,4,278-290,All OA; Gold,Article,"Aceves‐Bueno, Eréndira; Adeleye, Adeyemi S.; Feraud, Marina; Huang, Yuxiong; Tao, Mengya; Yang, Yi; Anderson, Sarah E.",,"Aceves‐Bueno, Eréndira (University of California, Santa Barbara); Adeleye, Adeyemi S. (University of California, Santa Barbara); Feraud, Marina (University of California, Santa Barbara); Huang, Yuxiong (University of California, Santa Barbara); Tao, Mengya (University of California, Santa Barbara); Yang, Yi (University of California, Santa Barbara); Anderson, Sarah E. (University of California, Santa Barbara)",20,20,,,https://esajournals.onlinelibrary.wiley.com/doi/pdf/10.1002/bes2.1336,https://app.dimensions.ai/details/publication/pub.1091987076,,,,,,
8,100,pub.1085463423,10.1002/2016wr020136,,,Urban responses to restrictive conservation policy during drought,Water Resources Research,,,2017-05,2017,53,5,4459-4475,Closed,Article,"Palazzo, Joseph; Liu, Owen R.; Stillinger, Timbo; Song, Runsheng; Wang, Ying; Hiroyasu, Elizabeth H. T.; Zenteno, Jose; Anderson, Sarah; Tague, Christina",,"Palazzo, Joseph (University of California, Santa Barbara); Liu, Owen R. (University of California, Santa Barbara); Stillinger, Timbo (University of California, Santa Barbara); Song, Runsheng (University of California, Santa Barbara); Wang, Ying (University of California, Santa Barbara); Hiroyasu, Elizabeth H. T. (University of California, Santa Barbara); Zenteno, Jose (University of California, Santa Barbara); Anderson, Sarah (University of California, Santa Barbara); Tague, Christina (University of California, Santa Barbara)",8,7,,8.5,,https://app.dimensions.ai/details/publication/pub.1085463423,1402 Applied Economics; 14 Economics,1402 Applied Economics,14 Economics,,,
9,100,pub.1031175083,10.1111/lsq.12124,,,Legislative Institutions as a Source of Party Leaders' Influence,Legislative Studies Quarterly,,,2016-08,2016,41,3,605-631,"All OA; Green, Accepted & Submitted",Article,"Anderson, Sarah E.; Butler, Daniel M.; Harbridge, Laurel",,"Anderson, Sarah E. (University of California, Santa Barbara); Butler, Daniel M. (Washington University in St. Louis); Harbridge, Laurel (Northwestern University)",8,7,,8.53,https://escholarship.org/content/qt4c466911/qt4c466911.pdf?t=odg0at,https://app.dimensions.ai/details/publication/pub.1031175083,1606 Political Science; 16 Studies in Human Society,1606 Political Science,16 Studies in Human Society,,,
10,200,pub.1059823759,10.1093/jopart/muw002,,,Agency Structure and the Distribution of Federal Spending,Journal of Public Administration Research and Theory,,,2016-07,2016,26,3,461-474,"All OA; Green, Accepted & Submitted",Article,"Anderson, Sarah E.; Potoski, Matthew",,"Anderson, Sarah E. (); Potoski, Matthew ()",3,1,,2.65,https://escholarship.org/content/qt75g234mq/qt75g234mq.pdf?t=odg132,https://app.dimensions.ai/details/publication/pub.1059823759,1606 Political Science; 1605 Policy and Administration; 16 Studies in Human Society,1606 Political Science,1605 Policy and Administration,16 Studies in Human Society,,
11,100,pub.1049892689,10.1111/jiec.12183,,,Critical Components of Uncertainty Communication in Life Cycle Assessments of Emerging Technologies,Journal of Industrial Ecology,,,2015-06,2015,19,3,468-479,"All OA; Green, Accepted & Submitted",Article,"Gavankar, Sheetal; Anderson, Sarah; Keller, Arturo A.",,"Gavankar, Sheetal (University of California, Santa Barbara); Anderson, Sarah (); Keller, Arturo A. ()",13,7,,7.62,https://onlinelibrary.wiley.com/doi/pdf/10.1111/jiec.12202,https://app.dimensions.ai/details/publication/pub.1049892689,1605 Policy and Administration; 16 Studies in Human Society,1605 Policy and Administration,16 Studies in Human Society,,,
12,100,pub.1034584142,10.1007/s10021-015-9842-4,,,Citizen Science as an Approach for Overcoming Insufficient Monitoring and Inadequate Stakeholder Buy-in in Adaptive Management: Criteria and Evidence,Ecosystems,,,2015-04,2015,18,3,493-506,"All OA; Green, Accepted & Submitted",Article,"Aceves-Bueno, Eréndira; Adeleye, Adeyemi S.; Bradley, Darcy; Tyler Brandt, W.; Callery, Patrick; Feraud, Marina; Garner, Kendra L.; Gentry, Rebecca; Huang, Yuxiong; McCullough, Ian; Pearlman, Isaac; Sutherland, Sara A.; Wilkinson, Whitney; Yang, Yi; Zink, Trevor; Anderson, Sarah E.; Tague, Christina","Anderson, Sarah E.","Aceves-Bueno, Eréndira (University of California, Santa Barbara); Adeleye, Adeyemi S. (University of California, Santa Barbara); Bradley, Darcy (University of California, Santa Barbara); Tyler Brandt, W. (University of California, Santa Barbara); Callery, Patrick (University of California, Santa Barbara); Feraud, Marina (University of California, Santa Barbara); Garner, Kendra L. (University of California, Santa Barbara); Gentry, Rebecca (University of California, Santa Barbara); Huang, Yuxiong (University of California, Santa Barbara); McCullough, Ian (University of California, Santa Barbara); Pearlman, Isaac (University of California, Santa Barbara); Sutherland, Sara A. (University of California, Santa Barbara); Wilkinson, Whitney (University of California, Santa Barbara); Yang, Yi (University of California, Santa Barbara); Zink, Trevor (University of California, Santa Barbara); Anderson, Sarah E. (University of California, Santa Barbara); Tague, Christina (University of California, Santa Barbara)",46,27,,,http://www.escholarship.org/uc/item/2qx5z0vb,https://app.dimensions.ai/details/publication/pub.1034584142,05 Environmental Sciences; 06 Biological Sciences,05 Environmental Sciences,06 Biological Sciences,,,
13,100,pub.1021456956,10.1016/j.marpol.2014.06.007,,,An assessment of sector separation on the Gulf of Mexico recreational red snapper fishery,Marine Policy,,,2014-12,2014,50,,309-317,Closed,Article,"Doerpinghaus, J.; Hentrich, K.; Troup, M.; Stavrinaky, A.; Anderson, S.","Hentrich, K.","Doerpinghaus, J. (University of California, Santa Barbara); Hentrich, K. (University of California, Santa Barbara); Troup, M. (University of California, Santa Barbara); Stavrinaky, A. (University of California, Santa Barbara); Anderson, S. (University of California, Santa Barbara)",4,1,,2.17,,https://app.dimensions.ai/details/publication/pub.1021456956,1801 Law; 1606 Political Science; 16 Studies in Human Society; 18 Law and Legal Studies; 05 Environmental Sciences; 0502 Environmental Science and Management,1801 Law,1606 Political Science,16 Studies in Human Society,18 Law and Legal Studies,05 Environmental Sciences
14,100,pub.1042580626,10.1177/1532673x13511658,,,The Policy Consequences of Motivated Information Processing Among the Partisan Elite,American Politics Research,,,2014-07,2014,42,4,700-728,"All OA; Green, Accepted & Submitted",Article,"Anderson, Sarah E.; Harbridge, Laurel",,"Anderson, Sarah E. (University of California, Santa Barbara); Harbridge, Laurel (Northwestern University)",4,0,,0.95,https://escholarship.org/content/qt4cq2c1p1/qt4cq2c1p1.pdf?t=odg0p0,https://app.dimensions.ai/details/publication/pub.1042580626,17 Psychology and Cognitive Sciences; 1701 Psychology,17 Psychology and Cognitive Sciences,1701 Psychology,,,
15,100,pub.1013732005,10.1080/07343469.2013.852273,,,Delaying the Buck: Timing and Strategic Advantages in Executive-Legislative Bargaining over Appropriations,Congress & the Presidency,,,2014-01,2014,41,1,25-48,"All OA; Green, Accepted & Submitted",Article,"Anderson, Sarah E.; Woon, Jonathan",,"Anderson, Sarah E. (); Woon, Jonathan ()",2,0,,1.47,https://escholarship.org/content/qt1pm2b2vs/qt1pm2b2vs.pdf?t=odg0rw,https://app.dimensions.ai/details/publication/pub.1013732005,1606 Political Science; 16 Studies in Human Society,1606 Political Science,16 Studies in Human Society,,,
16,400,pub.1027671519,10.1007/s00267-013-0165-y,24065384,,Perspectives on Disconnects Between Scientific Information and Management Decisions on Post-fire Recovery in Western US,Environmental Management,,"Conservation of Natural Resources; Decision Making, Organizational; Decision Support Techniques; Fires; Government Agencies; Information Dissemination; Northwestern United States; Politics; Southwestern United States; Time Factors",2013-12,2013,52,6,1415-1426,"All OA; Green, Accepted & Submitted",Article,"Chen, Xiaoli; Emery, Nathan; Garcia, Elizabeth S.; Hanan, Erin J.; Hodges, Heather E.; Martin, Tyronne; Meyers, Matthew A.; Peavey, Lindsey E.; Peng, Hui; Santamaria, Jaime Sainz; Uyeda, Kellie A.; Anderson, Sarah E.; Tague, Christina","Anderson, Sarah E.","Chen, Xiaoli (University of California, Santa Barbara); Emery, Nathan (University of California, Santa Barbara); Garcia, Elizabeth S. (University of California, Santa Barbara); Hanan, Erin J. (University of California, Santa Barbara); Hodges, Heather E. (University of California System); Martin, Tyronne (University of California, Santa Barbara); Meyers, Matthew A. (University of California, Santa Barbara); Peavey, Lindsey E. (University of California, Santa Barbara); Peng, Hui (University of California, Santa Barbara; China Institute of Water Resources and Hydropower Research); Santamaria, Jaime Sainz (University of California, Santa Barbara); Uyeda, Kellie A. (University of California, Santa Barbara; San Diego State University); Anderson, Sarah E. (University of California, Santa Barbara); Tague, Christina (University of California, Santa Barbara)",5,1,0,0.94,https://escholarship.org/content/qt35n8t4pf/qt35n8t4pf.pdf?t=odg0uy,https://app.dimensions.ai/details/publication/pub.1027671519,05 Environmental Sciences; 0502 Environmental Science and Management,05 Environmental Sciences,0502 Environmental Science and Management,,,
17,100,pub.1047308861,10.1002/rhc3.12044,,,The Electoral Politics of Disaster Preparedness,Risk Hazards & Crisis in Public Policy,,,2013-12,2013,4,4,234-249,Closed,Article,"Sainz‐Santamaria, Jaime; Anderson, Sarah E.",,"Sainz‐Santamaria, Jaime (); Anderson, Sarah E. ()",7,5,,4.32,,https://app.dimensions.ai/details/publication/pub.1047308861,16 Studies in Human Society; 1601 Anthropology,16 Studies in Human Society,1601 Anthropology,,,
18,100,pub.1001173254,10.1002/pam.21697,,,"Technical Management in an Age of Openness: The Political, Public, and Environmental Forest Ranger",Journal of Policy Analysis and Management,,,2013-06,2013,32,3,554-573,Closed,Article,"Anderson, Sarah E.; Hodges, Heather E.; Anderson, Terry L.",,"Anderson, Sarah E. (); Hodges, Heather E. (); Anderson, Terry L. ()",8,2,,4.65,,https://app.dimensions.ai/details/publication/pub.1001173254,14 Economics; 1606 Political Science; 16 Studies in Human Society; 1605 Policy and Administration; 1402 Applied Economics,14 Economics,1606 Political Science,16 Studies in Human Society,1605 Policy and Administration,1402 Applied Economics
19,100,pub.1052711890,10.1111/j.1540-6210.2012.02627.x,,,Invitation Phone Calls Increase Attendance at Civic Meetings: Evidence from a Field Experiment,Public Administration Review,,,2013-03,2013,73,2,221-228,Closed,Article,"Hock, Scott; Anderson, Sarah; Potoski, Matthew",,"Hock, Scott (); Anderson, Sarah (University of California, Santa Barbara); Potoski, Matthew (University of California, Santa Barbara)",16,4,,7.51,,https://app.dimensions.ai/details/publication/pub.1052711890,1605 Policy and Administration; 16 Studies in Human Society,1605 Policy and Administration,16 Studies in Human Society,,,
20,100,pub.1006701634,10.1111/j.1747-1346.2012.00396.x,,,Policy Domain‐Specific Ideology: When Interest Group Scores Offer More Insight,Politics &amp Policy,,,2012-12,2012,40,6,1186-1202,"All OA; Green, Accepted & Submitted",Article,"Anderson, Sarah E.",,"Anderson, Sarah E. (University of California, Santa Barbara)",1,1,,0.53,http://fiesta.bren.ucsb.edu/~sanderson/Are We Missing Something.pdf,https://app.dimensions.ai/details/publication/pub.1006701634,1606 Political Science; 1605 Policy and Administration; 16 Studies in Human Society,1606 Political Science,1605 Policy and Administration,16 Studies in Human Society,,
21,100,pub.1036775256,10.1111/j.1939-9162.2012.00056.x,,,Political Bargaining and the Timing of Congressional Appropriations,Legislative Studies Quarterly,,,2012-11,2012,37,4,409-436,Closed,Article,"Woon, Jonathan; Anderson, Sarah",,"Woon, Jonathan (University of Pittsburgh); Anderson, Sarah (University of California, Santa Barbara)",15,5,,9.91,,https://app.dimensions.ai/details/publication/pub.1036775256,1606 Political Science; 16 Studies in Human Society,1606 Political Science,16 Studies in Human Society,,,
22,100,pub.1039534018,10.1080/09644016.2011.589579,,,Complex constituencies: intense environmentalists and representation,Environmental Politics,,,2011-07,2011,20,4,547-565,Closed,Article,"Anderson, Sarah E.",,"Anderson, Sarah E. ()",10,4,,5.87,,https://app.dimensions.ai/details/publication/pub.1039534018,1606 Political Science; 16 Studies in Human Society,1606 Political Science,16 Studies in Human Society,,,
23,100,pub.1028710655,10.1111/j.1540-6210.2010.02160.x,,,"Incrementalism in Appropriations: Small Aggregation, Big Changes",Public Administration Review,,,2010-05,2010,70,3,464-474,Closed,Article,"Anderson, Sarah; Harbridge, Laurel",,"Anderson, Sarah (University of California System); Harbridge, Laurel (Northwestern University)",12,2,,6.32,,https://app.dimensions.ai/details/publication/pub.1028710655,1606 Political Science; 16 Studies in Human Society,1606 Political Science,16 Studies in Human Society,,,
24,100,pub.1059969045,10.1093/pan/mpn015,,,"Revisiting Adjusted ADA Scores for the U.S. Congress, 1947–2007",Political Analysis,,,2009,2009,17,1,83-88,Closed,Article,"Anderson, Sarah; Habel, Philip",,"Anderson, Sarah (University of California, Santa Barbara); Habel, Philip (Southern Illinois University Carbondale)",26,6,,12.81,,https://app.dimensions.ai/details/publication/pub.1059969045,1606 Political Science; 16 Studies in Human Society,1606 Political Science,16 Studies in Human Society,,,
